,0,1,2
2CH.30.2,The king and his officials and the whole assembly in Jerusalem decided to celebrate the Passover in the second month.,Kuk’ umwami n’abaganwa biwe n’ikoraniro ryose ry’ i Yerusalemu bari bagiye inama yo kugira umusi mukuru w’ivya Pasika mu kwezi kwa kabiri.,"Le roi, ses ministres et toute la communauté avaient tenu conseil à Jérusalem et ils avaient convenu de célébrer la Pâque au second mois de l’année ."
2CH.30.3,They had not been able to celebrate it at the regular time because not enough priests had consecrated themselves and the people had not assembled in Jerusalem.,"Ntivyābashobokeye mu gihe gikwiye, kukw igitigiri c’abaherezi biyejeje cāri gito, kand’ abantu batākoraniye i Yerusalemu.","Ils n’avaient pas pu la célébrer à la date prescrite, car il n’y avait pas suffisamment de prêtres qui se soient purifiés et le peuple ne s’était pas rassemblé à Jérusalem."
2CH.30.4,The plan seemed right both to the king and to the whole assembly.,Nuk’ umwami n’iryo koraniro ryose barabishima;,Ce projet parut bon au roi et à toute l’assemblée
2CH.30.5,"They decided to send a proclamation throughout Israel, from Beersheba to Dan, calling the people to come to Jerusalem and celebrate the Passover to the Lord , the God of Israel. It had not been celebrated in large numbers according to what was written.","bashinga ko bitāngāzwa mu Bgisirayeli hose, uhereye i Berisheba ugashitsa i Dani, ngo baze i Yerusalemu ku musi mukuru wa Pasika y’Uhoraho Imana y’Abisirayeli; kuko batāri bakiza ari benshi nk’uko vyari vyarashinzwe.","et, comme beaucoup d’Israélites ne célébraient plus la Pâque selon ce qui est écrit, ils décidèrent de faire une annonce dans tout Israël depuis Beer-Sheva jusqu’à Dan pour inviter tout le monde à se rendre à Jérusalem afin de célébrer la Pâque en l’honneur de l’Eternel, le Dieu d’Israël."
2CH.30.6,"At the king’s command, couriers went throughout Israel and Judah with letters from the king and from his officials, which read: “People of Israel, return to the Lord , the God of Abraham, Isaac and Israel, that he may return to you who are left, who have escaped from the hand of the kings of Assyria.","Nukw intumwa zijana ivyete bivuye ku mwami n’abaganwa biwe, zibikwiza mu Bgisirayeli hose no mu Buyuda, zivuga nk’uk’ umwami yashinze, ziti Yemwe Bisirayeli, ni mugaruke k’Uhoraho Imana ya Aburahamu na Isaka na Isirayeli, kugira ngo na we agaruke kuri mwebge abasigaye barokotse abami b’i Ashuri.","Les coureurs s’en allèrent dans tout Israël et Juda porter les lettres signées par le roi et ses ministres. Le roi leur avait ordonné de proclamer : Israélites, revenez à l’Eternel, le Dieu d’Abraham, d’Isaac et d’Israël, et il reviendra à vous, vous, les rescapés, qui avez échappé à l’emprise du roi d’Assyrie ."
2CH.30.7,"Do not be like your parents and your fellow Israelites, who were unfaithful to the Lord , the God of their ancestors, so that he made them an object of horror, as you see.","Ngo Kandi ntimuse na ba sogokuruza banyu, cank’ abandi b’i wanyu bāgenda bacumura k’Uhoraho Imana ya ba sekuruza, bigatuma ibatanga bakagesezwa, nk’uko namwe mubibona.","N’imitez pas vos pères et vos frères qui ont été infidèles à l’Eternel, le Dieu de leurs ancêtres. C’est pour cela que Dieu a fait venir la dévastation sur leur pays comme vous le constatez."
2CH.30.8,"Do not be stiff-necked, as your ancestors were; submit to the Lord . Come to his sanctuary, which he has consecrated forever. Serve the Lord your God, so that his fierce anger will turn away from you.","Ngo None rero mweho ntimugamike amazosi nka ba sogokuruza banyu, ariko muyoboke Uhoraho, muze muze mu rusengero rwiwe yejeje gushitsa ibihe vyose, mube abasavyi b’Uhoraho Imana yanyu, kugira ng’ uburake bgiwe bg’inkazi bubaveko.","Maintenant, ne soyez donc pas rebelles comme vos ancêtres, engagez-vous solennellement envers l’Eternel, revenez à son sanctuaire qu’il a consacré pour toujours ! Servez l’Eternel, votre Dieu, pour que sa colère ardente se détourne de vous !"
2CH.30.9,"If you return to the Lord , then your fellow Israelites and your children will be shown compassion by their captors and will return to this land, for the Lord your God is gracious and compassionate. He will not turn his face from you if you return to him.”","Ngo Kuko ni mwahindukirira Uhoraho, ab’ i wanyu n’abana banyu bazotera akagongwe abābajanye ar’ inyagano, babarekure bagaruke mur’ iki gihugu; ngo Kuk’ Uhoraho Imana yanyu ar’ umunyabuntu kandi n’umunyembabazi, ntazobakūrakw inyonga ziwe ni mwamugarukako.","Si vous revenez vraiment à l’Eternel, vos compatriotes et vos fils qui ont été déportés trouveront de la compassion auprès de leurs conquérants qui les laisseront revenir dans ce pays ; car l’Eternel est plein de compassion et de grâce, et si vous revenez à lui, il ne vous rejettera pas."
2CH.30.10,"The couriers went from town to town in Ephraim and Manasseh, as far as Zebulun, but people scorned and ridiculed them.","Nukw izo ntumwa ziragenda, zihetura ibisagara vyose vyo mu gihugu c’Abefurayimu n’ic’ Abamanase, zirinda zishika no mu c’ Abazebuloni; ariko barazitwenga cane, barazishinyagurira.",Les coureurs passèrent ainsi de ville en ville dans le territoire d’Ephraïm et de Manassé. Ils poussèrent au nord jusqu’au territoire de Zabulon . Mais on se moquait d’eux et on les tournait en dérision.
2CH.30.11,"Nevertheless, some from Asher, Manasseh and Zebulun humbled themselves and went to Jerusalem.","Mugabo bamwe bo mu Basheri no mu Bamanase no mu Bazebuloni barīhanūra, baja i Yerusalemu.","Cependant, quelques membres des tribus d’Aser, de Manassé et de Zabulon s’humilièrent et se rendirent à Jérusalem."
2CH.30.12,"Also in Judah the hand of God was on the people to give them unity of mind to carry out what the king and his officials had ordered, following the word of the Lord .","Kandi n’i Buyuda ukuboko kw’ Imana kubaha guhūza umutima, bumvira ico cagezwe c’umwami n’ abaganwa kivuye kw ijambo ry’ Uhoraho.","Au pays de Juda, Dieu agit puissamment sur la population et la rendit unanime pour obéir à l’ordre du roi et des ministres qui était conforme à la parole de l’Eternel."
2CH.30.13,A very large crowd of people assembled in Jerusalem to celebrate the Festival of Unleavened Bread in the second month.,"Nuko mu kwezi kwa kabiri hakoranira abantu benshi i Yerusalemu, kugira umusi mukuru w’ imitsima itambiwe, ar’ ikoraniro rinini cane.",Un peuple nombreux afflua donc à Jérusalem pour célébrer la fête des Pains sans levain au second mois. Ils formèrent une immense assemblée.
2CH.30.14,They removed the altars in Jerusalem and cleared away the incense altars and threw them into the Kidron Valley.,"Bakūra hasi, bakūrah’ ibicaniro vyar’ i Yerusalemu, n’ibicaniro vyose vyo kwoserezakw imibavu, babita mu mugezi Kidironi.",Ils se mirent à détruire les autels qui se trouvaient dans la ville et ils firent disparaître tous les encensoirs en les jetant dans le ravin du Cédron.
2CH.30.15,They slaughtered the Passover lamb on the fourteenth day of the second month. The priests and the Levites were ashamed and consecrated themselves and brought burnt offerings to the temple of the Lord .,"Maze ku musi ugira icumi na kane wo mur’ ukwo kwezi kwa kabiri, babāga ivya Pasika; maz’ abaherezi n’Abalewi baramāramāra, baraheza barīyeza, bazana ibimazi vyo kwoswa mu ngoro y’Uhoraho.","Puis on immola les agneaux pour la Pâque le quatorzième jour du second mois. Les prêtres et les lévites, saisis de honte, s’étaient purifiés et ils offrirent des holocaustes dans le temple de l’Eternel."
2CH.30.16,Then they took up their regular positions as prescribed in the Law of Moses the man of God. The priests splashed against the altar the blood handed to them by the Levites.,"Bahagarara mu myanya yabo basanganywe, nk’uko vyashinzwe na Mose umuntu w’Imana; abo baherezi bamija amaraso, Abalewi ari bo bayabahēreje;","Chacun prit son poste attitré comme le prescrit la Loi de Moïse, homme de Dieu. Les lévites remettaient le sang des sacrifices aux prêtres qui le répandaient sur l’autel."
2CH.30.17,"Since many in the crowd had not consecrated themselves, the Levites had to kill the Passover lambs for all those who were not ceremonially clean and could not consecrate their lambs to the Lord .","kuko mur’ iryo koraniro hāri benshi batiyejeje, bituma Abalewi ari bo bagerwa kubāgira umwagazi wa Pasika umuntu wese ahumanye, kugira ngo babēreze Uhoraho.","Comme il y avait dans l’assemblée beaucoup de gens qui ne s’étaient pas purifiés rituellement, les lévites eurent à immoler les agneaux de la Pâque pour toutes ces personnes qui n’étaient pas rituellement pures et donc aptes à accomplir ce geste cultuel pour le Seigneur."
2CH.30.18,"Although most of the many people who came from Ephraim, Manasseh, Issachar and Zebulun had not purified themselves, yet they ate the Passover, contrary to what was written. But Hezekiah prayed for them, saying, “May the Lord , who is good, pardon everyone","Kukw abantu benshi cane batāri biyejeje, cane‐cane bār’ abo mu Befurayimu no mu Bamanase no mu Bisakari no mu Bazebuloni, bagapfa kurya ivya Pasika uburyo butemewe n’ivyanditswe. Kandi Hezekiya yari yābasengeye,","Beaucoup de gens, en effet, et surtout parmi ceux qui étaient venus d’Ephraïm, de Manassé, d’Issacar et de Zabulon, n’avaient pas accompli les rites de purification ; mais ils mangèrent quand même l’agneau de la Pâque, contrairement à ce qui est écrit. C’est pourquoi Ezéchias pria pour eux en ces termes : Eternel, toi qui es bon, veuille pardonner"
2CH.30.19,"who sets their heart on seeking God—the Lord , the God of their ancestors—even if they are not clean according to the rules of the sanctuary.”","at’ Uhoraho, ari we munyabuntu, n’aharire umuntu wese ashize umutima ku kurondera Imana, ari we Uhoraho Imana ya ba sekuruza, nah’ atejejwe nk’ukw ivyagezwe vy’urusengero rwera biri.","à tous ceux qui se sont efforcés de tout leur cœur de se tourner vers Dieu, l’Eternel, le Dieu de leurs ancêtres, même s’ils ne se sont pas purifiés comme cela est requis pour un acte cultuel."
2CH.30.20,And the Lord heard Hezekiah and healed the people.,"Nuk’ Uhoraho yumvira Hezekiya, atunga abantu.",L’Eternel écouta la prière d’Ezéchias et il laissa le peuple indemne.
2CH.30.21,"The Israelites who were present in Jerusalem celebrated the Festival of Unleavened Bread for seven days with great rejoicing, while the Levites and priests praised the Lord every day with resounding instruments dedicated to the Lord .","Nukw Abisirayeli bāri bakoraniye i Yerusalemu bamara imisi ndwi bari mu misi mikuru y’imitsima itambiwe bafise umunezero mwinshi; kand’ Abalewi n’abaherezi bāhimbaza Uhoraho uko bukeye, bamuririmbira n’amajwi arenga.","Ainsi les Israélites qui se trouvaient présents à Jérusalem célébrèrent la fête des Pains sans levain pendant sept jours et dans une grande joie. Chaque jour, les lévites et les prêtres chantèrent les louanges de l’Eternel en faisant retentir leurs instruments avec force en son honneur."
2CH.30.22,"Hezekiah spoke encouragingly to all the Levites, who showed good understanding of the service of the Lord . For the seven days they ate their assigned portion and offered fellowship offerings and praised the Lord , the God of their ancestors.","Hezekiya aremēsha imitima y’Abalewi bose bāgira umwete wo gukorera Uhoraho. Nukw abantu bamara iyo misi ndwi barya ivy’ iyo misi mikuru, batanga ibimazi vy’ishimwe, bakengurukira Uhoraho Imana ya ba sekuruza.","Ezéchias adressa des encouragements à tous les lévites qui avaient fait preuve de considération envers l’Eternel. Pendant les sept jours de la fête, ils mangèrent la viande des sacrifices, offrirent des sacrifices de communion, et célébrèrent l’Eternel, le Dieu de leurs ancêtres."
2CH.30.23,The whole assembly then agreed to celebrate the festival seven more days; so for another seven days they celebrated joyfully.,Maz’ ikoraniro ryose baja inama yo kwongera kumara iyindi misi mikuru ndwi; nuko bayimara banezerewe.,"Toute l’assemblée décida de prolonger la fête de sept jours, et ces sept jours supplémentaires furent célébrés dans la joie,"
2CH.30.24,"Hezekiah king of Judah provided a thousand bulls and seven thousand sheep and goats for the assembly, and the officials provided them with a thousand bulls and ten thousand sheep and goats. A great number of priests consecrated themselves.","Kuko Hezekiya umwami w’Abayuda yari yahaye iryo koraniro amamasa igihumbi n’intama ibihumbi ndwi vyo gutanga kw ibimazi, abaganwa na bo bariha amamasa igihumbi nyene, n’intama ibihumbi cumi; nukw abaherezi benshi bariyeza.","car Ezéchias, roi de Juda, avait donné pour le ravitaillement de l’assemblée mille taureaux et sept mille moutons, et les ministres avaient offert mille taureaux et dix mille moutons. De nombreux prêtres s’étaient rituellement purifiés ."
2CH.30.25,"The entire assembly of Judah rejoiced, along with the priests and Levites and all who had assembled from Israel, including the foreigners who had come from Israel and also those who resided in Judah.","Nukw iryo koraniro ryose ry’Abayuda riranezerwa, bo n’abaherezi n’ Abalewi, n’ikoraniro ryose ryavuye i Bgisirayeli, n’abari baravuye mu gihugu c’i Bgisirayeli bakaza kuba i Buyuda.","Toute l’assemblée, Judéens, prêtres et lévites, tous ceux qui étaient venus d’Israël , ainsi que les immigrés venus d’Israël ou habitant dans le royaume de Juda, tous étaient dans la joie."
2CH.30.26,"There was great joy in Jerusalem, for since the days of Solomon son of David king of Israel there had been nothing like this in Jerusalem.","Nukw i Yerusalemu haba akanyamuneza kenshi, kuk’ uhereye ku ngoma ya Salomo mwene Dawidi umwami w’Abisirayeli, hatāri harīgeze kuba ibihwanye n’ivyo i Yerusalemu.","Une grande joie régnait dans toute la ville de Jérusalem. Depuis l’époque de Salomon, fils de David, roi d’Israël, rien de semblable ne s’était produit dans la ville."
2CH.30.27,"The priests and the Levites stood to bless the people, and God heard them, for their prayer reached heaven, his holy dwelling place.","Maz’ abaherezi, ari bo Balewi, barahaguruka, bahezagira abantu; ijwi ryabo ryumvikana ku Mana, ugusenga kwabo gushika ahēra hayo ah’ iba, ari ho mw ijuru.","Finalement, les prêtres-lévites se levèrent pour bénir le peuple. Leur voix fut entendue et leur prière parvint jusqu’à sa sainte demeure dans le ciel."
2CH.31.1,"When all this had ended, the Israelites who were there went out to the towns of Judah, smashed the sacred stones and cut down the Asherah poles. They destroyed the high places and the altars throughout Judah and Benjamin and in Ephraim and Manasseh. After they had destroyed all of them, the Israelites returned to their own towns and to their own property.","Nukw ivyo vyose bishize, Abisirayeli bose bāri bakoraniye aho, baca baja mu bisagara vy’i Buyuda, bamenagura amabuye bāshinze, batemagura inkingi bāshingiye Ashera, basibanganya ibitabo vyo ku mpinga z’imisozi, basangangura n’ibicaniro vy’i Buyuda n’i Bubenyamini, bo n’i Bgefurayimu no mu bg’Abamanase, gushitsa aho babiherengetereje vyose. Abisirayeli bose barahindukira, basubira mu bisagara vyabo, umuntu wese mw ishamvu yiwe.","Lorsque toute la fête fut terminée, tous les Israélites qui se trouvaient là partirent pour les villes de Juda et brisèrent les stèles des idoles, abattirent les pieux sacrés d’Ashéra et démolirent les hauts lieux et les autels dans tout Juda et Benjamin, ainsi que dans les territoires d’Ephraïm et de Manassé, jusqu’à ce qu’il n’en reste plus. Puis tous les Israélites retournèrent dans leurs villes, chacun dans sa propriété."
2CH.31.2,"Hezekiah assigned the priests and Levites to divisions—each of them according to their duties as priests or Levites—to offer burnt offerings and fellowship offerings, to minister, to give thanks and to sing praises at the gates of the Lord ’s dwelling.","Maze Hezekiya ashinga imbu z’abaherezi n’Abalewi, nk’uko zari zisanzwe, nk’uk’ umuntu wese muri bo yar’ asanzwe akora, ar’ abo gutanga ibimazi vyoswa, ar’ abo gutanga ibimazi vy’ishimwe, ar’ abo guhēreza, ar’ abo gushima, ar’ abo guhimbaza, bahagaze ku birimba vy’urugo rw’Uhoraho.","Ezéchias rétablit l’organisation des prêtres et des lévites d’après leurs classes. Dans ces classes, il assigna à chacun sa fonction propre ; les prêtres et les lévites devaient s’occuper des holocaustes et des sacrifices de communion, du service, du chant des cantiques de louange et de remerciement aux portes de la demeure de l’Eternel."
2CH.31.3,"The king contributed from his own possessions for the morning and evening burnt offerings and for the burnt offerings on the Sabbaths, at the New Moons and at the appointed festivals as written in the Law of the Lord .","Umwami agera n’umugabane w’ivyo azotanga ku vyo atunze, ku vy’ ibimazi vyo kwoswa bizotangwa mu gitondo no ku mugoroba, n’ibimazi vyo kwoswa ku masabato, n’ivyo mu mboneko z’ukwezi, n’ivy’ imisi mikuru yashinzwe, nk’uko vyanditswe mu vyagezwe vy’Uhoraho.","Le roi réserva une part de ses biens pour les holocaustes du matin et du soir et pour ceux des sabbats, des nouvelles lunes et des autres fêtes, selon ce qui est écrit dans la Loi de l’Eternel ."
2CH.31.4,He ordered the people living in Jerusalem to give the portion due the priests and Levites so they could devote themselves to the Law of the Lord .,"Kand’ agera kw abantu bose baba i Yerusalemu batanga ivyashinzwe guhabga abaherezi n’Abalewi, kugira ngo babone kwitwaririka ivyagezwe vy’Uhoraho.","D’autre part, il ordonna à la population de Jérusalem de donner la part des prêtres et des lévites, afin qu’ils puissent se consacrer aux tâches que leur prescrit la Loi de l’Eternel ."
2CH.31.5,"As soon as the order went out, the Israelites generously gave the firstfruits of their grain, new wine, olive oil and honey and all that the fields produced. They brought a great amount, a tithe of everything.","Nukw ico cagezwe kimaze gutāngāzwa, Abisirayeli bazana vyinshi cane vy’ umushuzo w’ingano na vino n’ amavuta ya elayo n’ubūki n’ ivyeze vyose vyo mu mirima; kandi n’ikigiracumi ca vyose babizana ari vyinshi cane.","Dès que cet ordre eut été publié, les Israélites apportèrent en grandes quantités les premières récoltes de blé, de vin nouveau, d’huile, de miel et de tous les produits agricoles. Ils apportèrent aussi la dîme de tout en abondance."
2CH.31.6,"The people of Israel and Judah who lived in the towns of Judah also brought a tithe of their herds and flocks and a tithe of the holy things dedicated to the Lord their God, and they piled them in heaps.","Kand’ Abisirayeli n’Abayuda, bāba mu bisagara vy’i Buyuda, na bo bazana ikigiracumi c’inka n’intama, n’ ikigiracumi c’ibintu vyejejwe bigashikanirwa Uhoraho Imana yabo, ivyo bintu babigira ibirundo.","Les Israélites et les Judéens qui habitaient dans les villes de Juda apportèrent eux aussi la dîme du gros bétail, des moutons et des chèvres, ainsi que celle des offrandes saintes qui étaient consacrées à l’Eternel leur Dieu. On fit des tas considérables des divers produits."
2CH.31.7,They began doing this in the third month and finished in the seventh month.,"Mu kwezi kwa gatatu ni ho batanguye kurunda ivyo birundo, babirangiza mu kwezi kw’indwi.","Cette accumulation, commencée en mai-juin, ne prit fin qu’en septembre-octobre."
2CH.31.8,"When Hezekiah and his officials came and saw the heaps, they praised the Lord and blessed his people Israel.","Maze Hezekiya n’abaganwa baje, bakabona ivyo birundo, baciye bashima Uhoraho n’abantu biwe b’Abisirayeli.","Ezéchias et les ministres vinrent voir tout ce qui avait été apporté, et ils bénirent l’Eternel et son peuple d’Israël."
2CH.31.9,Hezekiah asked the priests and Levites about the heaps;,Maze Hezekiya abaza abaherezi n’Abalewi ivy’ ivyo birundo.,Ezéchias s’enquit au sujet de ces dons auprès des prêtres et des lévites.
2CH.31.10,"and Azariah the chief priest, from the family of Zadok, answered, “Since the people began to bring their contributions to the temple of the Lord , we have had enough to eat and plenty to spare, because the Lord has blessed his people, and this great amount is left over.”","Azariya umuherezi mukuru, umuntu wo mu nzu ya Sadoki, aramwishura, at’ Uhereye igihe abantu batanguriye kuzana amashikanwa mu ngoro y’Uhoraho, twagiye tubona ivyo kurya, tugahāga, tugasigaza vyinshi; kuk’ Uhoraho yahaye abantu biwe umugisha, kand’ ibisāgutse ni vyo ibi bingana birtyo.","Alors le grand-prêtre Azaria, un descendant de Tsadoq, lui répondit : Depuis que le peuple a commencé d’apporter sa contribution au temple de l’Eternel, nous avons eu de quoi manger à satiété, et il en reste énormément, car l’Eternel a béni le peuple. Ce qui est entassé ici, c’est le surplus."
2CH.31.11,"Hezekiah gave orders to prepare storerooms in the temple of the Lord , and this was done.",Maze Hezekiya araheza ababarira ko batunganya ivyumba vyo mu ngoro y’Uhoraho; nuko barabitunganya;,"Ezéchias donna l’ordre d’aménager des entrepôts dans le temple de l’Eternel. Quand ils furent prêts,"
2CH.31.12,"Then they faithfully brought in the contributions, tithes and dedicated gifts. Konaniah, a Levite, was the overseer in charge of these things, and his brother Shimei was next in rank.","babishiramw’ ayo mashikanwa n’ivyo bigiracumi, n’ivyo bintu vyagizwe inyegu, babikoze nk’uko bizigiwe; umukuru yabijejwe yari Konaniya Umulewi, agakurikirwa na murumuna we Shimeyi.","on y déposa fidèlement les contributions du peuple, les dîmes et les autres offrandes saintes. Le lévite Konania s’en vit confier la responsabilité. Il était secondé par son frère Shimeï."
2CH.31.13,"Jehiel, Azaziah, Nahath, Asahel, Jerimoth, Jozabad, Eliel, Ismakiah, Mahath and Benaiah were assistants of Konaniah and Shimei his brother. All these served by appointment of King Hezekiah and Azariah the official in charge of the temple of God.","Yehiyeli na Azaziya na Nahati, na Asaheli na Yerimoti na Yozabadi, na Eliyeli na Isimakiya na Mahati na Benaya, ni bo bār’ ababgiriza bāgabga na Konaniya na murumuna we Shimeyi, nk’uk’ umwami Hezekiya yabishinze, bo na Azariya umubgiriza w’ingoro y’Imana.","Sous leur direction, Yehiel, Azazia, Nahath, Asaël, Yerimoth, Yozabad, Eliel, Yismakia, Mahath et Benaya assuraient la supervision des opérations par décision du roi Ezéchias et d’Azaria, le surintendant du temple de Dieu."
2CH.31.14,"Kore son of Imnah the Levite, keeper of the East Gate, was in charge of the freewill offerings given to God, distributing the contributions made to the Lord and also the consecrated gifts.","Kandi Kore, mwene Imuna Umulewi, umukumirizi w’irembo ry’i burasirazuba, ni we yar’ ajejwe amashikanwa bashikaniye Imana bavyigombeye, agatanga imigabane ku mashikanwa y’Uhoraho no ku bintu vyera cane.","Le lévite Qoré, fils de Yimna, qui était gardien de la porte orientale, fut chargé de recevoir les dons volontaires faits à Dieu et de répartir les contributions apportées pour l’Eternel et les offrandes très saintes."
2CH.31.15,"Eden, Miniamin, Jeshua, Shemaiah, Amariah and Shekaniah assisted him faithfully in the towns of the priests, distributing to their fellow priests according to their divisions, old and young alike.","Mu bisagara vy’abaherezi yar’ afise abizigirwa yagaba, ni bo aba: Edeni na Minyamini na Yeshuwa na Shemaya na Amariya na Shekaniya; yabagaba mu gikorwa cabo co guha imigabane bagenzi babo, uhereye ku bakuru n’abatoya, ukw imbu zabo zagenda zikurikirana;","Il avait sous ses ordres des lévites dans les villes sacerdotales . C’étaient Eden, Minyamîn, Josué, Shemaya, Amaria et Shekania. Ils étaient chargés de distribuer consciencieusement les vivres à leurs collègues selon leurs classes, sans faire de différences entre ceux de rang important et ceux de rang moins important."
2CH.31.16,"In addition, they distributed to the males three years old or more whose names were in the genealogical records—all who would enter the temple of the Lord to perform the daily duties of their various tasks, according to their responsibilities and their divisions.","mugabo ntibayiha abaramukiwe gukora mu ngoro y’Uhoraho ku rubu rwabo, nk’ukw ibikorwa bāgerewe biri uko bukeye, ari bo nyene banditswe mu gitabo kidondora amavuka y’izinamuhungu wese, uhereye ku bamaze imyaka itatu no kuja hejuru.","Ils accordaient des parts, non seulement à tous les hommes enregistrés depuis l’âge de trois ans sur les listes du recensement sacerdotal, mais encore à tous ceux qui accomplissaient jour par jour les tâches relatives à leur service, selon leur classe, dans le temple de l’Eternel."
2CH.31.17,"And they distributed to the priests enrolled by their families in the genealogical records and likewise to the Levites twenty years old or more, according to their responsibilities and their divisions.","Abaherezi bāgenda bandikwa ukw amazu ya ba sekuruza ari; Abalewi uhereye ku bamaze imyaka mirongwibiri no kuja hejuru, bakandikwa ukw ibikorwa vyabo n’imbu zabo biri.","Les prêtres furent enregistrés d’après leurs groupes familiaux, tandis que les lévites de vingt ans et plus étaient inscrits d’après leur service et leur classe."
