,0,1,2
2CH.20.10,"“But now here are men from Ammon, Moab and Mount Seir, whose territory you would not allow Israel to invade when they came from Egypt; so they turned away from them and did not destroy them.","Nuko none, ehe rāba Abamoni n’Abanyamowabu n’abo ku musozi Seyiri, abo wari warabujije Abisirayeli ngo ntibabatere, hamwe bāva mu gihugu ca Egiputa, bagaca hirya ntibabarandure,","Eh bien, maintenant, voici que les Ammonites, les Moabites et les habitants des monts de Séir viennent nous attaquer. Quand Israël venait d’Egypte , tu ne lui as pas permis de traverser le pays de ces gens-là et il a fait un détour ; il ne les a pas détruits."
2CH.20.11,See how they are repaying us by coming to drive us out of the possession you gave us as an inheritance.,"none rāba ivyo batwishuye: baje kutwirukana mw ishamvu yawe, iyo waduhaye ngo tuyegukire.",Et voilà comment ils nous récompensent : ils viennent nous chasser de la propriété que tu nous as attribuée.
2CH.20.12,"Our God, will you not judge them? For we have no power to face this vast army that is attacking us. We do not know what to do, but our eyes are on you.”","Ewe Mana yacu, mbega none ntiwobacirakw itēka? Kukw ata nkomezi dufise zo kurwanya ico gitero kingana girtyo kije kudutera, kandi turabuze ico twokora; ariko ni wewe duhanze amaso.","Notre Dieu, n’exerceras-tu pas tes jugements sur eux ? Car nous sommes impuissants pour résister à cette immense armée qui vient nous attaquer et nous ne savons que faire, mais nous tournons nos regards vers toi."
2CH.20.13,"All the men of Judah, with their wives and children and little ones, stood there before the Lord .","Nukw Abayuda bose bahagarara ngaho imbere y’Uhoraho, bari kumwe n’utwana twabo duto‐duto, n’abagore babo, n’abana babo bakuze.","Tout Juda, femmes et enfants y compris, se tenait debout devant l’Eternel."
2CH.20.14,"Then the Spirit of the Lord came on Jahaziel son of Zechariah, the son of Benaiah, the son of Jeiel, the son of Mattaniah, a Levite and descendant of Asaph, as he stood in the assembly.","Maze Mpwemu w’Uhoraho aza kuri Yahaziyeli mwene Zekariya, Zekariya wa Benaya, Benaya wa Yeyeli, Yeyeli wa Mataniya, Umulewi, umwe wo mu ba Asafu; amuzakw aho yar’ ari hagati mur’ iryo koraniro;","Alors l’Esprit de l’Eternel vint sur Yahaziel, fils de Zacharie, descendant de Benaya, de Yeïel et de Mattania, un lévite de la lignée d’Asaph , au milieu de l’assemblée."
2CH.20.15,"He said: “Listen, King Jehoshaphat and all who live in Judah and Jerusalem! This is what the Lord says to you: ‘Do not be afraid or discouraged because of this vast army. For the battle is not yours, but God’s.","aravuga, ati Ni mutege amatwi, yemwe Bayuda mwese, namwe ababa i Yerusalemu, nawe Mwami Yehoshafati: uku ni k’Uhoraho agize: ati Nta co mutinya, canke ngo muranduke imitima kubg’ ayo masinzi y’ingabo; kukw intambara atar’ iyanyu, ariko n’iy’ Imana.","Yahaziel dit : Soyez attentifs, vous tous qui habitez Juda et Jérusalem, et toi aussi, roi Josaphat ! Voici ce que vous déclare l’Eternel : « Ne craignez rien et ne vous laissez pas effrayer devant cette immense armée, car cette guerre n’est pas votre affaire, c’est celle de Dieu."
2CH.20.16,"Tomorrow march down against them. They will be climbing up by the Pass of Ziz, and you will find them at the end of the gorge in the Desert of Jeruel.","Ejo muze mumanuke mubatege; rāba ubu bariko baradūga akadūgo k’i Sisi, muzobasanga ah’ ikiyaya giherera, aharābana n’ubugaragwa bg’i Yeruweli.","Demain matin, marchez contre eux. Ils vont gravir la montée de la Fleur. Vous les rencontrerez au bout du défilé à l’entrée du désert de Yerouel ."
2CH.20.17,"You will not have to fight this battle. Take up your positions; stand firm and see the deliverance the Lord will give you, Judah and Jerusalem. Do not be afraid; do not be discouraged. Go out to face them tomorrow, and the Lord will be with you.’ ”","Mur’ iyo ntambara ntimuzorinda kurwana, ariko muze mutonde urugamba, mwihagararire gusa, murābe agakiza Uhoraho azobakirisha, yemwe Bayuda namwe b’i Yerusalemu. Ntimuze mutinye, canke ngo muranduke imitima: ejo muze muje kubatega, kuk’ Uhoraho azoba ari kumwe namwe.","Vous n’aurez même pas à combattre ; contentez-vous de prendre position et de vous tenir là : vous verrez l’Eternel vous accorder la délivrance. Gens de Juda et de Jérusalem, ne craignez rien et ne vous laissez pas effrayer ! Demain, marchez à leur rencontre, et l’Eternel sera avec vous ! »"
2CH.20.18,"Jehoshaphat bowed down with his face to the ground, and all the people of Judah and Jerusalem fell down in worship before the Lord .","Maze Yehoshafati yunamika amaso, akubita inkoro hasi, n’ Abayuda bose n’ababa i Yerusalemu barūnama bashika hasi imbere y’Uhoraho, baramusenga.",Josaphat se prosterna le visage contre terre et tout Juda et les habitants de Jérusalem se laissèrent tomber devant l’Eternel et se prosternèrent devant lui.
2CH.20.19,"Then some Levites from the Kohathites and Korahites stood up and praised the Lord , the God of Israel, with a very loud voice.","Maz’ Abalewi bo mu ba Kohati n’abo mu ba Kora bava hasi ngo batāzīre Uhoraho Imana y’ Abisirayeli, bavuga n’ijwi rirenga cane.","Alors les lévites qehatites et qoréites se levèrent pour louer l’Eternel, le Dieu d’Israël, en chantant d’une voix très forte."
2CH.20.20,"Early in the morning they left for the Desert of Tekoa. As they set out, Jehoshaphat stood and said, “Listen to me, Judah and people of Jerusalem! Have faith in the Lord your God and you will be upheld; have faith in his prophets and you will be successful.”","Bukeye bgaho barazinduka, bafata inzira ngo baje mu bugaragwa bg’i Tekowa; bagitangura kugenda, Yehoshafati ahagarara ngaho, aravuga, ati Ni muntege amatwi, yemwe Bayuda, namwe ababa i Yerusalemu; mwizere Uhoraho Imana yanyu, mubone gushikama; mwizere n’abavugishwa na we, mubone gutsinda.","Le lendemain matin, ils se levèrent tôt, et les hommes se mirent en route pour le désert de Teqoa . Au moment du départ, Josaphat leur adressa la parole : Ecoutez-moi, hommes de Juda et habitants de Jérusalem ! Faites confiance à l’Eternel votre Dieu, et vous serez invulnérables ! Faites confiance à ses prophètes, et vous aurez la victoire !"
2CH.20.21,"After consulting the people, Jehoshaphat appointed men to sing to the Lord and to praise him for the splendor of his holiness as they went out at the head of the army, saying: “Give thanks to the Lord , for his love endures forever.”","Nukw amaze kuja inama n’ abantu, ashirahw abo kuririmbira Uhoraho no kumutāzīra, bashazishije ukwera, kugira ngo bagende bītangiye imbere y’ingabo, baririmbe, bati Ni mushime Uhoraho, kukw imbabazi ziwe zamah’ ibihe bidashira.","Il s’était concerté avec le peuple et avait placé en tête de l’armée des musiciens pour louer l’Eternel et la majesté de sa sainte personne. Ils se mirent en route devant les soldats en armes en chantant : Louez l’Eternel, car son amour ╵dure à toujours."
2CH.20.22,"As they began to sing and praise, the Lord set ambushes against the men of Ammon and Moab and Mount Seir who were invading Judah, and they were defeated.","Nuko bagitangura kuririmba no gutāzīra, Uhoraho ashirah’ abo guca igico abāri baje gutera i Buyuda, ari bo Bamoni n’ Abanyamowabu n’abāvuye ku musozi Seyiri, baca basubiranamwo.","Au moment où ils entonnèrent leurs cantiques de louange, l’Eternel plaça une embuscade contre les Ammonites, les Moabites et les habitants des monts de Séir qui venaient attaquer Juda, de sorte qu’ils furent battus."
2CH.20.23,"The Ammonites and Moabites rose up against the men from Mount Seir to destroy and annihilate them. After they finished slaughtering the men from Seir, they helped to destroy one another.","Kukw Abamoni n’ Abanyamowabu baciye bahindukirana abāvuye ku musozi Seyiri, kugira ngo babice, babageseze; nuko bamaze guherengeteza abo Banyaseyiri, bīsubiraniramw’ ubgabo, umuntu wese na mugenzi we bashirako baricana.","Les Ammonites et les Moabites se dressèrent contre les habitants des monts de Séir et les exterminèrent. Quand ils en eurent terminé avec eux, ils se jetèrent les uns sur les autres, jusqu’à s’anéantir."
2CH.20.24,"When the men of Judah came to the place that overlooks the desert and looked toward the vast army, they saw only dead bodies lying on the ground; no one had escaped.","Hanyuma Abayuda bashitse ku munara wo gushibamako wo mu bugaragwa, bagize ngo bararāba ayo masinzi y’ingabo, basanga n’imirambararo hasi, ata warushe akira n’umwe.","Lorsque les Judéens parvinrent au promontoire d’où l’on apercevait le désert, ils regardèrent du côté de leurs ennemis et ils ne virent que des cadavres jonchant le sol : il n’y avait aucun rescapé."
2CH.20.25,"So Jehoshaphat and his men went to carry off their plunder, and they found among them a great amount of equipment and clothing and also articles of value—more than they could take away. There was so much plunder that it took three days to collect it.","Maze Yehoshafati n’ingabo ziwe bagiye ngo bīsahurire isahu, bahasanga ibigenda vy’ibitayega, n’ibintu vyinshi, n’impuzu, n’utugenegene tw’ igiciro; nuko bamaze kubakoba, bibananira kubitwara kuko vyari vyinshi; bamara imisi itatu bīsahurira isahu, kuko vyar’ isinzi.","Josaphat et son armée allèrent s’emparer du butin ; ils trouvèrent en abondance toutes sortes de biens, des vêtements et des objets précieux. Ils en ramassèrent une telle quantité qu’ils ne purent tout emporter. Ils restèrent trois jours à piller le butin tant il était abondant."
2CH.20.26,"On the fourth day they assembled in the Valley of Berakah, where they praised the Lord . This is why it is called the Valley of Berakah to this day.","Ku musi ugira kane bakoranira mu kiyaya c’i Beraka, bahashimira Uhoraho; ni co catumye aho hantu hitwa Ikiyaya c’i Beraka gushitsa na bugingo n’ubu.","Le quatrième jour, ils s’assemblèrent dans la vallée de la Bénédiction où ils bénirent l’Eternel ; c’est pourquoi on a appelé cet endroit vallée de la Bénédiction, nom qu’il porte encore aujourd’hui."
2CH.20.27,"Then, led by Jehoshaphat, all the men of Judah and Jerusalem returned joyfully to Jerusalem, for the Lord had given them cause to rejoice over their enemies.","Nuko baratabaruka, Abayuda n’ab’i Yerusalemu bose, Yehoshafati abakāmagiye imbere, basubira i Yerusalemu banezerewe, kuk’ Uhoraho yabahaye kwibonera abansi babo.","Tous les hommes de Juda et de Jérusalem reprirent joyeusement le chemin de la ville, Josaphat en tête, car l’Eternel les avait remplis de joie en les délivrant de leurs ennemis."
2CH.20.28,They entered Jerusalem and went to the temple of the Lord with harps and lyres and trumpets.,"Nuko bashika i Yerusalemu bavuza amakembe n’ inanga n’inzumbete, bashika ku ngoro y’Uhoraho.","Ils arrivèrent à Jérusalem au son des luths, des lyres et des trompettes et se rendirent au temple de l’Eternel."
2CH.20.29,The fear of God came on all the surrounding kingdoms when they heard how the Lord had fought against the enemies of Israel.,"Maz’ ubgoba buvuye ku Mana bufata abami bo mu bihugu vyose, bumvise yuk’ Uhoraho yarwanije abansi b’Abisirayeli.",Tous les autres peuples furent frappés de terreur à cause de l’Eternel lorsqu’ils apprirent comment il avait combattu les ennemis d’Israël.
2CH.20.30,"And the kingdom of Jehoshaphat was at peace, for his God had given him rest on every side.","Nukw igihugu ca Yehoshafati kigira impore, kukw Imana yiwe yar’ imuhaye umutēkāno impande zose.","Dès lors, le royaume de Josaphat jouit de la tranquillité et son Dieu lui assura la paix sur toutes ses frontières."
2CH.20.31,"So Jehoshaphat reigned over Judah. He was thirty-five years old when he became king of Judah, and he reigned in Jerusalem twenty-five years. His mother’s name was Azubah daughter of Shilhi.",Uko ni ko Yehoshafati yaganje i Buyuda; aho yatangura kwima yar’ amaze imyaka mirongwitatu n’itanu; araheza amara ku ngoma imyaka mirongwibiri n’itanu i Yerusalemu. Nyina yitwa Azuba umukobga wa Shiluhi.,"Ainsi régna Josaphat sur Juda. Il était âgé de trente-cinq ans à son avènement, et il régna vingt-cinq ans à Jérusalem. Sa mère s’appelait Azouba, elle était fille de Shilhi."
2CH.20.32,He followed the ways of his father Asa and did not stray from them; he did what was right in the eyes of the Lord .,"Kandi yagendera mu ngeso za se Asa; ntiyatirimuka ngw azivemwo, ariko yagenda akora ivyo Uhoraho abona kw ari vyiza.","Il suivit l’exemple de son père Asa sans en dévier, en faisant ce que l’Eternel considère comme juste."
2CH.20.33,"The high places, however, were not removed, and the people still had not set their hearts on the God of their ancestors.",Mugabo ibitabo vyo ku mpinga z’imisozi vyo ntivyākūrwaho; kand’ abantu ntibāribgahereze imitima ku Mana ya ba sekuruza.,"Cependant, les hauts lieux ne disparurent pas : le peuple n’avait toujours pas attaché fermement son cœur au Dieu de ses ancêtres."
2CH.20.34,"The other events of Jehoshaphat’s reign, from beginning to end, are written in the annals of Jehu son of Hanani, which are recorded in the book of the kings of Israel.","Ibindi vyose vyadonzwe kuri Yehoshafati, uhereye ku ca mbere ugashitsa ku c’ imperēra, vyanditswe mu vyo Yehu mwene Hanani yadonze, vyashizwe mu gitabo c’abami b’ Abayuda.","Les autres faits et gestes de Josaphat, des premiers aux derniers, sont cités dans les Actes de Jéhu, fils de Hanani, qui ont été insérés dans le livre des rois d’Israël."
2CH.20.35,"Later, Jehoshaphat king of Judah made an alliance with Ahaziah king of Israel, whose ways were wicked.",Hanyuma y’ivyo Yehoshafati umwami w’i Buyuda yifatanya na Ahaziya umwami w’Abisirayeli; Ahaziya uwo yar’ umunyangeso mbi cane.,"Après cela, Josaphat, roi de Juda, s’allia avec Ahazia, roi d’Israël, dont la conduite n’était pas conforme à la volonté de Dieu."
2CH.20.36,"He agreed with him to construct a fleet of trading ships. After these were built at Ezion Geber,",Nukw afatanya na we kubāzisha amāto yo kuja i Tarushishi; babāzira ayo māto i Eziyoni‐geberi.,Ils se mirent ensemble pour construire des navires au long cours. Ils fabriquèrent ces navires dans le port d’Etsyôn-Guéber.
2CH.20.37,"Eliezer son of Dodavahu of Mareshah prophesied against Jehoshaphat, saying, “Because you have made an alliance with Ahaziah, the Lord will destroy what you have made.” The ships were wrecked and were not able to set sail to trade.","Maze Eliyezeri mwene Dodavahu w’i Maresha abarira Yehoshafati avugishijwe n’Imana, ati Ko wifatanije na Ahaziya, Uhoraho akwiciye ivyo wabājishije. Nukw ayo māto aramenagurika, ntiyaba akija i Tarushishi.","Alors Eliézer, fils de Dodavahou, de Marésha, adressa à Josaphat la prophétie suivante : Parce que tu t’es allié à Ahazia, l’Eternel va détruire tes réalisations. Effectivement, les navires furent brisés avant d’avoir pu atteindre Tarsis ."
2CH.21.1,Then Jehoshaphat rested with his ancestors and was buried with them in the City of David. And Jehoram his son succeeded him as king.,"Maze Yehoshafati ahamvya ba sekuruza, ahambga hamwe na bo ku murwa wa Dawidi; maz’ umuhungu wiwe Yehoramu asubira ku ngoma yiwe.","Josaphat rejoignit ses ancêtres décédés, et il fut enseveli auprès d’eux dans la Cité de David, et son fils Yoram lui succéda sur le trône."
2CH.21.2,"Jehoram’s brothers, the sons of Jehoshaphat, were Azariah, Jehiel, Zechariah, Azariahu, Michael and Shephatiah. All these were sons of Jehoshaphat king of Israel.","Kandi Yehoramu yar’ afise barumuna biwe, abahungu ba Yehoshafati, Azariya na Yehiyeli na Zekariya na Azariyahu na Mikayeli na Shefatiya; abo bose bār’ abahungu ba Yehoshafati, umwami w’Abayuda.","Yoram avait plusieurs frères : Azaria, Yehiel, Zacharie, Azaria, Michaël et Shephatia, tous fils de Josaphat, roi d’Israël."
2CH.21.3,"Their father had given them many gifts of silver and gold and articles of value, as well as fortified cities in Judah, but he had given the kingdom to Jehoram because he was his firstborn son.","Se abaraga ibiragwa bikomeye, amafeza n’amazahabu n’ibindi bintu vy’igiciro, bo n’ibisagara vy’i Buyuda bizitiriwe inzitiro z’amabuye; ariko Yehoramu aba ari we araga ubgami, kukw ari we mfura yiwe.","Leur père leur avait fait de nombreux cadeaux, de l’argent, de l’or et des objets précieux ; de plus, il leur avait confié le gouvernement de plusieurs villes fortifiées en Juda ; mais c’est à Yoram qu’il avait conféré la royauté parce qu’il était l’aîné."
2CH.21.4,"When Jehoram established himself firmly over his father’s kingdom, he put all his brothers to the sword along with some of the officials of Israel.","Maze Yehoramu asubiye ku ngoma ya se, amaze kwigira agakomeye, yicisha inkota abo barumuna biwe bose, bo n’abaganwa bamwe‐bamwe b’i Buyuda.","Dès que Yoram fut en possession du royaume de son père et qu’il eut affermi son pouvoir, il fit assassiner tous ses frères ainsi que des dirigeants d’Israël."
2CH.21.5,"Jehoram was thirty-two years old when he became king, and he reigned in Jerusalem eight years.","Kandi Yehoramu, aho yatangura kwima, yar’ amaze imyaka mirongwitatu n’ibiri; araheza amara imyaka munani i Yerusalemu ari ku ngoma.",Yoram avait trente-deux ans à son avènement et il régna huit ans à Jérusalem .
2CH.21.6,"He followed the ways of the kings of Israel, as the house of Ahab had done, for he married a daughter of Ahab. He did evil in the eyes of the Lord .","Ariko yagendera mu ngeso z’abami b’Abisirayeli, nk’ukw ab’ inzu ya Ahabu bākora, kuko yari yābiriye umukobga wa Ahabu; nukw akora ivyo Uhoraho abona kw ari bibi.","Il suivit l’exemple des rois d’Israël , agissant comme la dynastie d’Achab, car il avait épousé une fille d’Achab . Il fit ce que l’Eternel considère comme mal."
2CH.21.7,"Nevertheless, because of the covenant the Lord had made with David, the Lord was not willing to destroy the house of David. He had promised to maintain a lamp for him and his descendants forever.","Mugabo Uhoraho yanka guhonnya inzu ya Dawidi, kubg’ isezerano yari yasezeranye na Dawidi kw azomuha itara rizokwama ryaka mu ruvyaro rwiwe ibihe vyose.","Pourtant, l’Eternel ne voulut pas détruire la dynastie de David, à cause de l’alliance qu’il avait conclue avec David à qui il avait promis que ses descendants régneraient pour toujours ."
2CH.21.8,"In the time of Jehoram, Edom rebelled against Judah and set up its own king.","Ku ngoma yiwe ni ho Abanyedomu bāgararije Abayuda, biyimikira uwabo mwami.","Sous le règne de Yoram, les Edomites se révoltèrent contre la domination de Juda et se donnèrent un roi ."
2CH.21.9,"So Jehoram went there with his officers and all his chariots. The Edomites surrounded him and his chariot commanders, but he rose up and broke through by night.","Maze Yehoramu aca ajabukana n’abagabisha biwe b’ingabo n’imikogote yiwe yose y’intambara; maz’ Abanyedomu bamutaye hagati, ahenga mw ijoro, bo n’abagabisha b’imikogote yiwe, bīcīra inzira mur’ abo Banyedomu.","Alors Yoram partit avec ses officiers et tous ses chars de guerre. En pleine nuit, il tomba sur les Edomites qui l’avaient déjà encerclé et il les battit, ainsi que les chefs des chars."
2CH.21.10,"To this day Edom has been in rebellion against Judah. Libnah revolted at the same time, because Jehoram had forsaken the Lord , the God of his ancestors.","Uko ni kw Abanyedomu bīkūye ku Bayuda gushitsa na bugingo n’ ubu. Ico gihe ab’i Libuna na bo baramugarariza, bamwīkūrako, kuko yar’ aretse Uhoraho, Imana ya ba sekuruza.","Depuis lors, Edom fut en révolte contre Juda, et l’est toujours. A la même époque, Libna se révolta également contre la domination de Yoram parce qu’il avait abandonné l’Eternel, le Dieu de ses ancêtres."
2CH.21.11,He had also built high places on the hills of Judah and had caused the people of Jerusalem to prostitute themselves and had led Judah astray.,"Kandi Yehoramu ataba ibitabo ku mpinga z’imisozi y’i Buyuda, akwegera ababa i Yerusalemu ngo bahurumbire mu bumaka, azimiza Abayuda.",Il construisit même des hauts lieux sur les montagnes de Juda : il incita les habitants de Jérusalem à l’idolâtrie et entraîna les Judéens au mal.
2CH.21.12,"Jehoram received a letter from Elijah the prophet, which said: “This is what the Lord , the God of your father David, says: ‘You have not followed the ways of your father Jehoshaphat or of Asa king of Judah.","Bukeye aronka icete kivuye k’uwavugishwa n’Imana Eliya, kivuga, ng’ Uku ni k’Uhoraho, Imana ya sogokuruza Dawidi, agize: ngo K’utāgendanye ingeso nziza za so Yehoshafati, canke za Asa umwami w’ Abayuda;","C’est alors qu’une lettre du prophète Elie lui parvint. Elle disait : Voici ce que déclare l’Eternel, le Dieu de David, ton ancêtre : « Tu n’as pas suivi l’exemple de ton père Josaphat, et celui d’Asa, roi de Juda."
2CH.21.13,"But you have followed the ways of the kings of Israel, and you have led Judah and the people of Jerusalem to prostitute themselves, just as the house of Ahab did. You have also murdered your own brothers, members of your own family, men who were better than you.","ngw Arik’ ukagendana iz’ abami b’Abisirayeli, ugakwegera Abayuda n’ababa i Yerusalemu ngo bahurumbire mu bumaka, ngo Nk’ukw ab’ inzu ya Ahabu bākoze; ngo Kand’ ukica barumuna bawe, ari bo nyene b’inzu ya so bākurusha ingeso nziza;","Au contraire, tu as imité la conduite des rois d’Israël ; tu as incité les Judéens et les habitants de Jérusalem à l’idolâtrie, suivant l’exemple d’idolâtrie de la maison d’Achab. Tu es même allé jusqu’à assassiner tes frères, membres de ta famille, qui étaient meilleurs que toi."
2CH.21.14,"So now the Lord is about to strike your people, your sons, your wives and everything that is yours, with a heavy blow.","ngo Rāba Uhoraho ngw Azotēza abantu bawe ivyago bikomeye, bo n’abana bawe n’ abamikazi bawe n’ivy’ ufise vyose;","C’est pourquoi l’Eternel frappera d’un terrible fléau ton peuple, tes fils, tes femmes et tous tes biens."
2CH.21.15,"You yourself will be very ill with a lingering disease of the bowels, until the disease causes your bowels to come out.’ ”","ngo Kandi nawe uzorwara indwara ikomeye mu mara, ngo Kand’ izogenda ikura uko bukeye, gushitsa ah’ amara yawe azoruha akavyagira, akuvuye mu nda.","Quant à toi, tu seras atteint de maladies graves, et en particulier d’une maladie au ventre qui empirera de jour en jour au point de faire sortir tes intestins hors de ton ventre. »"
2CH.21.16,The Lord aroused against Jehoram the hostility of the Philistines and of the Arabs who lived near the Cushites.,Bukeye Uhoraho ahagurukiriza Yehoramu Abafilisitiya bo n’ Abarabo bahereranye n’Abanyetiyopiya;,L’Eternel excita contre Yoram l’hostilité des Philistins et des Arabes voisins des Ethiopiens.
2CH.21.17,"They attacked Judah, invaded it and carried off all the goods found in the king’s palace, together with his sons and wives. Not a son was left to him except Ahaziah, the youngest.","batera i Buyuda, barahadwēbēra, basahura ibintu vyose vyari mu ngoro y’umwami, bajana n’abahungu biwe ar’ inyagano, bo n’abamikazi biwe; ntibamusigarana umwana w’umuhungu n’umwe, atari Yehowahazi umuhererezi wiwe.","Ils attaquèrent Juda, envahirent le pays, emportèrent toutes les richesses accumulées dans le palais du roi et emmenèrent ses fils et ses femmes en captivité, de sorte qu’il ne lui resta plus qu’un fils, Yoahaz, le cadet."
2CH.21.18,"After all this, the Lord afflicted Jehoram with an incurable disease of the bowels.",Hanyuma y’ivyo vyose Uhoraho amutēza indwara mu mara idashobora kuvūrwa.,"Après tout cela, l’Eternel frappa Yoram d’une maladie intestinale incurable."
2CH.21.19,"In the course of time, at the end of the second year, his bowels came out because of the disease, and he died in great pain. His people made no funeral fire in his honor, as they had for his predecessors.","Maz’ igihe kiragera, imyaka ibiri ihise, indwara yiwe ituma amara avyagira, amuva mu nda, apfa yībōnye. Arikw abantu biwe ntibamwosereza imibavu nk’ uko bābigenza kuri ba sekuruza.","Elle empira de jour en jour, et vers la fin de la seconde année, le mal fit sortir ses intestins de son ventre, de sorte qu’il mourut dans d’atroces souffrances. Le peuple n’alluma pas de brasier en son honneur comme il l’avait fait pour ses ancêtres ."
2CH.21.20,"Jehoram was thirty-two years old when he became king, and he reigned in Jerusalem eight years. He passed away, to no one’s regret, and was buried in the City of David, but not in the tombs of the kings.","Aho yatangura kwima, yar’ amaze imyaka mirongwitatu n’ ibiri, araheza amara imyaka munani i Yerusalemu ari ku ngoma; atāmbūra ata wukimugomba. Bamuhamba ku murwa wa Dawidi, ariko si mu mva z’abandi bami.","Yoram avait trente-deux ans à son avènement et il régna huit ans à Jérusalem . Il partit sans être regretté par personne. On l’enterra dans la Cité de David, mais pas dans les tombeaux des rois."
