,0,1,2
2KI.7.17,"Now the king had put the officer on whose arm he leaned in charge of the gate, and the people trampled him in the gateway, and he died, just as the man of God had foretold when the king came down to his house.","Maze wa mugabisha umwami yagenda yegamiye, umwami amushira mw irembo kubuza ababandana; arikw abantu bamucako bamuhonyangira aho nyene mw irembo, arapfa, nk’uko wa muntu w’Imana yavuze, igihe umwami yaza ah’ ari.","Le roi avait chargé son aide de camp qui l’accompagnait de surveiller la porte de la ville, mais celui-ci fut piétiné là par la foule et il mourut, comme l’homme de Dieu l’avait annoncé au moment où le roi était venu le trouver."
2KI.7.18,"It happened as the man of God had said to the king: “About this time tomorrow, a seah of the finest flour will sell for a shekel and two seahs of barley for a shekel at the gate of Samaria.”","Birashika nk’uk’ uwo muntu w’Imana yabariye umwami, at’ Ejo nk’aya mango, kw irembo ry’i Samariya, ingero y’ifu igogōretse izogurwa shekeli imwe, kandi n’ingero zibiri za sayiri zizogurwa shekeli imwe nyene;","En effet, c’est à ce moment qu’il avait dit au roi : Demain, à cette heure, sur la place de Samarie, à la porte de la ville, on pourra acheter vingt kilos d’orge ou dix kilos de fine farine pour une pièce d’argent."
2KI.7.19,"The officer had said to the man of God, “Look, even if the Lord should open the floodgates of the heavens, could this happen?” The man of God had replied, “You will see it with your own eyes, but you will not eat any of it!”","uwo mugabisha akishura uwo muntu w’Imana, ati Mbeg’ Uhoraho naho yotobora amadirisha mw ijuru, ben’ ivyo vyoshoboka? na we akamwishura, at’ Uzobirābisha amaso, ariko ntuzobiryako.","Et l’aide de camp lui avait répliqué : Même si l’Eternel perçait des trous dans le ciel, comment pareille chose pourrait-elle se réaliser ? A quoi Elisée avait répondu : Tu le verras de tes propres yeux, mais tu n’en mangeras pas."
2KI.7.20,"And that is exactly what happened to him, for the people trampled him in the gateway, and he died.","Nuko bimushikako birtyo; abantu bamucako bamuhonyangira mw irembo, arapfa.","C’est bien en effet ce qui lui arriva : la foule le piétina à la porte de la ville, et il mourut."
2KI.8.1,"Now Elisha had said to the woman whose son he had restored to life, “Go away with your family and stay for a while wherever you can, because the Lord has decreed a famine in the land that will last seven years.”","Kandi Elisa yari yarabariye wa mugore yazurira umwana, at’ Enda genda, mwe n’abo mu rugo rwawe, urondere ah’ usuhukira, kuk’ Uhoraho arekuye inzara, kand’ izomara imyaka ndwi mu gihugu.","Elisée dit à la femme dont il avait ressuscité le fils : Mets-toi en route et va à l’étranger avec ta famille. Allez vous installer où vous pourrez, car l’Eternel a décidé d’envoyer dans ce pays une famine qui sévira durant sept ans."
2KI.8.2,The woman proceeded to do as the man of God said. She and her family went away and stayed in the land of the Philistines seven years.,"Nuk’ uwo mugore aragenda, agira nk’uk’ uwo muntu w’Imana yavuze, ajana n’abo mu rugo rwiwe, asuhukira mu gihugu c’Abafilisitiya, amaray’ imyaka ndwi.",La femme suivit le conseil de l’homme de Dieu : elle s’en alla avec sa famille et s’installa pendant sept ans dans le pays des Philistins .
2KI.8.3,At the end of the seven years she came back from the land of the Philistines and went to appeal to the king for her house and land.,"Iyo myaka ndwi ishize, uwo mugore arasuhukuruka, ava mu gihugu c’Abafilisitiya; araheza araza atakambira umwami, yitwarira urugo rwiwe n’itongo ryiwe.","A la fin de la septième année, elle en revint et se rendit chez le roi pour implorer son intervention afin qu’on lui rende sa maison et ses terres."
2KI.8.4,"The king was talking to Gehazi, the servant of the man of God, and had said, “Tell me about all the great things Elisha has done.”","Kand’ uwo mwanya umwami yarikw arabonana na Gehazi, wa musuku wa wa muntu w’Imana, amubaza, at’ Enda mbarira ibintu bikomeye Elisa yakoze vyose.","Le roi s’entretenait justement avec Guéhazi, le serviteur de l’homme de Dieu, et lui demandait : Raconte-moi donc toutes les grandes choses qu’Elisée a accomplies."
2KI.8.5,"Just as Gehazi was telling the king how Elisha had restored the dead to life, the woman whose son Elisha had brought back to life came to appeal to the king for her house and land. Gehazi said, “This is the woman, my lord the king, and this is her son whom Elisha restored to life.”","Nukw akirikw arīgānira umwami ingene yazuye uwapfuye, ako kanya nya mugore yazuriye umwana arashika; atakambira umwami yitwarira urugo rwiwe n’itongo ryiwe. Gehazi aca aravuga, ati Mwami wanje nyen’ ingoma, nguyu wa mugore navuga, nguyu na wa mwana wiwe Elisa yazura.","Or, au moment précis où il lui racontait comment Elisée avait ramené un mort à la vie, la femme dont il avait ressuscité le fils arriva auprès du roi pour implorer son intervention au sujet de sa maison et de ses terres. Alors Guéhazi s’exclama : Mon seigneur le roi, voici la femme dont je te parlais et voici son fils qu’Elisée a rendu à la vie !"
2KI.8.6,"The king asked the woman about it, and she told him. Then he assigned an official to her case and said to him, “Give back everything that belonged to her, including all the income from her land from the day she left the country until now.”","Nuk’ umwami abibaza uwo mugore, na we arabimudondera. Umwami aca amuha umushikiriza, ati Genda umushikirize ibintu vyiwe vyose, n’ivyahimbuwe vyose uhereye ku musi yahaviriye ugashitsa n’ubu.","Le roi interrogea la femme et elle lui raconta toute son histoire. Puis le roi mit à sa disposition l’un de ses chambellans auquel il dit : Fais restituer à cette femme tout ce qui lui appartient, et qu’on lui paie même une redevance pour ce que ses terres ont rapporté depuis le jour où elle a quitté le pays jusqu’à maintenant."
2KI.8.7,"Elisha went to Damascus, and Ben-Hadad king of Aram was ill. When the king was told, “The man of God has come all the way up here,”","Bukeye Elisa aja i Damasiko; ico gihe Beni‐hadadi umwami w’i Siriya yar’ arwaye; baramubarira, bati Wa muntu w’Imana yaje ar’ ino.","Une autre fois, Elisée se rendit à Damas. Ben-Hadad, le roi de Syrie, était malade. On lui annonça que l’homme de Dieu était venu jusque-là."
2KI.8.8,"he said to Hazael, “Take a gift with you and go to meet the man of God. Consult the Lord through him; ask him, ‘Will I recover from this illness?’ ”","Maz’ umwami abarira Hazayeli, at’ Enda abīra ingemu, uje guhūra n’uyo muntu w’Imana, umubarire ansigurize Uhoraho yuko nzokira iyi ndwara.","Le roi dit à Hazaël : Prends un cadeau, va trouver l’homme de Dieu et consulte l’Eternel par son intermédiaire pour savoir si je guérirai de cette maladie."
2KI.8.9,"Hazael went to meet Elisha, taking with him as a gift forty camel-loads of all the finest wares of Damascus. He went in and stood before him, and said, “Your son Ben-Hadad king of Aram has sent me to ask, ‘Will I recover from this illness?’ ”","Nuko Hazayeli aja guhūra na we atwaye ingemu zo ku vyiza‐vyiza vyose vy’i Damasiko, abiremētse ingamiya mirongwine; nukw arashika ahagarara imbere yiwe, aramubarira, at’ Umwana wawe Beni‐hadadi, umwami w’i Siriya, arantumye, ngo Mbeg’ ubona azokira iyo ndwara yiwe?","Hazaël alla trouver Elisée en emportant un présent composé des meilleurs produits de Damas , chargés sur quarante chameaux. Lorsqu’il fut arrivé auprès de lui, il se tint devant lui et dit : Ton serviteur Ben-Hadad, roi de Syrie, m’envoie vers toi pour te demander s’il sortira vivant de cette maladie."
2KI.8.10,"Elisha answered, “Go and say to him, ‘You will certainly recover.’ Nevertheless, the Lord has revealed to me that he will in fact die.”","Elisa aramwishura, ati Genda umubarire, uti Gukira uzokira; ariko rer’ Uhoraho anyeretse kw azopfa.","Elisée lui répondit : Va et dis-lui : « Oui, certainement, tu guériras de cette maladie. » Cependant, l’Eternel m’a révélé qu’il va mourir."
2KI.8.11,He stared at him with a fixed gaze until Hazael was embarrassed. Then the man of God began to weep.,"Araheza amushinga ijisho, kugeza aho Hazayeli yagiriye isoni. Uwo muntu w’Imana arahava ararira.","Puis le regard de l’homme de Dieu se figea, il fixa Hazaël avec intensité, jusqu’à ce que celui-ci rougisse de honte, puis il se mit à pleurer."
2KI.8.12,"“Why is my lord weeping?” asked Hazael. “Because I know the harm you will do to the Israelites,” he answered. “You will set fire to their fortified places, kill their young men with the sword, dash their little children to the ground, and rip open their pregnant women.”","Maze Hazayeli aramubaza, at’ Urizwa n’iki ga mugenzi? Aramwishura, ati N’uko mbona ibibi uzogirira Abisirayeli; amaboma yabo uzoyatongoza umuriro, n’abasore babo uzobicisha inkota; utuyoya twabo uzotumenagura, abagore babo bafise inda uzobafomoza.","Hazaël lui demanda : Pourquoi mon seigneur pleure-t-il ? Elisée répondit : Parce que je sais tout le mal que tu feras aux Israélites, tu incendieras leurs villes fortifiées, tu massacreras leurs jeunes gens, tu écraseras leurs petits enfants et tu fendras le ventre de leurs femmes enceintes ."
2KI.8.13,"Hazael said, “How could your servant, a mere dog, accomplish such a feat?” “The Lord has shown me that you will become king of Aram,” answered Elisha.","Hazayeli aramwishura, ati Mbega nkanje umuntu w’imbga, n’inda n’indesho, nd’ uwo gukora ibikomeye ben’ ivyo? Elisa aramwishura, at’ Uhoraho yanyeretse k’uzoba umwami w’i Siriya.","Hazaël reprit étonné : Mais qu’est donc ton serviteur, pour accomplir de pareilles choses ? Je n’ai pas plus de valeur qu’un chien. Elisée répliqua : L’Eternel m’a fait voir que tu deviendras roi de Syrie ."
2KI.8.14,"Then Hazael left Elisha and returned to his master. When Ben-Hadad asked, “What did Elisha say to you?” Hazael replied, “He told me that you would certainly recover.”","Maz’ avuye aho Elisa ari, asubira kwa shebuja; shebuja aramubaza, ati Elisa yakubgiye iki? Na we aramwishura, ati Yambgiye ng’ Uzokira nta kabuza.","Hazaël quitta Elisée et revint auprès de son souverain qui lui demanda : Que t’a dit Elisée ? Il répondit : Il m’a dit : « Oui, certainement tu guériras de cette maladie. »"
2KI.8.15,"But the next day he took a thick cloth, soaked it in water and spread it over the king’s face, so that he died. Then Hazael succeeded him as king.","Bukeye bgaho, Hazayeli yābīra uburengeti, abginika mu mazi, abumuta mu maso, aramupfunda arapfa. Hazayeli aca asubira ku ngoma yiwe.","Le lendemain Hazaël prit une couverture, la trempa dans l’eau et en recouvrit le visage du roi qui mourut. Hazaël lui succéda sur le trône."
2KI.8.16,"In the fifth year of Joram son of Ahab king of Israel, when Jehoshaphat was king of Judah, Jehoram son of Jehoshaphat began his reign as king of Judah.","Mu mwaka ugira gatanu Yoramu mwene Ahabu umwami w’Abisirayeli, ari ku ngoma, ni ho Yehoramu mwene Yehoshafati umwami w’Abayuda, yaja ku ngoma i Buyuda.","La cinquième année du règne de Yoram, fils d’Achab, roi d’Israël, tandis que Josaphat était encore roi de Juda, Yoram, son fils, devint roi de Juda."
2KI.8.17,"He was thirty-two years old when he became king, and he reigned in Jerusalem eight years.","Aho yatangura kwima, yar’ amaze imyaka mirongwitatu n’ibiri; araheza amara imyaka munani i Yerusalemu ari ku ngoma.",Il avait trente-deux ans à son avènement et il régna huit ans à Jérusalem .
2KI.8.18,"He followed the ways of the kings of Israel, as the house of Ahab had done, for he married a daughter of Ahab. He did evil in the eyes of the Lord .","Ariko yagendera mu ngeso z’abami b’ Abisirayeli, nk’ukw ab’ inzu ya Ahabu bākora, kuko yari yābiriye umukobga wa Ahabu; nukw akora ivyo Uhoraho abona kw ari bibi.","Il suivit l’exemple des rois d’Israël, agissant comme la dynastie d’Achab, car il avait épousé une fille d’Achab . Il fit ce que l’Eternel considère comme mal."
2KI.8.19,"Nevertheless, for the sake of his servant David, the Lord was not willing to destroy Judah. He had promised to maintain a lamp for David and his descendants forever.","Mugabo Uhoraho yanka guhonnya Abayuda kubga Dawidi umusavyi wiwe, nk’uko yari yaramusezeraniye kuzomuha itara rizokwama ryaka mu ruvyaro rwiwe ibihe vyose.","Pourtant, l’Eternel ne voulut pas détruire Juda, à cause de son serviteur David à qui il avait promis que ses descendants régneraient pour toujours ."
2KI.8.20,"In the time of Jehoram, Edom rebelled against Judah and set up its own king.","Ku ngoma yiwe ni ho Abanyedomu bāgararije Abayuda, biyimikira uwabo mwami.","Sous le règne de Yoram, les Edomites se révoltèrent contre la domination de Juda, et se donnèrent un roi ."
2KI.8.21,"So Jehoram went to Zair with all his chariots. The Edomites surrounded him and his chariot commanders, but he rose up and broke through by night; his army, however, fled back home.","Maze Yehoramu aca ajabukana n’imikogote yiwe yose y’intambara, afata i Zayiri; maz’ Abanyedomu bamutaye hagati, ahenga mw ijoro, bo n’abagabisha b’imikogote yiwe, bīcīra inzira mur’ abo Banyedomu; ingabo ziwe zica zirahunga zīsubirira i wabo.","Alors Yoram partit pour Tsaïr avec tous ses chars de guerre. En pleine nuit, il tomba sur les Edomites qui l’avaient déjà encerclé, et il les battit ainsi que les chefs des chars ; les soldats s’enfuirent chez eux."
2KI.8.22,To this day Edom has been in rebellion against Judah. Libnah revolted at the same time.,Uko ni kw Abanyedomu bīkūye ku Bayuda gushitsa na bugingo n’ubu. Ico gihe ab’ i Libuna na bo baramugarariza.,"Depuis lors, Edom fut en révolte contre Juda, et il l’est toujours. A la même époque, Libna se révolta également."
2KI.8.23,"As for the other events of Jehoram’s reign, and all he did, are they not written in the book of the annals of the kings of Judah?","Ibindi vyose vyadonzwe kuri Yehoramu, n’ivyo yakoze vyose, none ntivyanditswe mu gitabo c’ivyo ku ngoma z’ abami b’Abayuda?",Les autres faits et gestes de Yoram et toutes ses réalisations sont cités dans le livre des Annales des rois de Juda.
2KI.8.24,Jehoram rested with his ancestors and was buried with them in the City of David. And Ahaziah his son succeeded him as king.,"Nuko Yehoramu ahamvya ba sekuruza, ahambga hamwe na bo ku murwa wa Dawidi; maz’ umuhungu wiwe Ahaziya asubira ku ngoma yiwe.","Yoram rejoignit ses ancêtres décédés et fut enterré à leurs côtés dans la Cité de David. Ahazia, son fils, lui succéda sur le trône."
2KI.8.25,"In the twelfth year of Joram son of Ahab king of Israel, Ahaziah son of Jehoram king of Judah began to reign.","Mu mwaka ugira icumi na kabiri Yoramu mwene Ahabu umwami w’Abisirayeli ari ku ngoma, ni ho Ahaziya mwene Yehoramu umwami w’Abayuda yaja ku ngoma.","La douzième année du règne de Yoram, fils d’Achab, roi d’Israël, Ahazia, fils de Yoram, devint roi de Juda."
2KI.8.26,"Ahaziah was twenty-two years old when he became king, and he reigned in Jerusalem one year. His mother’s name was Athaliah, a granddaughter of Omri king of Israel.","Ahaziya aho yatangura kwima yar’ amaze imyaka mirongwibiri n’ibiri; araheza amara umwaka umwe i Yerusalemu ari ku ngoma. Nyina yitwa Ataliya, umwuzukuru wa Omuri umwami w’Abisirayeli.","Il était âgé de vingt-deux ans à son avènement et il régna un an à Jérusalem . Sa mère s’appelait Athalie, elle était une petite-fille d’Omri, roi d’Israël."
2KI.8.27,"He followed the ways of the house of Ahab and did evil in the eyes of the Lord , as the house of Ahab had done, for he was related by marriage to Ahab’s family.","Yagendera mu ngeso z’ab’ inzu ya Ahabu, agakora ivyo Uhoraho abona kw ari bibi, nk’ukw ab’ inzu ya Ahabu nyene bāgenda bakora; kuko yar’ afitaniye akamwe na bo.","Ahazia suivit l’exemple de la dynastie d’Achab et fit ce que l’Eternel considère comme mal, comme la famille d’Achab, car il était allié par mariage à cette famille."
2KI.8.28,Ahaziah went with Joram son of Ahab to war against Hazael king of Aram at Ramoth Gilead. The Arameans wounded Joram;,"Bukeye atabara Yoramu mwene Ahabu, baja gutera Hazayeli umwami w’i Siriya i Ramoti‐gileyadi; maz’ Abasiriya bakomeretsa Yoramu.","Il partit avec Yoram, le fils d’Achab, pour une expédition militaire contre Hazaël, roi de Syrie, à Ramoth en Galaad. Yoram fut blessé par les Syriens."
2KI.8.29,"so King Joram returned to Jezreel to recover from the wounds the Arameans had inflicted on him at Ramoth in his battle with Hazael king of Aram. Then Ahaziah son of Jehoram king of Judah went down to Jezreel to see Joram son of Ahab, because he had been wounded.","Nuk’ umwami Yoramu aratabaruka, aja i Yezireli kugira ngw arwarirey’ izo nguma yakomerekerejwe n’Abasiriya i Rama, igihe yarwanya Hazayeli umwami w’i Siriya. Bukeye Ahaziya mwene Yehoramu umwami w’i Buyuda, amanuka i Yezireli kurāba Yoramu mwene Ahabu ukw ameze, kuko yar’ arwaye.","Alors, il retourna à Jizréel pour se faire soigner des blessures que les Syriens lui avaient infligées à Rama pendant le combat contre Hazaël, roi de Syrie. Ahazia, fils de Yoram, roi de Juda, y alla pour lui rendre visite au cours de sa maladie."
2KI.9.1,"The prophet Elisha summoned a man from the company of the prophets and said to him, “Tuck your cloak into your belt, take this flask of olive oil with you and go to Ramoth Gilead.","Bukeye Elisa ūvugishwa n’ Imana ahamagara umwe mu biga ivy’ ukuvugishwa, aramubarira, at’ Ikazanure, wābīre iri cupa ry’amavuta ya elayo, uje i Ramoti‐gileyadi.",Le prophète Elisée appela l’un des disciples des prophètes et lui dit : Habille-toi pour partir. Prends cette fiole d’huile et va à Ramoth en Galaad.
2KI.9.2,"When you get there, look for Jehu son of Jehoshaphat, the son of Nimshi. Go to him, get him away from his companions and take him into an inner room.","Ni washikayo, ubaze Yehu mwene Yehoshafati, Yehoshafati mwene Nimushi; uheze winjire iy’ ari, umuhagurutse umukūre mu bandi, umujane haruguru ahīherereye;","Là tu iras voir Jéhu, fils de Josaphat et petit-fils de Nimshi. Tu l’aborderas et tu lui demanderas de laisser ses compagnons et de te suivre seul dans une pièce retirée."
2KI.9.3,"Then take the flask and pour the oil on his head and declare, ‘This is what the Lord says: I anoint you king over Israel.’ Then open the door and run; don’t delay!”","uheze usokorore iryo cupa ry’amavuta, uyamusuke ku mutwe, uvuge ut’ Uku ni k’Uhoraho agize, ngw Akwimikishije amavuta ng’ ube umwami w’Abisirayeli. Uheze wugurure urugi; ntutebagane, uce uhunga.",Tu prendras la fiole d’huile et tu en verseras le contenu sur sa tête en disant : « Voici ce que déclare l’Eternel : Je te confère l’onction pour t’établir roi d’Israël ! » Puis tu te précipiteras vers la porte et tu t’enfuiras sans attendre.
2KI.9.4,So the young prophet went to Ramoth Gilead.,Nuk’ uwo muvugishwa w’ umusore aragenda aja i Ramoti‐gileyadi.,Le jeune prophète partit donc pour Ramoth en Galaad.
2KI.9.5,"When he arrived, he found the army officers sitting together. “I have a message for you, commander,” he said. “For which of us?” asked Jehu. “For you, commander,” he replied.","Ashitseyo, asanga abagabisha b’ingabo bicaranye; aravuga, ati Yewe mugabisha, mfise ico ngutumweko. Yehu aramubaza, ati Ni nde muri twebge twese? Aramwishura, ati Ni wewe, mugenzi.","Quand il arriva, il trouva les chefs de l’armée d’Israël siégeant ensemble. Il dit : Chef, j’ai un message pour toi. Jéhu demanda : Pour lequel d’entre nous ? Il répondit : Pour toi, chef !"
2KI.9.6,"Jehu got up and went into the house. Then the prophet poured the oil on Jehu’s head and declared, “This is what the Lord , the God of Israel, says: ‘I anoint you king over the Lord ’s people Israel.","Nuko Yehu ava hasi, binjirana mu nzu; uwo musore araheza amusuka amavuta mu mutwe, aravuga, at’ Uku ni k’ Uhoraho Imana y’Abisirayeli agize, ngw Akwimikishije amavuta ng’ ube umwami w’abantu biwe b’Abisirayeli.","Jéhu se leva et entra dans la maison. Le prophète lui répandit l’huile sur la tête et lui dit : Voici ce que déclare l’Eternel, le Dieu d’Israël : « Je te confère l’onction pour t’établir roi d’Israël, le peuple de l’Eternel ."
2KI.9.7,"You are to destroy the house of Ahab your master, and I will avenge the blood of my servants the prophets and the blood of all the Lord ’s servants shed by Jezebel.","Kandi ng’ Uze wice ab’ inzu ya Ahabu shobuja, ngo Kugira ngw ahōre Yezebeli amaraso y’abasavyi biwe b’abavugishwa, n’ay’ abandi basavyi biwe bose yavishije.","Tu frapperas la maison d’Achab, ton seigneur. Ainsi, je vengerai le meurtre de mes serviteurs les prophètes et celui de tous les serviteurs de l’Eternel assassinés par Jézabel."
2KI.9.8,The whole house of Ahab will perish. I will cut off from Ahab every last male in Israel—slave or free.,"Ngo Kand’ ab’ inzu ya Ahabu bose bazogesera; kandi ngw Azoherengeteza izinamuhungu wese wo kuri we, aho bava bakagera mu Bisirayeli.","Oui, toute la famille d’Achab périra. J’en exterminerai tous les hommes, esclaves et libres, en Israël."
2KI.9.9,I will make the house of Ahab like the house of Jeroboam son of Nebat and like the house of Baasha son of Ahijah.,"Ngw Inzu ya Ahabu azoyihindura nk’iya Yerobowamu mwene Nebati, kandi nk’iya Bayasha mwene Ahiya.","Je traiterai cette maison comme j’ai traité celle de Jéroboam, fils de Nebath, et celle de Baésha, fils d’Ahiya ."
2KI.9.10,"As for Jezebel, dogs will devour her on the plot of ground at Jezreel, and no one will bury her.’ ” Then he opened the door and ran.","Ngo Kand’ imbga zizorīra Yezebeli ku musozi w’i Yezireli, ngo Kandi nta wuzomuhamba. Nukw araheza yugurura urugi, arahunga.","Quant à Jézabel, elle sera dévorée par les chiens dans le domaine de Jizréel, sans qu’il y ait personne pour l’enterrer . » Après avoir dit cela, le prophète ouvrit la porte et s’enfuit."
2KI.9.11,"When Jehu went out to his fellow officers, one of them asked him, “Is everything all right? Why did this maniac come to you?” “You know the man and the sort of things he says,” Jehu replied.","Maze Yehu arasohoka, aza aho ba bantu ba shebuja bari; umwe aramubaza, ati Mbega n’ amahoro? Uwo mugabo w’umusazi yakuronderakw iki? Arabishura, at’ Ereg’ uwo muntu ni mwebge mumuzi, n’amajambo yiwe murayazi.","Lorsque Jéhu revint auprès des autres officiers du roi, ils lui demandèrent : Est-ce que ça va ? Pourquoi cet exalté est-il venu te voir ? Jéhu leur répondit : Vous connaissez bien ce genre de personnes et leurs divagations."
2KI.9.12,"“That’s not true!” they said. “Tell us.” Jehu said, “Here is what he told me: ‘This is what the Lord says: I anoint you king over Israel.’ ”","Baramwishura, bat’ Eka s’ivy’ ukuri nta co tuzi: tubarire nyabuna ivy’ ari vyo. Arabishura, at’ Ivyo ambariye n’ ibi: ng’ Uku ni k’Uhoraho agize, ngw Anyimikishije amavuta ngo mbe umwami w’Abisirayeli.","Mais ils répliquèrent : Tu mens ! Raconte-nous donc ce qui s’est passé. – Eh bien, dit-il, voici comment il m’a parlé. Il m’a dit : « Voici ce que déclare l’Eternel : Je te confère l’onction pour t’établir roi d’Israël. »"
2KI.9.13,"They quickly took their cloaks and spread them under him on the bare steps. Then they blew the trumpet and shouted, “Jehu is king!”","Baca babaduka n’ingoga, umuntu wese yikiza umutamana wiwe, bayishira musi y’ibirenge vyiwe, ah’ ahagaze hejuru ku ngazi y’amabuye; bavuza inzamba, bati Yehu ni we mwami!","A ces mots, les officiers s’empressèrent d’étendre leurs manteaux devant lui sur les marches de l’escalier, puis ils sonnèrent du cor et se mirent à crier : Vive le roi Jéhu !"
2KI.9.14,"So Jehu son of Jehoshaphat, the son of Nimshi, conspired against Joram. (Now Joram and all Israel had been defending Ramoth Gilead against Hazael king of Aram,","Uku ni ko Yehu mwene Yehoshafati, Yehoshafati wa Nimushi, yagararije Yoramu. Kandi Yoramu n’Abisirayeli bose bari bashagaje i Ramoti‐gileyadi, bimiriye Hazayeli umwami w’i Siriya;","C’est ainsi que Jéhu, fils de Josaphat, petit-fils de Nimshi, forma une conspiration contre Yoram à l’époque où celui-ci défendait, avec tout Israël, Ramoth en Galaad contre Hazaël, roi de Syrie."
2KI.9.15,"but King Joram had returned to Jezreel to recover from the wounds the Arameans had inflicted on him in the battle with Hazael king of Aram.) Jehu said, “If you desire to make me king, don’t let anyone slip out of the city to go and tell the news in Jezreel.”","arik’ umwami Yoramu ubgiwe yari yahindukiye asubira i Yezireli, kugira ngw arwarirey’ inguma yakomerekejwe n’Abasiriya, igihe yarwanya Hazayeli umwami w’i Siriya. Nuko Yehu aravuga, ati Namb’ ari vyo mugomba, ntihagire umuntu n’umwe yomba ngw ave mu gisagara, aje kubivuga i Yezireli.","Le roi Yoram était retourné à Jizréel pour se faire soigner des blessures que lui avaient infligées les Syriens pendant le combat contre Hazaël, roi de Syrie. Jéhu dit à ses compagnons : Si vous êtes décidés à vous rallier à moi, il faut que personne ne s’échappe de la ville pour aller annoncer la chose à Jizréel."
