,0,1,2
2KI.12.14,"it was paid to the workers, who used it to repair the temple.",kuko bāyaha abākora ivyo bikorwa ngo bayakoreshe gusanura iyo ngoro.,"On n’utilisa pas les sommes apportées au Temple pour confectionner des coupes à aspersion, des couteaux, des coupes, des trompettes ou d’autres objets d’or ou d’argent ."
2KI.12.15,"They did not require an accounting from those to whom they gave the money to pay the workers, because they acted with complete honesty.","Kand’ abo bantu bāhabga ayo mahera yo guhemba abakozi, ntibārinda kuyasuzumirwa, kuko bākora ar’ abizigirwa.",On le remettait intégralement aux artisans qui faisaient le travail afin qu’ils effectuent les réparations du Temple.
2KI.12.16,The money from the guilt offerings and sin offerings was not brought into the temple of the Lord ; it belonged to the priests.,"Arikw amahera y’ibimazi vy’impongano n’ay’ ibimazi bitangirwa ivyaha, yo ntiyashirwa mu ngoro y’Uhoraho, yaba ay’ abaherezi.","D’ailleurs, on ne demandait pas de comptes aux hommes chargés de payer les ouvriers qui exécutaient l’ouvrage, car c’étaient des gens honnêtes."
2KI.12.17,About this time Hazael king of Aram went up and attacked Gath and captured it. Then he turned to attack Jerusalem.,"Bukeye Hazayeli umwami w’i Siriya aradūga, atera i Gati, ahagira ahiwe; maze yiteguye kudūga ngw atere i Yerusalemu na ho,","L’argent versé à la place d’un sacrifice de culpabilité ou d’un sacrifice pour le péché n’était pas déposé dans le coffre du Temple, il revenait aux prêtres ."
2KI.12.18,"But Joash king of Judah took all the sacred objects dedicated by his predecessors—Jehoshaphat, Jehoram and Ahaziah, the kings of Judah—and the gifts he himself had dedicated and all the gold found in the treasuries of the temple of the Lord and of the royal palace, and he sent them to Hazael king of Aram, who then withdrew from Jerusalem.","Yowasi umwami w’i Buyuda aca yābīra ivyatanzwekw inyegu vyose, ivyo ba sekuruza Yehoshafati na Yehoramu na Ahaziya abami b’Abayuda bāri bāratanze, n’ ivyo yatanzekw inyegu na we ubgiwe, n’ivy’ amazahabu vyose vyari mu bubīko bgo mu ngoro y’ Uhoraho, n’ivyari mu ngoro yiwe ubgiwe, abihongera Hazayeli umwami w’i Siriya; nuko Hazayeli arahindukira, areka Yerusalemu.","En ce temps-là , Hazaël, roi de Syrie, vint attaquer la ville de Gath et s’en empara, puis il décida de marcher sur Jérusalem."
2KI.12.19,"As for the other events of the reign of Joash, and all he did, are they not written in the book of the annals of the kings of Judah?","Nukw ibindi vyose vyadonzwe kuri Yowasi, n’ivyo yakoze vyose, none ntivyanditswe mu gitabo c’ ivyo ku ngoma z’abami b’i Buyuda?","Joas, roi de Juda, prit tous les objets consacrés, ceux que ses ancêtres Josaphat, Yoram et Ahazia, rois de Juda, avaient consacrés. Il y ajouta ceux qu’il avait lui-même consacrés et tout l’or déposé dans la chambre du trésor du temple de l’Eternel et dans le palais royal, et il fit porter le tout à Hazaël, roi de Syrie. Là-dessus, celui-ci se détourna de Jérusalem."
2KI.12.20,"His officials conspired against him and assassinated him at Beth Millo, on the road down to Silla.","Bukeye abantu bo mu banyarugo biwe baramugarariza, bamutsinda mu nzu i Milo ku nzira imanuka ija i Sila.",Les autres faits et gestes de Joas et toutes ses réalisations sont cités dans le livre des Annales des rois de Juda.
2KI.12.21,The officials who murdered him were Jozabad son of Shimeath and Jehozabad son of Shomer. He died and was buried with his ancestors in the City of David. And Amaziah his son succeeded him as king.,"Abo banyarugo biwe bāmwishe ni Yozakari umwana wa Shimeyati na Yehozabadi umwana wa Shomeri; nukw arapfa, bamuhamba hamwe na ba sekuruza ku murwa wa Dawidi; maz’ umuhungu wiwe Amaziya asubira ku ngoma yiwe.",Ses ministres se révoltèrent contre lui et fomentèrent un complot. Ils assassinèrent Joas à Beth-Millo sur la route qui descend vers Silla .
2KI.13.1,"In the twenty-third year of Joash son of Ahaziah king of Judah, Jehoahaz son of Jehu became king of Israel in Samaria, and he reigned seventeen years.","Mu mwaka ugira mirongwibiri na gatatu Yowasi mwene Ahaziya, umwami w’i Buyuda, ari ku ngoma, ni ho Yehowahazi mwene Yehu yima i Samariya mu Bisirayeli, amara imyaka cumi n’ indwi ari ku ngoma.","La vingt-troisième année du règne de Joas, fils d’Ahazia, roi de Juda, Yoahaz, fils de Jéhu, devint roi d’Israël à Samarie. Il régna dix-sept ans ."
2KI.13.2,"He did evil in the eyes of the Lord by following the sins of Jeroboam son of Nebat, which he had caused Israel to commit, and he did not turn away from them.","Akora ivyo Uhoraho abona kw ari bibi, akurikira ivyaha vya Yerobowamu mwene Nebati, ivyo yakoze akabikwegeramwo n’Abisirayeli, ntiyabivamwo.","Il fit ce que l’Eternel considère comme mal et adopta la conduite coupable de Jéroboam, fils de Nebath, qui avait entraîné Israël dans le péché . Il ne se détourna pas de cette mauvaise voie."
2KI.13.3,"So the Lord ’s anger burned against Israel, and for a long time he kept them under the power of Hazael king of Aram and Ben-Hadad his son.","Maz’ uburake bg’Uhoraho buziriringira Abisirayeli, akāma abagabura mu maboko ya Hazayeli umwami w’i Siriya, no mu ya Beni‐hadadi mwene Hazayeli nyene.","Alors l’Eternel se mit en colère contre Israël. Il livra ses habitants pendant toute cette période au pouvoir de Hazaël, roi de Syrie, et de Ben-Hadad, fils de Hazaël ."
2KI.13.4,"Then Jehoahaz sought the Lord ’s favor, and the Lord listened to him, for he saw how severely the king of Aram was oppressing Israel.","Maze Yehowahazi atakambira Uhoraho, Uhoraho aramwumvira, kuko yabonye agahahazo umwami w’i Siriya yahahaza Abisirayeli.","Mais Yoahaz supplia l’Eternel d’apaiser sa colère. L’Eternel l’exauça, car il avait vu comment le roi de Syrie opprimait Israël."
2KI.13.5,"The Lord provided a deliverer for Israel, and they escaped from the power of Aram. So the Israelites lived in their own homes as they had before.","Maz’ Uhoraho aha Abisirayeli uwo kubakiza, bituma bīgobotora mu maboko y’Abasiriya, babona gusubira kwigumira i muhira nk’uko bāhora ubga mbere.","Il envoya aux Israélites un libérateur pour les délivrer des Syriens . Dès lors, ils purent de nouveau vivre tranquilles chez eux comme autrefois."
2KI.13.6,"But they did not turn away from the sins of the house of Jeroboam, which he had caused Israel to commit; they continued in them. Also, the Asherah pole remained standing in Samaria.","Mugabo ntibāva mu vyaha vy’ab’ inzu ya Yerobowamu, ari we nyene yari yarabikwegeyemw’ Abisirayeli ngo bacumure, ariko bakomeza kubigenderamwo. Kand’ inkingi za Ashera ziguma i Samariya.",Mais ils ne se détournèrent pas pour autant des péchés dans lesquels la maison de Jéroboam les avait entraînés. Ils persistèrent dans cette voie ; le pieu sacré d’Ashéra était même dressé à Samarie .
2KI.13.7,"Nothing had been left of the army of Jehoahaz except fifty horsemen, ten chariots and ten thousand foot soldiers, for the king of Aram had destroyed the rest and made them like the dust at threshing time.","Kuk’ umwami w’i Siriya ata co yasigarije Yehowahazi mu ngabo, atar’ abagendera ku mafarasi mirongwitanu, n’imikogote cumi, n’ abagendesha amaguru ibihumbi cumi; abandi yari yarabaranduye, abahindura nk’umukungugu wo ku mbuga.","De toute l’armée du roi, il ne restait à Yoahaz que cinquante hommes d’équipage de chars, dix chars et dix « milliers » de fantassins, car le roi de Syrie avait détruit le reste et l’avait réduit à l’état de poussière que l’on piétine ."
2KI.13.8,"As for the other events of the reign of Jehoahaz, all he did and his achievements, are they not written in the book of the annals of the kings of Israel?","Ibindi vyose vyadonzwe kuri Yehowahazi, n’ivyo yakoze vyose, n’ivy’ ububasha bgiwe, none ntivyanditswe mu gitabo c’ivyo ku ngoma z’abami b’Abisirayeli?","Les autres faits et gestes de Yoahaz, toutes ses réalisations et sa vaillance sont cités dans le livre des Annales des rois d’Israël."
2KI.13.9,Jehoahaz rested with his ancestors and was buried in Samaria. And Jehoash his son succeeded him as king.,"Nuko Yehowahazi ahamvya ba sekuruza, bamuhamba i Samariya; maz’ umuhungu wiwe Yehowasi asubira ku ngoma yiwe.",Yoahaz rejoignit ses ancêtres décédés et fut enterré à Samarie. Son fils Joas lui succéda sur le trône.
2KI.13.10,"In the thirty-seventh year of Joash king of Judah, Jehoash son of Jehoahaz became king of Israel in Samaria, and he reigned sixteen years.","Mu mwaka ugira mirongwitatu n’indwi Yowasi umwami w’i Buyuda ari ku ngoma, ni ho Yehowasi mwene Yehowahazi yima i Samariya mu Bisirayeli; amara imyaka cumi n’itandatu ari ku ngoma.","La trente-septième année du règne de Joas, roi de Juda, Joas, fils de Yoahaz, devint roi d’Israël à Samarie. Il régna seize ans ."
2KI.13.11,"He did evil in the eyes of the Lord and did not turn away from any of the sins of Jeroboam son of Nebat, which he had caused Israel to commit; he continued in them.","Akora ivyo Uhoraho abona kw ari bibi; ntiyava mu vyaha vyose vya Yerobowamu mwene Nebati, ivyo yakwegeyemw’ Abisirayeli ngo bacumure; arikw abigenderamwo na we.","Il fit ce que l’Eternel considère comme mal ; il n’abandonna pas les péchés dans lesquels Jéroboam, fils de Nebath, avait entraîné Israël, il persista dans cette voie."
2KI.13.12,"As for the other events of the reign of Jehoash, all he did and his achievements, including his war against Amaziah king of Judah, are they not written in the book of the annals of the kings of Israel?","Ibindi vyose vyadonzwe kuri Yehowasi, n’ivyo yakoze vyose, n’ ivy’ ubuhizi yar’ afise arwana na Amaziya umwami w’i Buyuda, none ntivyanditswe mu gitabo c’ivyo ku ngoma z’abami b’Abisirayeli?","Les autres faits et gestes de Joas, toutes ses réalisations, la vaillance dont il a fait preuve dans la guerre contre Amatsia, roi de Juda , sont cités dans le livre des Annales des rois d’Israël."
2KI.13.13,"Jehoash rested with his ancestors, and Jeroboam succeeded him on the throne. Jehoash was buried in Samaria with the kings of Israel.","Nuko Yehowasi ahamvya ba sekuruza, Yerobowamu asubira ku ngoma yiwe. Yehowasi ahambga i Samariya hamwe n’abami b’Abisirayeli.","Joas rejoignit ses ancêtres décédés et fut enterré à Samarie avec les rois d’Israël, et Jéroboam son fils accéda à son trône."
2KI.13.14,Now Elisha had been suffering from the illness from which he died. Jehoash king of Israel went down to see him and wept over him. “My father! My father!” he cried. “The chariots and horsemen of Israel!”,"Yehowasi akiriho, Elisa afatwa n’indwara, ari yo nyene yamwishe. Yehowasi umwami w’Abisirayeli aramanuka aja kurāba ukw ameze, amuririra hejura, ati Yewe ga data we, yewe ga data we, wabereye Abisirayeli imikogote n’abagendera ku mafarasi!","Elisée était atteint de la maladie dont il mourut, quand Joas, le roi d’Israël, lui rendit visite. Il se pencha sur son visage et pleura en répétant : Mon père ! Mon père ! Mon père ! Toi qui es comme les chars d’Israël et ses équipages !"
2KI.13.15,"Elisha said, “Get a bow and some arrows,” and he did so.","Elisa aramubarira, at’ Abīra umuheto n’imyampi. Nukw aravyābīra.",Elisée lui dit : Prends un arc et des flèches ! Joas se les fit apporter.
2KI.13.16,"“Take the bow in your hands,” he said to the king of Israel. When he had taken it, Elisha put his hands on the king’s hands.","Elisa abarira uwo mwami w’Abisirayeli, ati Fora. Nukw arafora; Elisa ashira intoke ziwe ku z’ umwami.","Puis Elisée lui ordonna : Tends l’arc ! Quand il l’eut tendu, Elisée posa ses mains sur celles du roi"
2KI.13.17,"“Open the east window,” he said, and he opened it. “Shoot!” Elisha said, and he shot. “The Lord ’s arrow of victory, the arrow of victory over Aram!” Elisha declared. “You will completely destroy the Arameans at Aphek.”","Araheza aravuga, at’ Ugurura idirisha ryerekeye i burasirazuba; bararyugurura. Maze Elisa aramubarira, ati Rasa; nukw ararasa. Elisa aravuga, ati N’umwampi w’Uhoraho w’intsinzi, ni wo mwampi wo kunesha i Siriya; kukw ari wewe uzorwanira n’Abasiriya muri Afeka gushitsa ah’ uzobaherengetereza.","et dit : Ouvre la fenêtre du côté de l’est ! Joas l’ouvrit. Puis Elisée commanda : Tire ! Il tira. Elisée s’écria : C’est la flèche de la victoire de l’Eternel, la flèche de la victoire contre les Syriens. Oui, tu battras les Syriens à Apheq jusqu’à leur extermination."
2KI.13.18,"Then he said, “Take the arrows,” and the king took them. Elisha told him, “Strike the ground.” He struck it three times and stopped.","Maz’ at’ Abīra imyampi; nuk’ uwo mwami w’Abisirayeli arayābīra. Elisa aramubarira, ati Yikubite hasi. Ayikubita hasi gatatu, araheza ageza aho.",Elisée ajouta : Prends maintenant d’autres flèches ! Il les prit. – Frappe contre le sol ! Le roi d’Israël frappa trois coups et s’arrêta.
2KI.13.19,"The man of God was angry with him and said, “You should have struck the ground five or six times; then you would have defeated Aram and completely destroyed it. But now you will defeat it only three times.”","Uwo muntu w’Imana aramurakira, aramubarira, at’ Iy’ uba war’ ukubise gatanu canke gatandatu, wonesheje Abasiriya gushitsa ah’ ubaherengeteje; ariko non’ uzobanesha gatatu gusa.","L’homme de Dieu se mit en colère contre lui et lui déclara : Il fallait frapper cinq ou six coups, alors tu aurais vaincu les Syriens jusqu’à leur extermination, tandis qu’à présent tu ne les battras que trois fois."
2KI.13.20,Elisha died and was buried. Now Moabite raiders used to enter the country every spring.,"Bukeye Elisa arahwera, baramuhamba. Kand’ uk’ umwaka utashe, ibitero vy’Abanyamowabu vyahora bitera ico gihugu ku gacikamvura.","Elisée mourut et fut enterré. L’année suivante, des bandes de pillards moabites firent une incursion dans le pays."
2KI.13.21,"Once while some Israelites were burying a man, suddenly they saw a band of raiders; so they threw the man’s body into Elisha’s tomb. When the body touched Elisha’s bones, the man came to life and stood up on his feet.","Umusi ur’ izina, harih’ abāri bagiye guhamba umuntu; bagize bartya, babona haje igitero; bashiburira uwo muvyimba mw isenga yahambgemwo Elisa, maz’ uwo muvyimba ugikora ku magufa ya Elisa, uwo muntu aca ararabūka, ava hasi, arahagarara.","On était en train d’enterrer un mort quand, tout à coup, on vit venir une de ces bandes. Alors on jeta le corps en hâte dans la tombe d’Elisée. Au contact des ossements du prophète, le mort reprit vie et se dressa sur ses pieds."
2KI.13.22,Hazael king of Aram oppressed Israel throughout the reign of Jehoahaz.,"Kand’ igihe cose Yehowahazi yabaye ku ngoma, Hazayeli umwami w’i Siriya yahahaza Abisirayeli.","Pendant tout le règne de Yoahaz, Hazaël, roi de Syrie, avait opprimé les Israélites."
2KI.13.23,"But the Lord was gracious to them and had compassion and showed concern for them because of his covenant with Abraham, Isaac and Jacob. To this day he has been unwilling to destroy them or banish them from his presence.","Arik’ Uhoraho bamutera akagongwe, abagirira imbabazi, abasubizak’ umutima kubg’ isezerano yasezeraniye Aburahamu na Isaka na Yakobo, ntiyabarandura; no kugeza n’ubu ntiyabaciye.","Mais l’Eternel leur témoigna sa grâce : il eut de la compassion pour eux et leur vint en aide à cause de son alliance avec Abraham, Isaac et Jacob . A cette époque, il ne voulut pas les détruire et il ne voulut pas encore les exiler loin de sa présence."
2KI.13.24,"Hazael king of Aram died, and Ben-Hadad his son succeeded him as king.",Maze Hazayeli umwami w’i Siriya aratanga; umuhungu wiwe Beni‐hadadi asubira ku ngoma yiwe.,"Hazaël, roi de Syrie, mourut et son fils Ben-Hadad lui succéda sur le trône."
2KI.13.25,"Then Jehoash son of Jehoahaz recaptured from Ben-Hadad son of Hazael the towns he had taken in battle from his father Jehoahaz. Three times Jehoash defeated him, and so he recovered the Israelite towns.","Hanyuma Yehowasi mwene Yehowahazi agarura ibisagara Beni‐hadadi mwene Hazayeli yari yaranyaze se Yehowahazi mu ntambara. Yehowasi amunesha gatatu, agarura ibisagara vy’i Bgisirayeli.","Alors Joas, fils de Yoahaz, reprit à Ben-Hadad, fils de Hazaël, les villes enlevées par ce dernier à son père Yoahaz à la suite des guerres . Joas le battit à trois reprises et reconquit les villes d’Israël."
2KI.14.1,"In the second year of Jehoash son of Jehoahaz king of Israel, Amaziah son of Joash king of Judah began to reign.","Mu mwaka ugira kabiri Yehowasi mwene Yehowahazi umwami w’Abisirayeli ari ku ngoma, ni ho Amaziya mwene Yowasi umwami w’i Buyuda yima.","La deuxième année du règne de Joas, fils de Yoahaz, roi d’Israël, Amatsia, fils de Joas, roi de Juda, devint roi."
2KI.14.2,"He was twenty-five years old when he became king, and he reigned in Jerusalem twenty-nine years. His mother’s name was Jehoaddan; she was from Jerusalem.","Yar’ amaze imyaka mirongwibiri n’itanu igihe yaja ku ngoma, amara imyaka mirongwibiri n’ icenda i Yerusalemu ari ku ngoma; nyina yitwa Yehowadina w’i Yerusalemu nyene.","Il avait vingt-cinq ans à son avènement et régna vingt-neuf ans à Jérusalem . Sa mère s’appelait Yehoaddân, elle était de Jérusalem."
2KI.14.3,"He did what was right in the eyes of the Lord , but not as his father David had done. In everything he followed the example of his father Joash.","Akora ivyo Uhoraho abona kw ari vyiza, ariko ntiyashikīra sekuruza Dawidi; yakoze nk’ivyo se Yowasi yakoze vyose.","Il fit ce que l’Eternel considère comme juste, mais pas autant que David son ancêtre. Il suivit en tout l’exemple de son père Joas."
2KI.14.4,"The high places, however, were not removed; the people continued to offer sacrifices and burn incense there.","Mugabo ibitabo vyo ku mpinga z’imisozi ntivyakūrwaho; abantu bāri bagitangira ibimazi mur’ ivyo bitabo, bakahosereza imibavu.",Les hauts lieux ne furent pas supprimés et le peuple continuait à y offrir des sacrifices et à y brûler des parfums.
2KI.14.5,"After the kingdom was firmly in his grasp, he executed the officials who had murdered his father the king.","Hanyuma amaze kubona kw ahangamye ku ngoma, yica ba banyarugo bāri barishe umwami se wiwe.","Dès qu’Amatsia eut affermi son autorité royale, il fit exécuter les ministres qui avaient assassiné son père ."
2KI.14.6,"Yet he did not put the children of the assassins to death, in accordance with what is written in the Book of the Law of Moses where the Lord commanded: “Parents are not to be put to death for their children, nor children put to death for their parents; each will die for their own sin.”","Arikw abana b’abo bicanyi ntiyabica, nk’uko vyanditswe mu gitabo c’ivyagezwe vya Mose, ivyashinzwe n’Uhoraho, ngw Abavyeyi ntibaze bicwe bazize abana babo, kand’ abana ntibaze bicwe bazize abavyeyi: ngw Arik’ umuntu wese az’ azire iciwe caha.","Mais il ne fit pas mourir les fils de ces meurtriers, conformément aux ordres donnés par l’Eternel dans le livre de la Loi de Moïse, lorsqu’il dit : « On ne fera pas mourir les pères pour les fils, ni les fils pour les pères ; mais chacun mourra pour son propre péché . »"
2KI.14.7,"He was the one who defeated ten thousand Edomites in the Valley of Salt and captured Sela in battle, calling it Joktheel, the name it has to this day.","Kandi yishe mu Banyedomu abantu ibihumbi cumi, abatsinze mu Kiyaya c’Umunyu; atera n’i Sela, arahatsinda, ahahindura izina ahita i Yokiteli na bugingo n’ubu.",Amatsia battit dix mille Edomites dans la vallée du Sel et conquit de haute lutte la ville de Séla . Il lui donna le nom de Yoqtéel qu’elle porte encore aujourd’hui.
2KI.14.8,"Then Amaziah sent messengers to Jehoash son of Jehoahaz, the son of Jehu, king of Israel, with the challenge: “Come, let us face each other in battle.”","Hanyuma Amaziya atuma intumwa kuri Yehowasi mwene Yehowahazi, Yehowahazi mwene Yehu, umwami w’Abisirayeli, muti N’uze muhangane.","Là-dessus, Amatsia envoya des messagers à Joas, fils de Yoahaz et petit-fils de Jéhu, roi d’Israël, pour lui dire : Allons nous affronter !"
2KI.14.9,"But Jehoash king of Israel replied to Amaziah king of Judah: “A thistle in Lebanon sent a message to a cedar in Lebanon, ‘Give your daughter to my son in marriage.’ Then a wild beast in Lebanon came along and trampled the thistle underfoot.","Yehowasi umwami w’Abisirayeli atuma kwishura Amaziya umwami w’i Buyuda, mut’ Igitovu c’i Lebanoni catumye kw isederi y’i Lebanoni nyene, ut’ Umukobga wawe n’umushingire umuhungu waco. Bukeye igikōko caba i Lebanoni kihahise gikandagira ca gitovu.","Joas lui fit répondre : Un jour, le chardon du Liban envoya dire au cèdre du Liban : « Donne ta fille en mariage à mon fils ! » Mais les bêtes sauvages du Liban passèrent par là et piétinèrent le chardon."
2KI.14.10,"You have indeed defeated Edom and now you are arrogant. Glory in your victory, but stay at home! Why ask for trouble and cause your own downfall and that of Judah also?”","Nka ko waratsinze Abanyedomu, uraheza wishira hejuru mu mutima wawe: ego ni wihaye, arik’ ugume i muhira; n’iki gituma ugomba kwikwegera akaziri, mugapfa mwe n’ Abayuda?","Certes, tu as vaincu les Edomites, et cela t’est monté à la tête ! Jouis de ta gloire, mais reste chez toi ! Pourquoi veux-tu t’engager dans une entreprise malheureuse et courir au-devant d’un désastre pour toi et pour le royaume de Juda ?"
2KI.14.11,"Amaziah, however, would not listen, so Jehoash king of Israel attacked. He and Amaziah king of Judah faced each other at Beth Shemesh in Judah.","Ariko Amaziya ntiyaruha amwumvira. Nuko Yehowasi umwami w’Abisirayeli ni kwo kudūga, bahanganira na Amaziya umwami w’i Buyuda i Beti‐shemeshi h’i Buyuda nyene, bararumana.","Mais Amatsia n’écouta pas son avertissement. Alors Joas, roi d’Israël, se mit en campagne. Les deux rois s’affrontèrent à Beth-Shémesh au pays de Juda ."
2KI.14.12,"Judah was routed by Israel, and every man fled to his home.","Maz’ Abayuda baneshwa n’Abisirayeli, umuntu wese ahungira i we.","L’armée de Juda fut battue par celle d’Israël, et les soldats de Juda s’enfuirent chacun chez soi."
2KI.14.13,"Jehoash king of Israel captured Amaziah king of Judah, the son of Joash, the son of Ahaziah, at Beth Shemesh. Then Jehoash went to Jerusalem and broke down the wall of Jerusalem from the Ephraim Gate to the Corner Gate—a section about four hundred cubits long.","Maze Yehowasi umwami w’Abisirayeli afata mpiri Amaziya umwami w’i Buyuda, mwene Yowasi, Yowasi mwene Ahaziya, amufatira i Beti‐shemeshi nyene; aca aja i Yerusalemu, asangangura uruzitiro rwaho rw’amabuye, uhereye kw irembo ry’Abefurayimu ugashitsa kw irembo ryo ku mfuruka, hose har’ amatambge amajana ane y’ ukuboko uciriye mu nkokora.","A Beth-Shémesh, Joas, roi d’Israël, fit prisonnier Amatsia, roi de Juda, fils de Joas et petit-fils d’Ahazia. Il se rendit à Jérusalem et démolit le rempart de la ville sur une longueur de cent quatre-vingts mètres, depuis la porte d’Ephraïm jusqu’à la porte de l’Angle ."
2KI.14.14,He took all the gold and silver and all the articles found in the temple of the Lord and in the treasuries of the royal palace. He also took hostages and returned to Samaria.,"Asahura amazahabu n’amafeza yose, n’ibintu vyose vy’imbombovu bāsanze mu ngoro y’Uhoraho n’ivyo bāsanze mu bubīko bgo mu ngoro y’umwami, afata n’abantu abajana bari mu bugōmbe, araheza asubira i Samariya.","Il prit tout l’or et l’argent et tous les objets précieux qui se trouvaient dans le temple de l’Eternel et dans les trésors du palais royal ; il prit en plus des otages, puis retourna à Samarie."
2KI.14.15,"As for the other events of the reign of Jehoash, what he did and his achievements, including his war against Amaziah king of Judah, are they not written in the book of the annals of the kings of Israel?","Ibindi vyose vyadonzwe kuri Yehowasi, n’ivy’ ubuhizi bgiwe, n’ingene yarwanye na Amaziya umwami w’i Buyuda, none ntivyanditswe mu gitabo c’ivyo ku ngoma z’abami b’Abisirayeli?","Les autres faits et gestes de Joas, la vaillance dont il fit preuve dans la guerre contre Amatsia, roi de Juda, sont cités dans le livre des Annales des rois d’Israël ."
2KI.14.16,Jehoash rested with his ancestors and was buried in Samaria with the kings of Israel. And Jeroboam his son succeeded him as king.,"Nuko Yehowasi ahamvya ba sekuruza, ahambga i Samariya hamwe n’abami b’Abisirayeli; maz’ umuhungu wiwe Yerobowamu asubira ku ngoma yiwe.",Joas rejoignit ses ancêtres décédés et fut enterré à Samarie avec les rois d’Israël. Son fils Jéroboam lui succéda sur le trône.
2KI.14.17,Amaziah son of Joash king of Judah lived for fifteen years after the death of Jehoash son of Jehoahaz king of Israel.,"Yehowasi mwene Yehowahazi umwami w’Abisirayeli amaze gutanga, Amaziya mwene Yowasi umwami w’i Buyuda amara iyindi myaka cumi n’itanu.","Amatsia, fils de Joas, roi de Juda, vécut encore quinze années après la mort de Joas, fils de Yoahaz, roi d’Israël ."
