,0,1,2
2KI.17.32,"They worshiped the Lord , but they also appointed all sorts of their own people to officiate for them as priests in the shrines at the high places.","Ariko n’Uhoraho na we baramusaba, kandi bamwe muri bo bābagira abaherezi bo mu bitabo, bo kubatangira ibimazi mu tunyabugoro two mur’ ivyo bitabo.","Avec cela, ils craignaient l’Eternel et ils instituèrent un peu partout des prêtres choisis parmi eux pour officier en leur nom dans les sanctuaires des hauts lieux."
2KI.17.33,"They worshiped the Lord , but they also served their own gods in accordance with the customs of the nations from which they had been brought.","Uko ni ko bāsaba Uhoraho, bagatako bagasaba izabo mana, nk’ukw imigenzo y’amahanga bākūwemwo yar’ imeze.","D’un côté donc, ils craignaient l’Eternel, mais en même temps, ils continuaient à rendre un culte à leurs propres dieux selon les coutumes des gens de leurs pays d’origine."
2KI.17.34,"To this day they persist in their former practices. They neither worship the Lord nor adhere to the decrees and regulations, the laws and commands that the Lord gave the descendants of Jacob, whom he named Israel.","No gushitsa uyu musi wa none baracagenza nk’uko bamye bagenza kera; ntibatinya Uhoraho, ntibitondera amateka cank’ imigenzo cank’ ivyagezwe cank’ amabgirizwa, ivyo Uhoraho yahaye bene Yakobo, uwo yise Isirayeli,","Jusqu’à aujourd’hui, ils continuent à suivre leurs anciennes coutumes. Ils ne craignent pas vraiment l’Eternel et n’observent pas les ordonnances et les articles de droit, ni la Loi et les commandements donnés par l’Eternel aux descendants de Jacob, auquel il avait donné le nom d’Israël ."
2KI.17.35,"When the Lord made a covenant with the Israelites, he commanded them: “Do not worship any other gods or bow down to them, serve them or sacrifice to them.","akabasezeranira isezerano, akabihanikiriza, ati Ntimuze musabe izindi mana, canke ngo muzīkubite imbere, canke ngo muzisenge, canke ngo muzihe ibimazi;","L’Eternel avait conclu une alliance avec les descendants de Jacob et leur avait ordonné : Vous ne craindrez pas d’autres dieux, vous ne vous prosternerez pas devant eux, vous ne leur rendrez pas de culte et vous ne leur offrirez aucun sacrifice ."
2KI.17.36,"But the Lord , who brought you up out of Egypt with mighty power and outstretched arm, is the one you must worship. To him you shall bow down and to him offer sacrifices.","ariko jewe Uhoraho nabakūje mu gihugu ca Egiputa ububasha bganje bginshi n’ukuboko kubanguye, abe ari jewe mwubaha, abe ari jewe mwikubita imbere, abe ari jewe muha ibimazi;","C’est l’Eternel, lui qui vous a fait sortir d’Egypte par sa grande force et en déployant sa puissance, c’est lui seul que vous craindrez ; c’est devant lui que vous vous prosternerez, c’est à lui que vous offrirez des sacrifices."
2KI.17.37,"You must always be careful to keep the decrees and regulations, the laws and commands he wrote for you. Do not worship other gods.","kand’ amateka n’imigenzo n’ivyagezwe n’amabgirizwa, ivyo nabandikiye, mube ari vyo mwitondera, mubikore gushitsa ibihe vyose; kandi ntimuze mugire izindi mana musaba.","Vous aurez soin d’observer et d’appliquer chaque jour les ordonnances, les articles de droit, la Loi et les commandements qu’il vous a donnés par écrit, et vous ne craindrez pas d’autres dieux."
2KI.17.38,"Do not forget the covenant I have made with you, and do not worship other gods.","Kand’ isezerano nasezeranye namwe ntimuze muryibagire, kandi ntimuze mwubahe izindi mana;","Vous ne serez pas infidèles à l’alliance que j’ai conclue avec vous et, je le répète, vous ne craindrez pas d’autres dieux."
2KI.17.39,"Rather, worship the Lord your God; it is he who will deliver you from the hand of all your enemies.”",ariko jewe Uhoraho Imana yanyu abe ari jewe mwubaha; nanje nzobarokora mbakūre mu maboko y’abansi banyu bose.,"Mais vous craindrez l’Eternel, votre Dieu, et il vous délivrera de tous vos ennemis."
2KI.17.40,"They would not listen, however, but persisted in their former practices.","Yamara ntibaruha bavyumva, ariko bakomeza kugenza nk’uko bamye bagenza kera.",Mais ces gens n’ont pas écouté ; ils restent attachés à leurs anciennes coutumes.
2KI.17.41,"Even while these people were worshiping the Lord , they were serving their idols. To this day their children and grandchildren continue to do as their ancestors did.","Nukw ab’ ayo mahanga bātinya Uhoraho, bagatako bagasaba ibishushanyo vyabo vy’ibibāzano; n’abana babo n’abuzukuru babo bakomeza kugenza bartyo; uko ba sekuruza bāgenza, na bo ni ko bagenza na bugingo n’ubu.","Ainsi donc les gens de ces peuples étrangers craignaient l’Eternel tout en continuant à rendre un culte à leurs idoles. Jusqu’à ce jour, leurs enfants et leurs descendants ont maintenu les pratiques de leurs ancêtres."
2KI.18.1,"In the third year of Hoshea son of Elah king of Israel, Hezekiah son of Ahaz king of Judah began to reign.","Mu mwaka ugira gatatu Hoseya mwene Ela, umwami w’Abisirayeli ari ku ngoma, ni ho Hezekiya mwene Ahazi, umwami w’i Buyuda, yima.","La troisième année du règne d’Osée, fils d’Ela, roi d’Israël, Ezéchias, fils d’Ahaz, roi de Juda, devint roi ."
2KI.18.2,"He was twenty-five years old when he became king, and he reigned in Jerusalem twenty-nine years. His mother’s name was Abijah daughter of Zechariah.","Yar’ amaze imyaka mirongwibiri n’itanu igihe yima, amara imyaka mirongwibiri n’icenda i Yerusalemu ari ku ngoma; nyina yitwa Abi, umukobga wa Zekariya.","Il était âgé de vingt-cinq ans à son avènement et il régna vingt-neuf ans à Jérusalem . Sa mère s’appelait Abi, elle était fille de Zacharie."
2KI.18.3,"He did what was right in the eyes of the Lord , just as his father David had done.","Akora ivyo Uhoraho abona kw ari vyiza, nk’ ivyo sekuruza Dawidi yakoze vyose.","Il fit ce que l’Eternel considère comme juste, en tout point comme l’avait fait son ancêtre David."
2KI.18.4,"He removed the high places, smashed the sacred stones and cut down the Asherah poles. He broke into pieces the bronze snake Moses had made, for up to that time the Israelites had been burning incense to it. (It was called Nehushtan. )","Akūrah’ ibitabo vyo ku mpinga z’imisozi, amenagura amabuye bāshinze, atemagura inkingi bāshingiye Ashera; amenagura igishushanyo c’inzoka Mose yacuze mu muringa; kuko gushitsa ico gihe Abisirayeli bācosereza imibavu; bācita Nehushitani.","Il fit disparaître les hauts lieux, briser les stèles des idoles, couper le pieu sacré de la déesse Ashéra. Il fit aussi mettre en pièces le serpent de bronze que Moïse avait fabriqué , car jusqu’à cette époque-là, les Israélites faisaient brûler des parfums pour lui et l’appelaient Nehoushtân."
2KI.18.5,"Hezekiah trusted in the Lord , the God of Israel. There was no one like him among all the kings of Judah, either before him or after him.","Hezekiya yizigira Uhoraho Imana y’Abisirayeli; kandi mu bami bose b’i Buyuda bāmuherukiye nta wahwanye na we, no mu bāmwitangiye imbere;","Ezéchias mit sa confiance en l’Eternel, le Dieu d’Israël. Parmi tous les rois de Juda qui lui succédèrent ou qui l’avaient précédé, aucun ne l’égala."
2KI.18.6,He held fast to the Lord and did not stop following him; he kept the commands the Lord had given Moses.,"kuko yifatanije n’Uhoraho akaramata, ntākevye ngw areke kumukurikira, arikw akitondera ivyagezwe Uhoraho yageze Mose.","Il demeura attaché à l’Eternel, sans se détourner de lui ; il obéit à tous les commandements que l’Eternel avait donnés à Moïse."
2KI.18.7,And the Lord was with him; he was successful in whatever he undertook. He rebelled against the king of Assyria and did not serve him.,"Kand’ Uhoraho yabana na we, akagira ukuboko kwiza aho yaja hose. Bukeye agarariza umwami w’i Ashuri, ntiyaba akimusaba.",Aussi l’Eternel fut-il avec lui. Il réussit dans toutes ses entreprises. Il se révolta contre le roi d’Assyrie et cessa de lui être assujetti.
2KI.18.8,"From watchtower to fortified city, he defeated the Philistines, as far as Gaza and its territory.","Atera Abafilisitiya ukarinda ushitsa i Gaza n’intāra yaho, uhereye ku minara y’abarinzi ugashitsa ku bisagara bizitijwe inzitiro.","Il battit les Philistins et les poursuivit jusqu’à Gaza , ravageant la ville et son territoire, et s’emparant des villes fortifiées aussi bien que des postes d’observation."
2KI.18.9,"In King Hezekiah’s fourth year, which was the seventh year of Hoshea son of Elah king of Israel, Shalmaneser king of Assyria marched against Samaria and laid siege to it.","Mu mwaka ugira kane umwami Hezekiya ari ku ngoma, ari wo mwaka ugira indwi wo ku ngoma ya Hoseya mwene Ela, umwami w’Abisirayeli, Shalumaneseri umwami w’i Ashuri aradūga, atera i Samariya, arahugariza.","Ce fut pendant la quatrième année du règne d’Ezéchias , qui correspond à la septième année de celui d’Osée, fils d’Ela, roi d’Israël, que Salmanasar, roi d’Assyrie, vint attaquer Samarie et l’assiégea."
2KI.18.10,"At the end of three years the Assyrians took it. So Samaria was captured in Hezekiah’s sixth year, which was the ninth year of Hoshea king of Israel.","Maze hashize imyaka itatu barahanesha; i Samariya hāneshejwe mu mwaka ugira gatandatu Hezekiya ari ku ngoma, ari wo mwaka ugira icenda wo ku ngoma ya Hoseya umwami w’ Abisirayeli.","Il s’en empara au bout de trois ans, la sixième année du règne d’Ezéchias, c’est-à-dire la neuvième année du règne d’Osée, roi d’Israël ; ainsi Samarie fut prise."
2KI.18.11,"The king of Assyria deported Israel to Assyria and settled them in Halah, in Gozan on the Habor River and in towns of the Medes.","Umwami w’i Ashuri araheza ajana Abisirayeli ar’ inyagano, abajana muri Ashuri, abashira i Hala no kuri Habori, uruzi rw’i Gozani, no mu bisagara vy’Abamedi;","Le roi d’Assyrie déporta les Israélites en Assyrie et les établit à Halah et sur les rives du Habor, dans la région de Gozân ainsi que dans les villes de la Médie."
2KI.18.12,"This happened because they had not obeyed the Lord their God, but had violated his covenant—all that Moses the servant of the Lord commanded. They neither listened to the commands nor carried them out.","ivyo vyabaye kukw Abisirayeli batumviye Uhoraho Imana yabo, ariko bakava mw isezerano ryiwe, mu vyo Mose umusavyi wiwe yabageze vyose; bakanka kuvyumvira ngo babikore.","Ces malheurs leur arrivèrent parce qu’ils n’avaient pas obéi aux ordres de l’Eternel, leur Dieu, parce qu’ils avaient été infidèles à son alliance en désobéissant à tout ce que Moïse, le serviteur de l’Eternel, leur avait ordonné, au lieu de l’écouter et de l’appliquer."
2KI.18.13,"In the fourteenth year of King Hezekiah’s reign, Sennacherib king of Assyria attacked all the fortified cities of Judah and captured them.","Mu mwaka ugira icumi na kane umwami Hezekiya ari ku ngoma, Senakeribu umwami w’i Ashuri yaradūze, atera ibisagara vyose vyubakiwe inzitiro vy’i Buyuda, arabitsinda.","La quatorzième année du règne d’Ezéchias, Sennachérib, roi d’Assyrie , vint attaquer toutes les villes fortifiées de Juda et s’en empara."
2KI.18.14,"So Hezekiah king of Judah sent this message to the king of Assyria at Lachish: “I have done wrong. Withdraw from me, and I will pay whatever you demand of me.” The king of Assyria exacted from Hezekiah king of Judah three hundred talents of silver and thirty talents of gold.","Maze Hezekiya umwami w’i Buyuda atuma ku mwami w’i Ashuri i Lakishi, ut’ Arazi ko yakoze nabi; uti Non’ arakwisavye, umureke usubire i wawe; ut’ Ivyo umucira vyose azobitanga. Nuk’ umwami w’i Ashuri acira Hezekiya umwami w’i Buyuda italanto z’ifeza amajana atatu n’italanto z’izahabu mirongwitatu.","Alors Ezéchias, roi de Juda, fit transmettre au roi d’Assyrie à Lakish le message suivant : J’ai commis une faute, cesse de m’attaquer. J’accepte de payer le tribut que tu m’imposeras. Le roi d’Assyrie exigea d’Ezéchias dix tonnes d’argent et une tonne d’or."
2KI.18.15,So Hezekiah gave him all the silver that was found in the temple of the Lord and in the treasuries of the royal palace.,"Hezekiya amuha amafeza yose yari mu ngoro y’Uhoraho, n’ayari mu ngoro yiwe ubgiwe.",Ezéchias lui fit donc porter tout l’argent qui se trouvait dans le temple de l’Eternel et dans le trésor du palais royal.
2KI.18.16,"At this time Hezekiah king of Judah stripped off the gold with which he had covered the doors and doorposts of the temple of the Lord , and gave it to the king of Assyria.","Mur’ ico gihe Hezekiya umwami w’i Buyuda yomorora izahabu ku nzugi z’urusengero rw’ Uhoraho n’izo ku nkingi yari yarometseko, aziha umwami w’i Ashuri.",Il dut même arracher les plaques d’or dont il avait fait revêtir les portes et les linteaux du temple de l’Eternel pour les donner au roi d’Assyrie.
2KI.18.17,"The king of Assyria sent his supreme commander, his chief officer and his field commander with a large army, from Lachish to King Hezekiah at Jerusalem. They came up to Jerusalem and stopped at the aqueduct of the Upper Pool, on the road to the Washerman’s Field.","Bukeye umwami w’i Ashuri atuma Tarutani na Rabusarisi na Rabushake, bava i Lakishi bajanye ingabo nyinshi, ngo baje ku mwami Hezekiya i Yerusalemu. Nuko baradūga baja i Yerusalemu nyene. Bashitseyo bahagarara ku mugende wo ku kidengeri co haruguru, ku nzira yo ku kibuga c’umumesuzi.","Le roi d’Assyrie envoya de Lakish à Jérusalem vers le roi Ezéchias son général en chef, son chef d’état-major et son aide de camp, accompagnés d’une puissante armée. Lorsque les trois officiers supérieurs furent arrivés en haut de la côte près de Jérusalem, ils prirent position près de l’aqueduc du réservoir supérieur qui est sur la route du champ du Teinturier ."
2KI.18.18,"They called for the king; and Eliakim son of Hilkiah the palace administrator, Shebna the secretary, and Joah son of Asaph the recorder went out to them.","Maze bahamagaje umwami, haca haza umuzezwarugo wiwe Eliyakimu mwene Hilukiya, n’umukarani Shebuna, n’umwanditsi w’ivyaja biraba yitwa Yowa mwene Asafu, barenga irembo barabasanganira.","Ils crièrent qu’ils voulaient parler au roi. Eliaqim, fils de Hilqiya, qui avait la charge du palais royal, Shebna, le secrétaire du roi et Yoah, fils d’Asaph, l’archiviste, sortirent de la ville à leur rencontre."
2KI.18.19,"The field commander said to them, “Tell Hezekiah: “ ‘This is what the great king, the king of Assyria, says: On what are you basing this confidence of yours?","Rabushake arababarira, ati Ni mubarire Hezekiya, mut’ Uku ni k’ umwami ahambaye, ni we mwami w’i Ashuri, agize: ngo Mbeg’ ivyo vyizigiro wizigiye n’ibiki?","L’aide de camp du roi d’Assyrie leur dit : Veuillez transmettre ce message à Ezéchias : « Voici ce que déclare le grand roi, le roi d’Assyrie : En quoi mets-tu ta confiance ?"
2KI.18.20,"You say you have the counsel and the might for war—but you speak only empty words. On whom are you depending, that you rebel against me?","Muti K’uvuze ng’ ufise inama n’inkomezi zo kurwana, ariko n’ amagambo y’impfagusa! Muti Mbeg’ uwo wishimiye ni nde, yatumye umugarariza?",T’imaginerais-tu que de simples paroles peuvent tenir lieu de stratégie et de puissance militaire ? Sur qui comptes-tu donc pour t’être révolté contre moi ?
2KI.18.21,"Look, I know you are depending on Egypt, that splintered reed of a staff, which pierces the hand of anyone who leans on it! Such is Pharaoh king of Egypt to all who depend on him.","Mut’ Erega wishimiye ya nkoni y’irenga rivunitse, ni ryo Egiputa, umuntu yoryishimikiza, ryomutobekeranya ikiganza. Mut’ Uko ni ko Farawo umwami wa Egiputa amerera abamwishimiye bose.","Je le vois : tu t’appuies sur l’Egypte, ce roseau cassé qui blesse et qui transperce la main de celui qui s’appuie dessus. Oui, c’est bien là ce qu’est le pharaon, le roi d’Egypte, pour tous ceux qui se confient en lui !"
2KI.18.22,"But if you say to me, “We are depending on the Lord our God”—isn’t he the one whose high places and altars Hezekiah removed, saying to Judah and Jerusalem, “You must worship before this altar in Jerusalem”?","Naho mwomubarira ko mwishimiye Uhoraho Imana yanyu: none si yo Hezekiya yakūyeh’ ibitabo vyayo n’ibicaniro vyayo, akabarira Abayuda n’ab’i Yerusalemu, ati Muze musengere imbere y’iki gicaniro i Yerusalemu?","Peut-être me direz-vous : C’est en l’Eternel, notre Dieu, que nous nous confions. Mais n’est-ce pas précisément ce Dieu dont Ezéchias a fait disparaître les hauts lieux et les autels, en disant aux habitants de Juda et de Jérusalem de rendre leur culte uniquement devant l’autel qui se trouve à Jérusalem ?"
2KI.18.23,"“ ‘Come now, make a bargain with my master, the king of Assyria: I will give you two thousand horses—if you can put riders on them!","Muti None rero, enda shinga na shebuja umwami w’i Ashuri; muti Na we Rabushake araguha amafarasi ibihumbi bibiri, namba nawe ubgawe woshobora kuronka abo uyūriza.","Je te lance aujourd’hui un défi au nom de mon souverain, le roi d’Assyrie : Je te donnerai deux mille chevaux, si toi tu es capable de fournir autant d’hommes pour les monter."
2KI.18.24,"How can you repulse one officer of the least of my master’s officials, even though you are depending on Egypt for chariots and horsemen ?","Muti None se woshobora ute gukora mu maso y’umugabisha n’umwe wo mu basavyi ba shebuja bo hanyuma y’abandi, mut’ Asangw’ ar’ ukwishimira Abanyegiputa kw ari bo bazoguha imikogote ikwegwa n’ amafarasi n’abo kuyagenderako?","Comment t’y prendrais-tu pour repousser un seul de nos capitaines, même si c’était le moindre des serviteurs de mon maître ? Comptes-tu sur l’Egypte pour te fournir des chars avec leur équipage ?"
2KI.18.25,"Furthermore, have I come to attack and destroy this place without word from the Lord ? The Lord himself told me to march against this country and destroy it.’ ”","Muti Mbega yadūze gutera aha hantu no kuharandura, atari kubg’ Uhoraho? Mut’ Ereg’ Uhoraho ni we nyene yamubariye, ati Dūga utere ico gihugu, ukirandure.",D’ailleurs crois-tu que c’est sans l’assentiment de l’Eternel que je suis venu attaquer ce lieu-ci pour le détruire ? C’est l’Eternel qui m’a dit : Va attaquer ce pays et détruis-le ! »
2KI.18.26,"Then Eliakim son of Hilkiah, and Shebna and Joah said to the field commander, “Please speak to your servants in Aramaic, since we understand it. Don’t speak to us in Hebrew in the hearing of the people on the wall.”","Maze Eliyakimu mwene Hilukiya, na Shebuna na Yowa, bishura Rabushake, bat’ Enda se turakwinginze, utubarire mu Gisiriya kuko tucumva; ariko nta co utubaririra mu Kiyuda mu matwi y’aba bantu bari hejuru ku ruzitiro rw’amabuye.","Alors Eliaqim, fils de Hilqiya, Shebna et Yoah dirent à l’aide de camp assyrien : Voudrais-tu, s’il te plaît, parler à tes serviteurs en langue araméenne , car nous la comprenons. Ne nous parle pas en hébreu alors que les gens sont là, sur les remparts, à écouter !"
2KI.18.27,"But the commander replied, “Was it only to your master and you that my master sent me to say these things, and not to the people sitting on the wall—who, like you, will have to eat their own excrement and drink their own urine?”","Ariko Rabushake arabishura, ati Mbeg’ ugira ngo databuja yantumye kuri shobuja namwe gusa kubabgira aya majambo? Ntiyantumye kur’ aba bagabo bicaranye namwe hejuru ku ruzitiro, kugira ngo barīre amavyi yabo hamwe n’ayo basōvye?","Mais l’aide de camp leur répliqua : Crois-tu que c’est à ton souverain et à toi seulement que mon souverain m’a chargé d’adresser ce message ? Crois-tu que ce n’est pas aussi à ces gens assis sur les remparts, qui seront bientôt réduits avec vous à manger leurs excréments et à boire leur urine ?"
2KI.18.28,"Then the commander stood and called out in Hebrew, “Hear the word of the great king, the king of Assyria!","Maze Rabushake arahagarara, avuga n’ijwi rirenga mu rurimi rw’Ikiyuda, ati Ni mwumve ijambo ry’umwami ahambaye, ni we mwami w’i Ashuri.","Puis l’aide de camp se campa là et se mit à crier d’une voix forte, en hébreu : Ecoutez ce que dit le grand roi, le roi d’Assyrie !"
2KI.18.29,This is what the king says: Do not let Hezekiah deceive you. He cannot deliver you from my hand.,"Uku ni k’umwami agize, ngo Hezekiya ntabahende; ngo Kukw atazoshobora kubakiza ngo ntimukorokere mu maboko yiwe.",Ainsi parle le roi : « Ne vous laissez pas tromper par Ezéchias ! Car il ne peut pas vous délivrer !
2KI.18.30,"Do not let Hezekiah persuade you to trust in the Lord when he says, ‘The Lord will surely deliver us; this city will not be given into the hand of the king of Assyria.’","Ngo Kandi Hezekiya ntabizigize Uhoraho, ababarira, ng’ Uhoraho ntazobura kubakiza, kandi ng’ Uyu murwa ntuzotangwa ng’ ukorokere mu maboko y’umwami w’i Ashuri.","Ne vous laissez pas persuader par Ezéchias de vous confier en l’Eternel, s’il vous dit : Sûrement l’Eternel nous délivrera, cette ville ne tombera pas aux mains du roi d’Assyrie."
2KI.18.31,"“Do not listen to Hezekiah. This is what the king of Assyria says: Make peace with me and come out to me. Then each of you will eat fruit from your own vine and fig tree and drink water from your own cistern,","Ntimwumvire Hezekiya: kuk’ ukw ari k’umwami w’i Ashuri agize, ngo Kunda mwuzure na we, musokoroke muje iy’ ari, umuntu wese ngw abone kurya ku muzabibu wiwe no ku musukoni wiwe, no kunywa ku mazi yo mw ivomo ryiwe,","N’écoutez pas Ezéchias ; car voici ce que vous propose le roi d’Assyrie : Faites la paix avec moi, rendez-vous à moi ! Alors chacun de vous mangera les fruits de sa vigne et de son figuier , et chacun boira de l’eau de son puits,"
2KI.18.32,"until I come and take you to a land like your own—a land of grain and new wine, a land of bread and vineyards, a land of olive trees and honey. Choose life and not death! “Do not listen to Hezekiah, for he is misleading you when he says, ‘The Lord will deliver us.’","ngo Gushitsa igihe azozira akabajana mu gihugu gihwanye n’icanyu, igihugu c’ ingano na vino, igihugu c’indya n’inzabibu, igihugu c’amavuta ya clayo n’ubūki, kugira ngo mubone kubaho, ntimupfe; kandi ntimuze mwumvire Hezekiya ni yabahenda, avuga ng’ Uhoraho azobakiza.","en attendant que je vienne vous emmener dans un pays pareil au vôtre, un pays où il y a du blé et du vin, du pain et des vignes, des oliviers, de l’huile et du miel. Ainsi vous vivrez et vous ne mourrez pas. N’écoutez donc pas Ezéchias ; il vous trompe en vous disant : L’Eternel nous délivrera."
2KI.18.33,Has the god of any nation ever delivered his land from the hand of the king of Assyria?,Mbega mu mana z’abanyamahanga hari n’imwe yigeze gukiza igihugu cayo ngo ntigikorokere mu maboko y’umwami w’i Ashuri?,Les dieux des autres peuples ont-ils délivré leur pays du roi d’Assyrie ?
2KI.18.34,"Where are the gods of Hamath and Arpad? Where are the gods of Sepharvaim, Hena and Ivvah? Have they rescued Samaria from my hand?",Ngo Mbeg’ imana z’i Hamati n’izo muri Arupadi ziri hehe? Imana z’i Sefaravayimu n’iz’ i Hena n’iz’ i Iva ziri hehe? Ngo Mbega zarakijije Samariya ngo ntihakorokere mu maboko yiwe?,"Où sont les dieux de Hamath et d’Arpad ? Où sont les dieux de Sepharvaïm, de Héna et d’Ivva ? Ont-ils délivré Samarie ?"
2KI.18.35,Who of all the gods of these countries has been able to save his land from me? How then can the Lord deliver Jerusalem from my hand?”,"Ngo N’izihe mu mana zose zo mur’ ivyo bihugu zākijije igihugu cazo ngo ntigikorokere mu maboko yiwe, ng’Uhoraho na we akize Yerusalemu ngo ntihakorokere mu maboko yiwe?","De tous les dieux de ces pays, quels sont ceux qui ont délivré leur pays pour que l’Eternel délivre Jérusalem ? »"
2KI.18.36,"But the people remained silent and said nothing in reply, because the king had commanded, “Do not answer him.”","Maz’ abantu barihorera, ntibamwishura ijambo na rimwe, kukw ijambo ry’umwami ryari ryavuze, ngo Ntimugire ico mumwishura.","Le peuple garda le silence et ne lui répondit pas un mot, car le roi avait donné cet ordre : Vous ne lui répondrez pas."
2KI.18.37,"Then Eliakim son of Hilkiah the palace administrator, Shebna the secretary, and Joah son of Asaph the recorder went to Hezekiah, with their clothes torn, and told him what the field commander had said.","Hanyuma wa muzezwarugo Eliyakimu mwene Hilukiya, n’umukarani Shebuna, n’ umwanditsi w’ivyaja biraba yitwa Yowa mwene Asafu, baza kuri Hezekiya bitantamuriyekw impuzu zabo, bamudondera amagambo ya Rabushake.","Alors Eliaqim, fils de Hilqiya, qui avait la charge du palais, Shebna, le secrétaire et Yoah, fils d’Asaph, l’archiviste, retournèrent auprès d’Ezéchias, les vêtements déchirés, et lui rapportèrent les paroles de l’aide de camp."
2KI.19.1,"When King Hezekiah heard this, he tore his clothes and put on sackcloth and went into the temple of the Lord .","Maz’ umwami Hezekiya avyumvise, yitantamurirakw impuzu ziwe, yambara amagunira, yinjira mu ngoro y’Uhoraho.","Lorsque le roi Ezéchias eut entendu leur rapport, il déchira ses vêtements, se couvrit d’un vêtement d’étoffe grossière et se rendit au temple de l’Eternel."
