,0,1,2
JHN.6.12,"When they had all had enough to eat, he said to his disciples, “Gather the pieces that are left over. Let nothing be wasted.”","Bamaze guhāga, abgira abigishwa biwe, ati Ni mutororokanye utumanyagu tw’ imisigazwa, hoye kugira igipfa ubusa.","Quand ils eurent tous mangé à leur faim, Jésus dit à ses disciples : Ramassez les morceaux qui restent, pour que rien ne soit gaspillé."
JHN.6.13,So they gathered them and filled twelve baskets with the pieces of the five barley loaves left over by those who had eaten.,"Baradutororokanya, buzuza ibisimbo cumi na bibiri vy’utumanyagu twa ya mitsima itanu ya sayiri, utw’ abāriye bashigaje.",Ils les ramassèrent donc et remplirent douze paniers avec ce qui restait des cinq pains d’orge qu’on avait mangés.
JHN.6.14,"After the people saw the sign Jesus performed, they began to say, “Surely this is the Prophet who is to come into the world.”","Bano bantu babonye ikimenyetso akoze, baravuga, bati N’ukuri uyu ni wa muntu avugishwa n’Imana yar’ akwiye kuza mw isi.","Lorsque tous ces gens-là virent le signe miraculeux de Jésus, ils s’écrièrent : Pas de doute : cet homme est vraiment le Prophète qui devait venir dans le monde."
JHN.6.15,"Jesus, knowing that they intended to come and make him king by force, withdrew again to a mountain by himself.","Yesu amenye ko bagira baze kumufata ngo bamwimike, asubira ku musozi ari wenyene gusa.","Mais Jésus, sachant qu’ils allaient l’enlever de force pour le proclamer roi, se retira de nouveau, tout seul, dans la montagne."
JHN.6.16,"When evening came, his disciples went down to the lake,","Buhwibiriye, abigishwa biwe bamanuka ku kiyaga,","A la tombée de la nuit, ses disciples redescendirent au bord du lac."
JHN.6.17,"where they got into a boat and set off across the lake for Capernaum. By now it was dark, and Jesus had not yet joined them.","batambukira mu bgato, bajabuka baja hakurya y’ikiyaga i Kaperinawumu. Bgateranye Yesu atarabashikīra;","Ils montèrent dans un bateau et se dirigèrent vers Capernaüm, sur l’autre rive. Il faisait déjà nuit et Jésus ne les avait pas encore rejoints."
JHN.6.18,A strong wind was blowing and the waters grew rough.,"ikiyaga gitangura kuzungazunga, kuk’ umuyaga mwinshi uhuhuta.","Un vent violent se mit à souffler, et le lac était très agité."
JHN.6.19,"When they had rowed about three or four miles, they saw Jesus approaching the boat, walking on the water; and they were frightened.","Bamaze gusōza nka stadiyo mirongwibiri na zitanu canke mirongwitatu, babona Yesu agendesha amaguru hejuru ku kiyaga, arikw arēgēra ubgato, na bo baratinya.","Les disciples avaient déjà parcouru cinq ou six kilomètres, quand ils virent Jésus marcher sur l’eau et s’approcher de leur bateau. L’épouvante les saisit."
JHN.6.20,"But he said to them, “It is I; don’t be afraid.”","Maz’ arababgira, ati Ni jewe, nta co mutinya.","Mais Jésus leur dit : C’est moi, n’ayez pas peur !"
JHN.6.21,"Then they were willing to take him into the boat, and immediately the boat reached the shore where they were heading.","Bumva bakunze kumushira mu bgato, buno nyene buca bushika i musozi aho bāja.","Ils voulurent alors le faire monter dans le bateau, et au même moment, ils touchèrent terre à l’endroit où ils voulaient aller."
JHN.6.22,"The next day the crowd that had stayed on the opposite shore of the lake realized that only one boat had been there, and that Jesus had not entered it with his disciples, but that they had gone away alone.","Bukeye bg’aho, rya shengero ryari rihagaze hakurya y’ikiyaga, rimenye kw ata bundi bgato bgāriho atari bumwe, kandi yuko na Yesu atājanye n’abigishwa biwe mu bgato, arikw abigishwa biwe ni bo bāri bījanye:","Le lendemain, ceux qui étaient restés sur l’autre rive se rendirent compte qu’il n’y avait eu là qu’un seul bateau et que Jésus n’avait pas accompagné ses disciples ; ceux-ci étaient repartis seuls."
JHN.6.23,Then some boats from Tiberias landed near the place where the people had eaten the bread after the Lord had given thanks.,"(mugabo hār’ amato ajabuka ava i Tiberiya, afata hafi ya ha hantu bārīriye imitsima ihezagiwe n’Umwami Yesu).","Entre-temps, d’autres bateaux étaient arrivés de Tibériade, près de l’endroit où toute cette foule avait été nourrie après que le Seigneur eut remercié Dieu."
JHN.6.24,"Once the crowd realized that neither Jesus nor his disciples were there, they got into the boats and went to Capernaum in search of Jesus.","Nukw iryo shengero ribonye ko Yesu atari ho ari, n’abigishwa biwe na bo ar’ uko, rija mur’ ano mato na ryo, rijabuka i Kaperinawumu rirondera Yesu.","Quand les gens virent que Jésus n’était pas là, et ses disciples non plus, ils montèrent dans ces bateaux pour aller à Capernaüm, à la recherche de Jésus."
JHN.6.25,"When they found him on the other side of the lake, they asked him, “Rabbi, when did you get here?”","Bamubonye hakurya y’ikiyaga baramubaza, bati Mwigisha, waje ino ryari?","Ils le trouvèrent de l’autre côté du lac et lui demandèrent : Maître, quand es-tu venu ici ?"
JHN.6.26,"Jesus answered, “Very truly I tell you, you are looking for me, not because you saw the signs I performed but because you ate the loaves and had your fill.","Yesu arabishura, ati N’ukuri, n’ukuri ndababgire: Ntimundondera kuko mwabonye ibimenyetso, ariko n’uko mwariye kuri ya mitsima, mugahāga.","Jésus leur répondit : Vraiment, je vous l’assure, si vous me cherchez, ce n’est pas parce que vous avez compris le sens de mes signes miraculeux. Non ! C’est parce que vous avez mangé du pain et que vous avez été rassasiés."
JHN.6.27,"Do not work for food that spoils, but for food that endures to eternal life, which the Son of Man will give you. For on him God the Father has placed his seal of approval.”","Ntimukorere ivyo kurya biyoka, ariko mukorere ivyo kurya bihoraho bizana ubugingo budashira, ni vyo Umwana w’umuntu azobaha, kukw ari we Imana Data yashizekw ikimenyetso.","Travaillez, non pour la nourriture périssable, mais pour celle qui dure pour la vie éternelle. Cette nourriture, c’est le Fils de l’homme qui vous la donnera, car Dieu le Père lui en a accordé le pouvoir en le marquant de son sceau ."
JHN.6.28,"Then they asked him, “What must we do to do the works God requires?”","Baramubaza, bati Tugire dute ngo dukore ibikorwa vy’Imana?",– Et que devons-nous faire pour accomplir les œuvres que Dieu attend de nous ? lui demandèrent-ils encore.
JHN.6.29,"Jesus answered, “The work of God is this: to believe in the one he has sent.”","Yesu na we arabishura, at’ Igikorwa c’Imana ngiki: n’uko mwizera uwo yatumye.","– L’œuvre de Dieu, leur répondit Jésus, c’est que vous croyiez en celui qu’il a envoyé."
JHN.6.30,"So they asked him, “What sign then will you give that we may see it and believe you? What will you do?","Nuko baramubaza, bati Non’ ukora ikimenyetso ki, ngo tukirābe tukwizere? Ukora ikimeze gite?","Sur quoi, ils lui dirent : Quel signe miraculeux nous feras-tu voir pour que nous puissions croire en toi ? Que vas-tu faire ?"
JHN.6.31,Our ancestors ate the manna in the wilderness; as it is written: ‘He gave them bread from heaven to eat.’ ”,"Ba sogokuruza bacu bārīra manu mu bugaragwa, nk’uko vyanditswe ngo Yabahaye umutsima wo kurya uvuye mw ijuru.","Pendant qu’ils traversaient le désert, nos ancêtres ont mangé la manne , comme le dit ce texte de l’Ecriture : Il leur donna à manger un pain qui venait du ciel ."
JHN.6.32,"Jesus said to them, “Very truly I tell you, it is not Moses who has given you the bread from heaven, but it is my Father who gives you the true bread from heaven.","Yesu arababgira, ati N’ukuri, n’ukuri ndababgire: Si Mose yabahaye umutsima uvuye mw ijuru; Data ni we abaha umutsima w’ukuri uvuye mw ijuru.","Mais Jésus leur répondit : Vraiment, je vous l’assure : ce n’est pas Moïse qui vous a donné le pain venu du ciel, c’est mon Père qui vous donne le pain du ciel, le vrai pain."
JHN.6.33,For the bread of God is the bread that comes down from heaven and gives life to the world.”,"Kuk’ umutsima w’Imana ar’ ūmanuka uva mw ijuru, ugaha abari mw isi ubugingo.","Car le pain qui vient de Dieu, c’est celui qui descend du ciel et qui donne la vie au monde."
JHN.6.34,"“Sir,” they said, “always give us this bread.”","Baramubgira, bati Mugenzi, na ntaryo uz’ uhore uduha uwo mutsima.","– Seigneur, dirent-ils alors, donne-nous toujours de ce pain-là."
JHN.6.35,"Then Jesus declared, “I am the bread of life. Whoever comes to me will never go hungry, and whoever believes in me will never be thirsty.","Yesu arababgira, ati Ni jewe mutsima w’ubugingo: ūza kuri jewe ntazosonza na mba, kand’ ūnyizera nta ho azogira inyota na mba.","Et Jésus répondit : Moi, je suis le pain qui donne la vie. Celui qui vient à moi n’aura plus jamais faim, celui qui croit en moi n’aura plus jamais soif."
JHN.6.36,"But as I told you, you have seen me and still you do not believe.","Ariko narababgiye yuko mwāmbonye, muraheza ntimwizera.","Mais je vous l’ai déjà dit : vous avez vu, et vous ne croyez pas."
JHN.6.37,"All those the Father gives me will come to me, and whoever comes to me I will never drive away.","Ico Data ampa cose kiranshikīra, kand’ uwoza kuri jewe sinomuhinda na gatoya.","Tous ceux que le Père me donne viendront à moi, et je ne repousserai pas celui qui vient à moi."
JHN.6.38,For I have come down from heaven not to do my will but to do the will of him who sent me.,"Kuko ntākūwe mw ijuru no gukora ivyo nigombera, ariko nazanywe no gukora ivy’ uwantumye agomba.","Car si je suis descendu du ciel, ce n’est pas pour faire ce qui me plaît, mais pour accomplir la volonté de celui qui m’a envoyé."
JHN.6.39,"And this is the will of him who sent me, that I shall lose none of all those he has given me, but raise them up at the last day.","Kand’ ic’ uwantumye agomba ngiki: agomba yuko mu vyo yampaye vyose hatagira na kimwe kinzimirana, ariko ngo nze nkizure ku musi w’iherezo.","Or, celui qui m’a envoyé veut que je ne perde aucun de ceux qu’il m’a donnés, mais que je les ressuscite au dernier jour."
JHN.6.40,"For my Father’s will is that everyone who looks to the Son and believes in him shall have eternal life, and I will raise them up at the last day.”","Kukw iki ari co Data agomba: agomba yuk’ ūbona Umwana wese akamwizera, agira ubugingo budashira, nanje nkazomuzura ku musi w’iherezo.","Oui, telle est la volonté de mon Père : que tous ceux qui tournent leurs regards vers le Fils et qui croient en lui, possèdent la vie éternelle, et moi, je les ressusciterai au dernier jour."
JHN.6.41,"At this the Jews there began to grumble about him because he said, “I am the bread that came down from heaven.”","Bun’ Abayuda baramwidodombera, kuko yavuze, ati Ni jewe mutsima wamanutse uva mw ijuru.","Alors les gens se mirent à murmurer contre lui, parce qu’il avait dit : « C’est moi qui suis le pain descendu du ciel. »"
JHN.6.42,"They said, “Is this not Jesus, the son of Joseph, whose father and mother we know? How can he now say, ‘I came down from heaven’ ?”",Bat’ Uyu si we Yesu mwene Yosefu? Na se na nyina turabazi: non’ avuga ate ngo Namanutse mva mw ijuru?,"Ils disaient : Voyons, n’est-ce pas Jésus, le fils de Joseph ? Nous connaissons bien son père et sa mère ! Comment peut-il prétendre qu’il est descendu du ciel ?"
JHN.6.43,"“Stop grumbling among yourselves,” Jesus answered.","Yesu arabishura, ati Nta co mugira imyidodombo muri mwebge.",Jésus leur dit : Cessez donc de murmurer ainsi entre vous !
JHN.6.44,"“No one can come to me unless the Father who sent me draws them, and I will raise them up at the last day.",Nta n’umwe ashobora kuza kuri jewe Data yantumye atamukwegereye; nanje nzomuzura ku musi w’iherezo.,"Personne ne peut venir à moi si le Père qui m’a envoyé ne l’attire, et moi, je le ressusciterai au dernier jour."
JHN.6.45,It is written in the Prophets: ‘They will all be taught by God.’ Everyone who has heard the Father and learned from him comes to me.,"Mu majambo y’abavugishwa n’Imana handitswe, ngo Bose bazoba abigishijwe n’Imana. Uwumvise ivya Data wese akavyiga, aza kuri jewe.","Dans les écrits des prophètes , vous pouvez lire cette parole : Dieu les instruira tous . Tout homme qui écoute la voix du Père et qui est instruit par lui vient à moi."
JHN.6.46,No one has seen the Father except the one who is from God; only he has seen the Father.,"S’ukugira ngo har’ uwabonye Data, atar’ uwavuye ku Mana: uwo ni we yabonye Data.","Personne n’a jamais vu le Père, sauf celui qui est venu d’auprès de Dieu. Lui, il a vu le Père."
JHN.6.47,"Very truly I tell you, the one who believes has eternal life.","N’ukuri, n’ukuri ndababgire: Uwizera afise ubugingo budashira.","Vraiment, je vous l’assure : celui qui croit a la vie éternelle,"
JHN.6.48,I am the bread of life.,Ni jewe mutsima w’ubugingo.,car je suis le pain qui donne la vie.
JHN.6.49,"Your ancestors ate the manna in the wilderness, yet they died.","Ba sogokuruza banyu bārīra manu mu bugaragwa, barapfa:",Vos ancêtres ont bien mangé la manne dans le désert et cela ne les a pas empêchés de mourir.
JHN.6.50,"But here is the bread that comes down from heaven, which anyone may eat and not die.","uyu ni wo mutsima umanuka uva mw ijuru, ng’ umuntu awuryako ntapfe.",Mais c’est ici le pain qui descend du ciel : celui qui en mange ne mourra pas.
JHN.6.51,"I am the living bread that came down from heaven. Whoever eats this bread will live forever. This bread is my flesh, which I will give for the life of the world.”","Ni jewe mutsima w’ubugingo wamanutse uvuye mw ijuru; ni hagira ūrya kur’ uwo mutsima azohorah’ ibihe bidashira: kand’ umutsima nzobaha n’umubiri wanje, utangirwa abari mw isi ngo bagire ubugingo.","Moi, je suis le pain vivant descendu du ciel : si quelqu’un mange de ce pain-là, il vivra éternellement. Le pain que je donnerai pour que le monde vive, c’est mon propre corps ."
JHN.6.52,"Then the Jews began to argue sharply among themselves, “How can this man give us his flesh to eat?”","Abayuda batanakw ibirake, bat’ Uyu ashobora ate kuduha umubiri wiwe ngo tuwurye?","A ces mots, les Juifs se mirent à discuter vivement entre eux, disant : Comment cet homme pourrait-il nous donner son corps à manger ?"
JHN.6.53,"Jesus said to them, “Very truly I tell you, unless you eat the flesh of the Son of Man and drink his blood, you have no life in you.","Yesu arababgira, ati N’ukuri, n’ukuri ndababgire: Ni mutarya umubiri w’Umwana w’umuntu, ngo munywe amaraso yiwe, nta bugingo mwogira muri mwebge.","Alors Jésus leur dit : Oui, vraiment, je vous l’assure : si vous ne mangez pas la chair du Fils de l’homme et si vous ne buvez pas son sang, vous n’aurez pas la vie en vous."
JHN.6.54,"Whoever eats my flesh and drinks my blood has eternal life, and I will raise them up at the last day.","Ūrya umubiri wanje akanywa amaraso yanje, ni we afise ubugingo budashira, nanje nzomuzura ku musi w’iherezo.","Celui qui se nourrit de ma chair et qui boit mon sang a la vie éternelle, et moi je le ressusciterai au dernier jour."
JHN.6.55,For my flesh is real food and my blood is real drink.,"Kuk’ umubiri wanje ar’ ico kurya c’ukuri, n’amaraso yanje ar’ ico kunywa c’ukuri.",Car ma chair est vraiment une nourriture et mon sang est vraiment un breuvage.
JHN.6.56,"Whoever eats my flesh and drinks my blood remains in me, and I in them.","Ūrya umubiri wanje akanywa amaraso yanje, aguma muri jewe, nanje nkaguma muri we.","Celui qui mange ma chair et boit mon sang demeure en moi, et moi je demeure en lui."
JHN.6.57,"Just as the living Father sent me and I live because of the Father, so the one who feeds on me will live because of me.","Nk’uko Data w’ubugingo yantumye, nanje ndiho kubga Data, ni k’ūndya na we azobaho kubganje.","Le Père qui m’a envoyé a la vie en lui-même, et c’est lui qui me fait vivre ; ainsi, celui qui se nourrit de moi vivra lui aussi par moi."
JHN.6.58,"This is the bread that came down from heaven. Your ancestors ate manna and died, but whoever feeds on this bread will live forever.”","Uwo ni wo mutsima wamanutse uvuye mw ijuru, si nk’uwo ba sogokuruza banyu bāriye, ariko bagapfa; ūrya uwo mutsima azohorah’ ibihe bidashira.","C’est ici le pain descendu du ciel. Il n’est pas comme celui que vos ancêtres ont mangé ; eux, ils sont morts ; mais celui qui mange ce pain-ci vivra pour toujours."
JHN.6.59,He said this while teaching in the synagogue in Capernaum.,Ivyo yabivugiye mw isinagogi yigisha i Kaperinawumu.,Voilà ce que déclara Jésus lorsqu’il enseigna dans la synagogue de Capernaüm.
JHN.6.60,"On hearing it, many of his disciples said, “This is a hard teaching. Who can accept it?”","Nuko benshi mu bigishwa biwe bavyumvise, baravuga, bat’ Iryo jambo riragoye: har’ uworyumva akarishobora?","Après l’avoir entendu, plusieurs de ses disciples dirent : Ce langage est bien difficile à accepter ! Qui peut continuer à l’écouter ?"
JHN.6.61,"Aware that his disciples were grumbling about this, Jesus said to them, “Does this offend you?","Yesu amenye mu mutima kw abigishwa biwe bidodomba ivyo, arababaza, ati Mbeg’ ivyo birabatsitaje?",Jésus savait fort bien quels murmures ses paroles avaient soulevés parmi eux. C’est pourquoi il leur dit : Cela vous choque-t-il ?
JHN.6.62,Then what if you see the Son of Man ascend to where he was before!,None bizomera bite ni mwabona Umwana w’umuntu adūga aja iyo yahora ubga mbere?,Et si vous voyez le Fils de l’homme remonter là où il était auparavant ?
JHN.6.63,The Spirit gives life; the flesh counts for nothing. The words I have spoken to you—they are full of the Spirit and life.,"Impwemu ni zo zitera ubugingo, umubiri nta co umaze: amajambo mbabgiye n’impwemu n’ubugingo.",C’est l’Esprit qui donne la vie ; la chair à elle seule ne sert à rien. Les paroles que je vous ai dites sont Esprit et vie .
JHN.6.64,Yet there are some of you who do not believe.” For Jesus had known from the beginning which of them did not believe and who would betray him.,"Ariko muri mwebge hariho bamwe batizera. Kuko Yesu yahereye ubga mbere azi abatizera ab’ ari bo, n’ūzomugura uw’ ari we.","Hélas, il y en a parmi vous qui ne croient pas. En effet, dès le début Jésus savait quels étaient ceux qui ne croyaient pas, et qui était celui qui allait le trahir."
JHN.6.65,"He went on to say, “This is why I told you that no one can come to me unless the Father has enabled them.”","Kand’ aravuga, ati Ni co catumye mbabgira kw ata wushobora kuza kuri jewe atabihawe na Data.",Aussi ajouta-t-il : C’est bien pour cela que je vous ai dit : Personne ne peut venir à moi si cela ne lui est accordé par le Père.
JHN.6.66,From this time many of his disciples turned back and no longer followed him.,"Kuva ico gihe benshi mu bigishwa biwe bamuva inyuma, ntibāba bakijana na we.","A partir de ce moment-là, beaucoup de ses disciples l’abandonnèrent et cessèrent de l’accompagner."
JHN.6.67,"“You do not want to leave too, do you?” Jesus asked the Twelve.","Yesu abaza bamwe cumi na babiri, ati Mbega namwe muragomba kwīgīra?","Alors Jésus, se tournant vers les Douze, leur demanda : Et vous, ne voulez-vous pas aussi partir ?"
JHN.6.68,"Simon Peter answered him, “Lord, to whom shall we go? You have the words of eternal life.","Simoni Petero aramwishura, ati Tuje kwa nde ga Mugenzi? Kw ari wewe ufise amajambo y’ubugingo budashira,","Mais Simon Pierre lui répondit : Seigneur, vers qui irions-nous ? Tu as les paroles de la vie éternelle."
JHN.6.69,We have come to believe and to know that you are the Holy One of God.”,"natwe twarizeye, tumenya yuko wewe ur’ Uwera w’Imana.","Nous, nous avons mis toute notre confiance en toi et nous savons que tu es le Saint, envoyé de Dieu."
JHN.6.70,"Then Jesus replied, “Have I not chosen you, the Twelve? Yet one of you is a devil!”","Yesu aramwishura, ati Mbega si jewe nabatoranije uko mur’ icumi na babiri? Arik’ umwe muri mwebge n’umurwanizi.","– N’est-ce pas moi qui vous ai choisis tous les douze ? reprit Jésus. Et pourtant, l’un de vous est un diable."
JHN.6.71,"(He meant Judas, the son of Simon Iscariot, who, though one of the Twelve, was later to betray him.)","Yavuga Yuda Isikaryota, mwene Simoni, kukw ari we yagira az’ amugure, yar’ uwo muri bamwe cumi na babiri.","Par ces mots, il désignait Judas, fils de Simon Iscariot, l’un des Douze, qui allait le trahir."
JHN.7.1,"After this, Jesus went around in Galilee. He did not want to go about in Judea because the Jewish leaders there were looking for a way to kill him.","Hanyuma y’ivyo Yesu agendagenda i Galilaya: ntiyashaka kugendagenda i Yudaya, kukw Abayuda bārondera ingene bomwica.","Après cela, Jésus continua à parcourir la Galilée ; il voulait en effet éviter la Judée où les Juifs cherchaient à le supprimer."
JHN.7.2,"But when the Jewish Festival of Tabernacles was near,",Imisi mikuru y’Abayuda yitwa iy’ Insago yarikw irashika.,"Cependant, on se rapprochait de la fête juive des Cabanes ."
JHN.7.3,"Jesus’ brothers said to him, “Leave Galilee and go to Judea, so that your disciples there may see the works you do.","Nuko bene nyina baramubgira, bati N’uve ino, uje i Yudaya, abigishwa bawe na bo barābe ibikorwa ukora;","Ses frères lui dirent alors : Tu devrais quitter cette région et te rendre en Judée pour que, là aussi, tes disciples puissent voir les œuvres que tu accomplis."
JHN.7.4,"No one who wants to become a public figure acts in secret. Since you are doing these things, show yourself to the world.”","kukw ata wogira ico akora mu mpisho, na we ngw arondere kumenyekana. K’ukora ivyo, ni wiserure mu b’isi.","Quand on veut être connu, on n’agit pas avec tant de discrétion. Puisque tu accomplis de si grandes choses, fais en sorte que tout le monde le voie."
JHN.7.5,For even his own brothers did not believe in him.,Kuko na bene nyina na bo batāmwizera.,"En effet, les frères de Jésus eux-mêmes ne croyaient pas en lui."
JHN.7.6,"Therefore Jesus told them, “My time is not yet here; for you any time will do.","Maze Yesu arabishura, at’ Igihe canje ntikiragera, arikw igihe canyu co, cama kiriho.","Jésus leur répondit : Le moment n’est pas encore venu pour moi. En revanche, pour vous, c’est toujours le bon moment."
JHN.7.7,"The world cannot hate you, but it hates me because I testify that its works are evil.","Ab’ isi ntibabanka, ariko jewe baranyanka, kuko mbavugira ibikorwa vyabo kw ari bibi.","Le monde n’a aucune raison de vous haïr ; mais moi, il me déteste parce que je témoigne que ses actes sont mauvais."
JHN.7.8,"You go to the festival. I am not going up to this festival, because my time has not yet fully come.”","Mwebge ni mudūge kumara iyo misi mikuru, ariko jeho sindayidūgako, kukw igihe canje kitaragera.","Vous donc, allez à la fête ; pour ma part, je n’y vais pas encore car le moment n’est pas encore venu pour moi."
JHN.7.9,"After he had said this, he stayed in Galilee.","Ababgiye ivyo, aguma i Galilaya.","Après leur avoir dit cela, il resta en Galilée."
JHN.7.10,"However, after his brothers had left for the festival, he went also, not publicly, but in secret.","Bene nyina bamaze kudūga i Yerusalemu kumara iyo misi mikuru, na we aradūga, ntiyibonekeza, arikw agenda nk’uwomba.","Cependant, quand ses frères furent partis pour la fête, il s’y rendit lui aussi, mais secrètement, sans se montrer."
JHN.7.11,"Now at the festival the Jewish leaders were watching for Jesus and asking, “Where is he?”","Maz’ Abayuda bamurondera mur’ iyo misi mikuru, bati Mbega wa wundi ari hehe?","Or, pendant la fête, les Juifs le cherchaient et demandaient : Où est-il donc ?"
JHN.7.12,"Among the crowds there was widespread whispering about him. Some said, “He is a good man.” Others replied, “No, he deceives the people.”","Haba ivyongoshwe vyinshi mw ishengero bamuvuga: bamwe bati N’umuntu mwiza, abandi bat’ Oya, arazimiza abantu.","Dans la foule, les discussions allaient bon train à son sujet. Les uns disaient : C’est quelqu’un de bien. – Pas du tout, répondaient les autres : il trompe tout le monde."
JHN.7.13,But no one would say anything publicly about him for fear of the leaders.,"Ariko nta n’umwe yamuvuze atobora, kuko batinya Abayuda.","Mais, comme ils avaient tous peur des Juifs, personne n’osait parler librement de lui."
JHN.7.14,Not until halfway through the festival did Jesus go up to the temple courts and begin to teach.,"Ya misi mikuru igeze hagati, Yesu adūga mu rusengero, arigisha.","La moitié de la semaine de fête était déjà passée, quand Jésus alla au Temple et se mit à enseigner."
JHN.7.15,"The Jews there were amazed and asked, “How did this man get such learning without having been taught?”","Abayuda baratangara, bati Mbeg’ uyu yakūye ubgenge hehe, atigishijwe?","Les Juifs en étaient tout étonnés et se demandaient : Comment peut-il connaître à ce point les Ecritures, sans avoir jamais étudié ?"
JHN.7.16,"Jesus answered, “My teaching is not my own. It comes from the one who sent me.","Maze Yesu arabishura, at’ Izi nyigisho zanje s’izanje, n’iz’ uwantumye.",Jésus leur répondit : Rien de ce que j’enseigne ne vient de moi. J’ai tout reçu de celui qui m’a envoyé.
