,0,1,2
JHN.15.8,"This is to my Father’s glory, that you bear much fruit, showing yourselves to be my disciples.","Mur’ ivyo Data arashimagizwa, ni mwama cane, kandi mukaba abigishwa banje.","Si vous produisez du fruit en abondance et que vous prouvez ainsi que vous êtes vraiment mes disciples , mon Père sera glorifié aux yeux de tous."
JHN.15.9,"“As the Father has loved me, so have I loved you. Now remain in my love.","Nk’uko Data yankunze, ni ko nanje nabakunze: ni mugume mu rukundo rwanje.","Comme le Père m’a toujours aimé, moi aussi je vous ai aimés ; maintenez-vous donc dans mon amour."
JHN.15.10,"If you keep my commands, you will remain in my love, just as I have kept my Father’s commands and remain in his love.","Ni mwitondera ivyagezwe vyanje, muzoguma mu rukundo rwanje, nk’uko nanje nitondeye ivyagezwe vya Data, nkaguma mu rukundo rwiwe.","Si vous obéissez à mes commandements, vous demeurerez dans mon amour, tout comme moi-même j’ai obéi aux commandements de mon Père et je demeure dans son amour."
JHN.15.11,I have told you this so that my joy may be in you and that your joy may be complete.,"Ivyo mbibabgiye, kugira ng’umunezero wanje ube muri mwebge, kandi n’umunezero wanyu wuzuzwe.","Tout cela, je vous le dis pour que la joie qui est la mienne vous remplisse vous aussi, et qu’ainsi votre joie soit complète."
JHN.15.12,My command is this: Love each other as I have loved you.,"Ngiki icagezwe canje: ni mukundane, nk’uko nabakunze.",Voici quel est mon commandement : aimez-vous les uns les autres comme moi-même je vous ai aimés.
JHN.15.13,Greater love has no one than this: to lay down one’s life for one’s friends.,Nta wogira urukundo ruruta urw’ uk’ umuntu yigura abakunzi biwe.,Il n’y a pas de plus grand amour que de donner sa vie pour ses amis.
JHN.15.14,You are my friends if you do what I command.,"Mur’ abakunzi banje, ni mwakora ivyo mbagera.","Vous êtes mes amis, si vous faites ce que je vous commande."
JHN.15.15,"I no longer call you servants, because a servant does not know his master’s business. Instead, I have called you friends, for everything that I learned from my Father I have made known to you.","Sinkibita abashumba, kuk’ umushumba atamenya ico shebuja akora; ariko mweho nabise abakunzi, kukw ivyo numvanye Data vyose nabibamenyesheje.","Je ne vous appelle plus serviteurs, parce qu’un serviteur n’est pas mis au courant des affaires de son maître. Je vous appelle mes amis, parce que je vous ai fait part de tout ce que j’ai appris de mon Père."
JHN.15.16,"You did not choose me, but I chose you and appointed you so that you might go and bear fruit—fruit that will last—and so that whatever you ask in my name the Father will give you.","Si mwebge mwantoranije, ariko ni jewe nabatoranije, nabashizeho kugira ngo mugende murāma imbuto, kandi ngw imbuto zanyu zigumeho, kugira ngw ico muzosaba Data cose mw izina ryanje, akibahe.","Ce n’est pas vous qui m’avez choisi. Non, c’est moi qui vous ai choisis ; je vous ai donné mission d’aller, de porter du fruit, du fruit qui soit durable. Alors le Père vous accordera tout ce que vous lui demanderez en mon nom."
JHN.15.17,This is my command: Love each other.,Ivyo ndabibageze kugira ngo mukundane.,Voici donc ce que je vous commande : aimez-vous les uns les autres.
JHN.15.18,"“If the world hates you, keep in mind that it hated me first.","Isi ni yabanka, mumenye ko jewe yabanje kunyanka, itarabanka.","Si le monde a de la haine pour vous, sachez qu’il m’a haï avant vous."
JHN.15.19,"If you belonged to the world, it would love you as its own. As it is, you do not belong to the world, but I have chosen you out of the world. That is why the world hates you.","Iyo muba ab’ isi, isi iba ikunze icayo, maze kuko mutar’ ab’ isi, ariko nabatoranije mu b’isi, ni co gituma isi ibanka.","Si vous faisiez partie du monde, il vous aimerait parce que vous lui appartiendriez. Mais vous n’appartenez pas au monde parce que je vous ai choisis du milieu du monde ; c’est pourquoi il vous poursuit de sa haine."
JHN.15.20,"Remember what I told you: ‘A servant is not greater than his master.’ If they persecuted me, they will persecute you also. If they obeyed my teaching, they will obey yours also.","Mwibuke rya jambo nababgiye, nt’ Umushumba ntaruta shebuja; namba bārampamye, namwe bazobahama; namba bāritondeye ijambo ryanje, n’iryanyu bazoryitondera.","Souvenez-vous de ce que je vous ai déjà dit : Le serviteur n’est jamais plus grand que son maître. S’ils m’ont persécuté, ils vous persécuteront vous aussi ; s’ils ont gardé mes paroles, ils garderont aussi les vôtres."
JHN.15.21,"They will treat you this way because of my name, for they do not know the one who sent me.","Arikw ivyo vyose bazobibagirira babahōra izina ryanje, kuko batazi uwantumye.","Mais c’est à cause de moi qu’ils agiront ainsi, parce qu’ils ne connaissent pas celui qui m’a envoyé."
JHN.15.22,"If I had not come and spoken to them, they would not be guilty of sin; but now they have no excuse for their sin.","Iyo ntaba naraje ngo ngire ico mbabarira, nta caha baba bafise, ariko none ntibari n’ico bireguza icaha cabo.","Si je n’étais pas venu et si je ne leur avais pas parlé, ils ne seraient pas coupables, mais maintenant, leur péché est sans excuse."
JHN.15.23,Whoever hates me hates my Father as well.,Ūnyanka aba yanka na Data.,Celui qui a de la haine pour moi en a aussi pour mon Père.
JHN.15.24,"If I had not done among them the works no one else did, they would not be guilty of sin. As it is, they have seen, and yet they have hated both me and my Father.","Iyo ntaba narakoreye ibikorwa muri bo bitigeze gukorwa n’uwundi, nta caha baba bafise, ariko noneho twe na Data baratubonye, baraheza baratwanka.","Si je n’avais pas accompli au milieu d’eux des œuvres que jamais personne d’autre n’a faites, ils ne seraient pas coupables. Mais maintenant, bien qu’ils les aient vues, ils continuent à nous haïr, et moi, et mon Père."
JHN.15.25,But this is to fulfill what is written in their Law: ‘They hated me without reason.’,"Ariko vyabaye birtyo kugira ngw ijambo ryanditswe mu vyagezwe vyabo rishike, ngo Bānyankiye ubusa.",Mais il fallait bien que s’accomplisse cette parole écrite dans leur Loi : Ils m’ont haï sans raison .
JHN.15.26,"“When the Advocate comes, whom I will send to you from the Father—the Spirit of truth who goes out from the Father—he will testify about me.","Arik’ Umwitsa ah’ azozira, uwo nzobarungikira ava kuri Data, ni we Mpwemu w’ukuri akomoka kuri Data, uwo ni we azonshingira intahe,","Quand le Défenseur en justice sera venu, celui que je vous enverrai d’auprès du Père, l’Esprit de vérité qui vient du Père, il rendra lui-même témoignage de moi."
JHN.15.27,"And you also must testify, for you have been with me from the beginning.","kandi namwe nyene muranshingira intahe, kuko mwari kumwe nanje uhereye mbere na mbere.","Et vous, à votre tour, vous serez mes témoins, parce que depuis le commencement vous avez été à mes côtés."
JHN.16.1,“All this I have told you so that you will not fall away.,"Ico mbabaririye ivyo, n’ukugira ngo ntimuze mutsitazwe.",Je vous ai dit tout cela pour que vous soyez préservés de toute chute.
JHN.16.2,"They will put you out of the synagogue; in fact, the time is coming when anyone who kills you will think they are offering a service to God.","Bazobaca mu masinagogi, kand’ igihe kigiye kuza, ūzobīca wese azogira ngw agiriye Imana ikimazi.","Car on vous exclura des synagogues , et même l’heure vient où tous ceux qui vous mettront à mort s’imagineront rendre un culte à Dieu."
JHN.16.3,They will do such things because they have not known the Father or me.,"Kand’ ivyo bazobikora kuko batamenye Data, nanje ntibāmmenye.",Ils en arriveront là parce qu’ils n’ont jamais connu ni mon Père ni moi.
JHN.16.4,"I have told you this, so that when their time comes you will remember that I warned you about them. I did not tell you this from the beginning because I was with you,","Ico mbabaririye ivyo, n’ukugira ngw igihe cavyo ni cashika, muze muvyibuke ko nanje nabibabgiye. Uhereye ubga mbere sinaribgabibabgire, kuko nari nkiri kumwe namwe.","Je vous ai annoncé tout cela d’avance pour que, lorsque l’heure sera venue pour eux d’agir ainsi, vous vous rappeliez que je vous l’ai prédit. Je ne vous en ai pas parlé dès le début, parce que j’étais encore avec vous."
JHN.16.5,"but now I am going to him who sent me. None of you asks me, ‘Where are you going?’","None ngira ngende ku wantumye, kandi nta n’umwe muri mwebge arushe ambaza at’ Uja hehe?","Maintenant, je vais auprès de celui qui m’a envoyé, et aucun de vous ne me demande où je vais ?"
JHN.16.6,"Rather, you are filled with grief because I have said these things.","Ariko kuko mbabariye ivyo, umubabaro waciye wuzura mu mitima yanyu.","Mais, à cause de ce que je vous ai dit, la tristesse vous a envahis."
JHN.16.7,"But very truly I tell you, it is for your good that I am going away. Unless I go away, the Advocate will not come to you; but if I go, I will send him to you.","Ariko jewe ndababgira ukuri: Ikizogira ico kibamarira, n’uko jewe ngenda; kuko ni ntagenda, Umwitsa ntazoza kuri mwebge: ariko ni nagenda nzomubarungikira.","Pourtant, c’est la vérité que je vais vous dire : il vaut mieux pour vous que je m’en aille. En effet, si je ne m’en vais pas, le Défenseur en justice ne viendra pas à vous. Mais si je m’en vais, alors je vous l’enverrai."
JHN.16.8,"When he comes, he will prove the world to be in the wrong about sin and righteousness and judgment:","Uwo ni yaza, azohinyuza ab’ isi, abemeze ivy’ icaha, n’ivy’ ukugororoka, n’ivy’ amateka;","Et quand il sera venu, il produira la preuve que le monde s’égare au sujet du péché, de ce qui est juste et du jugement :"
JHN.16.9,"about sin, because people do not believe in me;","ivy’ icaha, kuko batānyizeye,","au sujet du péché, parce que le monde ne croit pas en moi ;"
JHN.16.10,"about righteousness, because I am going to the Father, where you can see me no longer;","ivy’ ukugororoka, kuko nja kwa Data, kandi namwe muzoba mutakimbona,","au sujet de ce qui est juste, parce que je m’en vais auprès du Père et que vous ne me verrez plus ;"
JHN.16.11,"and about judgment, because the prince of this world now stands condemned.","ivy’ amateka, kuk’ umwami w’iyi si yaciriwekw iteka.","et au sujet du jugement, parce que le dominateur de ce monde est d’ores et déjà condamné."
JHN.16.12,"“I have much more to say to you, more than you can now bear.","Nari ngifise vyinshi vyo kubabgira, ariko ntimushobora kuvyihanganira ubu.","J’ai encore beaucoup de choses à vous dire, mais elles sont encore trop lourdes à porter pour vous."
JHN.16.13,"But when he, the Spirit of truth, comes, he will guide you into all the truth. He will not speak on his own; he will speak only what he hears, and he will tell you what is yet to come.","Arik’ uwo Mpwemu w’ukuri ni yaza, azobarōngōra abashitse ku kuri kwose, kukw atazovuga ivyo yigeneye, arikw ivy’ azokwumva vyose ni vyo azovuga, kand’ azobamenyesha ibigira bize.","Quand l’Esprit de vérité sera venu, il vous conduira dans la vérité tout entière, car il ne parlera pas de lui-même, mais tout ce qu’il aura entendu, il le dira, et il vous annoncera les choses à venir."
JHN.16.14,He will glorify me because it is from me that he will receive what he will make known to you.,"Uwo azoshimagiza jewe, kukw azokwābīra ku vyanje, akabibamenyesha.","Il manifestera ma gloire, car il puisera dans ce qui est à moi et vous l’annoncera."
JHN.16.15,All that belongs to the Father is mine. That is why I said the Spirit will receive from me what he will make known to you.”,"Ivyo Data afise vyose n’ivyanje, ni co gitumye mvuga, nti Yābīra ku vyanje, akabibamenyesha.",Tout ce que le Père possède m’appartient à moi aussi ; voilà pourquoi je vous dis qu’il puisera dans ce qui est à moi et vous l’annoncera.
JHN.16.16,"Jesus went on to say, “In a little while you will see me no more, and then after a little while you will see me.”","Hasigaye igihe gito ntimube mukimbona, maze hazoca ikindi gihe gito musubire kumbona.","Dans peu de temps, vous ne me verrez plus ; puis encore un peu de temps, et vous me reverrez."
JHN.16.17,"At this, some of his disciples said to one another, “What does he mean by saying, ‘In a little while you will see me no more, and then after a little while you will see me,’ and ‘Because I am going to the Father’ ?”","Bamwe mu bigishwa biwe barabazanya, bati Mbeg’ ivyo atubgiye n’ibiki ngo Hasigaye igihe gito ntimube mukimbona, ngo Maze hazoca ikindi gihe gito musubire kumbona, kandi ngo Kuko nja kwa Data?","Certains de ses disciples se demandèrent alors entre eux : Qu’est-ce qu’il veut nous dire par là : « Dans peu de temps, vous ne me verrez plus ; encore un peu de temps, et vous me reverrez » ? Et aussi lorsqu’il affirme : « Je vais au Père » ?"
JHN.16.18,"They kept asking, “What does he mean by ‘a little while’ ? We don’t understand what he is saying.”","Kandi bat’ Ivyo atubgiye n’ibiki, ngw Igihe gito? Ntitumenye ico avuze ic’ ari co.",Ils ajoutèrent : Que signifie ce « peu de temps » dont il parle ? Nous ne voyons pas ce qu’il veut dire.
JHN.16.19,"Jesus saw that they wanted to ask him about this, so he said to them, “Are you asking one another what I meant when I said, ‘In a little while you will see me no more, and then after a little while you will see me’?","Yesu amenya ko bagomba kumubaza, arababaza, ati Mbega mubazanya ic’ ari co, ko mbabariye nti Hasigaye igihe gito ntimube mukimbona, nti Maze hazoca ikindi gihe gito musubire kumbona?","Jésus comprit qu’ils voulaient l’interroger ; il leur dit : Vous êtes en train de vous demander entre vous ce que j’ai voulu dire par ces mots : « Dans peu de temps, vous ne me verrez plus ; encore un peu de temps, et vous me reverrez. »"
JHN.16.20,"Very truly I tell you, you will weep and mourn while the world rejoices. You will grieve, but your grief will turn to joy.","N’ukuri, n’ukuri ndababgire: Mweho muzorira muboroge, arikw ab’ isi bo bazonezerwa; mweho muzobabara, arik’ umubabaro wanyu uzocika umunezero.","Vraiment, je vous l’assure, vous allez pleurer et vous lamenter, tandis que les gens de ce monde jubileront. Vous serez accablés de douleur, mais votre douleur se changera en joie."
JHN.16.21,A woman giving birth to a child has pain because her time has come; but when her baby is born she forgets the anguish because of her joy that a child is born into the world.,"Umugore iy’ aramutswe, aja mu mubabaro, kukw igihe ciwe kigeze, arikw iy’ umwana amaze kuvuka ntaba acibuka kugorwa kwiwe, kukw anezerejwe n’uk’ umuntu avutse mw isi.","Lorsqu’une femme accouche, elle éprouve de la douleur parce que c’est le moment ; mais à peine a-t-elle donné le jour au bébé, qu’elle oublie son épreuve à cause de sa joie d’avoir mis au monde un enfant."
JHN.16.22,"So with you: Now is your time of grief, but I will see you again and you will rejoice, and no one will take away your joy.","Ni ko namwe muri mu mubabaro, ariko nzosubira kubabona, kand’ imitima yanyu izonezerwa, umunezero wanyu nta n’umwe azowubanyaga.","Vous, de même, vous êtes maintenant dans la douleur, mais je vous verrai de nouveau : alors votre cœur sera rempli de joie, et cette joie, personne ne pourra vous l’enlever."
JHN.16.23,"In that day you will no longer ask me anything. Very truly I tell you, my Father will give you whatever you ask in my name.","Kur’ uwo musi nta na kimwe muzombaza. N’ukuri, n’ukuri ndababgire: Ni hagira ico musaba Data cose azokibaha mw izina ryanje.","Quand ce jour viendra, vous ne me poserez plus aucune question. Oui, vraiment, je vous l’assure : tout ce que vous demanderez au Père en mon nom, il vous l’accordera ."
JHN.16.24,"Until now you have not asked for anything in my name. Ask and you will receive, and your joy will be complete.","Kugeza ubu nta co mwasavye mw izina ryanje; musabe muzohabga, ng’umunezero wanyu wuzuzwe.","Jusqu’à présent vous n’avez rien demandé en mon nom. Demandez, et vous recevrez, pour que votre joie soit complète."
JHN.16.25,"“Though I have been speaking figuratively, a time is coming when I will no longer use this kind of language but will tell you plainly about my Father.","Ivyo mbibabgiriye mu migani, arikw igihe kizoza sinzoba ngisubira kuvuganira namwe mu migani, mugabo nzobabgira ivya Data mbifoboye.",Je vous ai dit tout cela de manière figurée . L’heure vient où je ne vous parlerai plus de cette manière ; je vous annoncerai en toute clarté ce qui concerne le Père.
JHN.16.26,In that day you will ask in my name. I am not saying that I will ask the Father on your behalf.,"Kur’ uwo musi muzosaba mw izina ryanje, kandi simbabgira ngo nzobasabira Data.","Ce jour-là, vous adresserez vos demandes au Père en mon nom. Et je ne vous dis même pas que j’interviendrai en votre faveur auprès du Père."
JHN.16.27,"No, the Father himself loves you because you have loved me and have believed that I came from God.","Kuko Data na we ubgiwe abakunda, kuko mwankunze kandi mwizeye ko naturutse ku Mana.",Car le Père lui-même vous aime parce que vous m’aimez et que vous avez cru que je suis venu de Dieu.
JHN.16.28,I came from the Father and entered the world; now I am leaving the world and going back to the Father.”,"Navuye kwa Data, nza mw isi; ikindi, isi ndiko ndayivamwo, nje kwa Data.","C’est vrai : Oui, je suis venu du Père et je suis venu dans le monde. Maintenant, je quitte le monde et je retourne auprès du Père."
JHN.16.29,"Then Jesus’ disciples said, “Now you are speaking clearly and without figures of speech.","Abigishwa biwe baravuga, bat’ Ubuho urabifoboye, nta mugani uduciriye.","– Maintenant enfin, s’écrièrent ses disciples, tu nous parles en toute clarté, et non plus de manière figurée."
JHN.16.30,Now we can see that you know all things and that you do not even need to have anyone ask you questions. This makes us believe that you came from God.”,"Ubuho tumenye k’uzi vyose, kandi ko kubgawe utarinda ko hogira ūkubaza; ni co gituma twizera ko waturutse ku Mana.","A présent, nous savons que tu sais tout et que tu connais d’avance les questions que l’on aimerait te poser. C’est pourquoi nous croyons que tu viens de Dieu."
JHN.16.31,“Do you now believe?” Jesus replied.,"Yesu arabishura, ati Mbega noneho murizeye?","– Ainsi donc, leur répondit Jésus, vous croyez à présent !"
JHN.16.32,"“A time is coming and in fact has come when you will be scattered, each to your own home. You will leave me all alone. Yet I am not alone, for my Father is with me.","Igihe kigira kize, mbere kirashitse, aho muhava musābagira, umuntu wese aje mu vyiwe, munte jenyene, ariko sindi jenyene, kuko Data ari kumwe nanje.","Mais l’heure vient, et elle est déjà là, où vous serez dispersés chacun de son côté, et où vous me laisserez seul. Mais je ne suis pas seul, puisque le Père est avec moi."
JHN.16.33,"“I have told you these things, so that in me you may have peace. In this world you will have trouble. But take heart! I have overcome the world.”","Ivyo mbibabgiye, kugira ngo mugire amahoro muri jewe. Mw isi muri n’amarushwa, ariko ni muhūmure, jewe naranesheje isi.","Il fallait que je vous dise aussi cela pour que vous trouviez la paix en moi. Dans le monde, vous aurez à souffrir bien des afflictions. Mais courage ! Moi, j’ai vaincu le monde."
JHN.17.1,"After Jesus said this, he looked toward heaven and prayed: “Father, the hour has come. Glorify your Son, that your Son may glorify you.","Yesu avuze ivyo, arangamiza mw ijuru, ati Data, igihe kirashitse: shimagiza Umwana wawe, ng’ Umwana agushimagize;","Après avoir ainsi parlé, Jésus leva les yeux au ciel et dit : Père, l’heure est venue : Fais éclater la gloire de ton Fils, pour qu’à son tour, le Fils fasse éclater ta gloire."
JHN.17.2,For you granted him authority over all people that he might give eternal life to all those you have given him.,"nk’uko wamuhaye ububasha ku bafise umubiri bose, ngw abo wamuhaye bose abahe ubugingo budashira.","En effet, tu lui as donné autorité sur l’humanité entière afin qu’il donne la vie éternelle à tous ceux que tu lui as donnés."
JHN.17.3,"Now this is eternal life: that they know you, the only true God, and Jesus Christ, whom you have sent.","Ubu ni bgo bugingo budashira, ko bamenya wewe, Imana yonyene y’ukuri, n’uwo watumye, Yesu Kristo.","Or, la vie éternelle consiste à te connaître, toi le Dieu unique et véritable, et celui que tu as envoyé : Jésus-Christ."
JHN.17.4,I have brought you glory on earth by finishing the work you gave me to do.,"Nagushimagije mw isi, nnonosoye igikorwa wampaye gukora.",J’ai fait connaître ta gloire sur la terre en accomplissant l’œuvre que tu m’avais confiée.
JHN.17.5,"And now, Father, glorify me in your presence with the glory I had with you before the world began.","Na none Data, unshimagizanye nawe, unshimagirishije bga bgiza nahoranye ndi kumwe nawe, isi itararemwa.","Et maintenant, Père, revêts-moi de gloire en ta présence, donne-moi cette gloire que j’avais déjà auprès de toi avant les origines du monde."
JHN.17.6,“I have revealed you to those whom you gave me out of the world. They were yours; you gave them to me and they have obeyed your word.,"Nahishuriye izina ryawe abantu wampaye mu b’isi; bar’ abawe, urabampa, kandi bitondeye ijambo ryawe.","Je t’ai fait connaître aux hommes que tu as pris du monde pour me les donner. Ils t’appartenaient, et tu me les as donnés : ils ont gardé ta Parole."
JHN.17.7,Now they know that everything you have given me comes from you.,None bamenye yukw ivyo wampaye vyose biva kuri wewe:,Maintenant ils savent que tout ce que tu m’as donné vient de toi ;
JHN.17.8,"For I gave them the words you gave me and they accepted them. They knew with certainty that I came from you, and they believed that you sent me.","kukw amajambo wampaye nayabahaye, na bo bakayākīra, bakamenya vy’ukuri ko naturutse kuri wewe; bakizera kw ari wewe wantumye.",car je leur ai transmis fidèlement le message que tu m’avais confié ; ils l’ont reçu. Aussi ont-ils reconnu avec certitude que je suis venu d’auprès de toi ; et ils ont cru que c’est toi qui m’as envoyé.
JHN.17.9,"I pray for them. I am not praying for the world, but for those you have given me, for they are yours.","Ndabasabira; sinsabira ab’ isi, ariko nsabira abo wampaye, kukw ar’ abawe;","Je te prie pour eux. Je ne te prie pas pour le monde, mais pour ceux que tu m’as donnés parce qu’ils t’appartiennent."
JHN.17.10,"All I have is yours, and all you have is mine. And glory has come to me through them.","kand’ ivyanje vyose n’ivyawe, n’ivyawe na vyo n’ivyanje, kandi nashimagijwe muri bo.","Car tout ce qui est à moi est à toi, comme tout ce qui est à toi est à moi. Ma gloire rayonne en eux."
JHN.17.11,"I will remain in the world no longer, but they are still in the world, and I am coming to you. Holy Father, protect them by the power of your name, the name you gave me, so that they may be one as we are one.","Sinkiri mw isi, ariko bo bari mw isi, nanje ndaje kuri wewe. Data wera, ubazigamire mw izina ryawe wampaye, ngo babe umwe nk’uko natwe turi.","Bientôt, je ne serai plus dans le monde, car je vais à toi, mais eux, ils vont rester dans le monde. Père saint, garde-les par le pouvoir de ton nom, celui que tu m’as donné , pour qu’ils soient un comme nous le sommes."
JHN.17.12,"While I was with them, I protected them and kept them safe by that name you gave me. None has been lost except the one doomed to destruction so that Scripture would be fulfilled.","Nkiri kumwe na bo, nabazigamiye mw izina ryawe wampaye. Narabashibamyeko, kandi nta n’umwe muri bo yapfuye rubi, atari wa mwana wo gupfa rubi, kugira ngw ivyanditswe bishike.","Aussi longtemps que j’étais parmi eux, je les ai gardés par le pouvoir de ton nom , ce nom que tu m’as donné ; je les ai protégés et aucun d’eux ne s’est perdu (sauf celui qui devait se perdre pour que s’accomplisse l’Ecriture)."
JHN.17.13,"“I am coming to you now, but I say these things while I am still in the world, so that they may have the full measure of my joy within them.","Ariko none ndaje kuri wewe, kand’ ibi mbivuga ndi mw isi, kugira ngo bagire umunezero wanje wuzure muri bo.","A présent, je retourne auprès de toi, et je dis tout cela pendant que je suis encore dans le monde, pour qu’ils possèdent en eux cette joie qui est la mienne, une joie parfaite."
JHN.17.14,"I have given them your word and the world has hated them, for they are not of the world any more than I am of the world.","Nabahaye ijambo ryawe; kand’ ab’ isi barabanka, kukw atar’ ab’ isi, nk’uko nanje ntar’ uw’ isi.","Je leur ai donné ta Parole, et le monde les a pris en haine parce qu’ils ne lui appartiennent pas, comme moi-même je ne lui appartiens pas."
JHN.17.15,My prayer is not that you take them out of the world but that you protect them from the evil one.,"Singusaba ng’ ubakūre mw isi, ariko ng’ ubarinde wa Mubi.","Je ne te demande pas de les retirer du monde, mais de les préserver du diable ."
JHN.17.16,"They are not of the world, even as I am not of it.","S’ab’ isi, nk’uko nanje ntar’ uw’ isi.","Ils n’appartiennent pas au monde, comme moi-même je ne lui appartiens pas."
