,0,1,2
MRK.8.7,They had a few small fish as well; he gave thanks for them also and told the disciples to distribute them.,"Kandi bāri bafise udufi duke; araduhezagira, avuga ko batubagaburira na two.",Ils avaient aussi quelques petits poissons. Jésus prononça la prière de bénédiction pour les poissons et dit à ses disciples de les distribuer également.
MRK.8.8,The people ate and were satisfied. Afterward the disciples picked up seven basketfuls of broken pieces that were left over.,"Bararya, barahāga, batororokanya utumanyagu tw’imisigazwa, twuzura ibivumvu ndwi.",Tout le monde mangea à satiété. On ramassa sept corbeilles des morceaux qui restaient.
MRK.8.9,"About four thousand were present. After he had sent them away,",Bāri nk’ibihumbi bine; arabasezera.,Il y avait là environ quatre mille hommes. Ensuite Jésus les congédia.
MRK.8.10,he got into the boat with his disciples and went to the region of Dalmanutha.,"Uwo mwanya atambukira mu bgato, bo n’abigishwa biwe, aja ahēgereye i Dalamanuta.","Aussitôt après, il monta dans le bateau avec ses disciples et se rendit dans la région de Dalmanoutha ."
MRK.8.11,"The Pharisees came and began to question Jesus. To test him, they asked him for a sign from heaven.","Haza Abafarisayo, batangura kumuhāririza, bamuronderakw ikimenyetso kiva mw ijuru, bamugeza.",Des pharisiens arrivèrent et engagèrent une discussion avec lui. Ils lui demandaient de leur faire voir un signe miraculeux qui viendrait du ciel : ils lui tendaient un piège.
MRK.8.12,"He sighed deeply and said, “Why does this generation ask for a sign? Truly I tell you, no sign will be given to it.”","Yitsa umutima cane, ati N’iki gitumye ab’iki gihe barondera ikimenyetso? Ndababgira ukuri ab’iki gihe bakazohabga ikimenyetso?","Jésus poussa un profond soupir et dit : Pourquoi les gens de notre temps réclament-ils un signe miraculeux ? Vraiment, je vous l’assure : il ne leur en sera accordé aucun !"
MRK.8.13,"Then he left them, got back into the boat and crossed to the other side.","Abasiga hano, yongera gutambukira mu bgato, ajabuka hakurya.","Il les quitta, remonta dans le bateau et partit pour l’autre rive."
MRK.8.14,"The disciples had forgotten to bring bread, except for one loaf they had with them in the boat.","Kandi bāri bibagiye gutekera imitsima, nta yo bāri bafise mu bgato, atar’ irobe rimwe.",Les disciples avaient oublié d’emporter du pain ; ils n’en avaient qu’un seul avec eux dans le bateau.
MRK.8.15,"“Be careful,” Jesus warned them. “Watch out for the yeast of the Pharisees and that of Herod.”","Arabihanikiriza, ati Mumenye, mwirinde umwambiro w’Abafarisayo n’umwambiro wa Herode.","Or, Jésus leur recommanda : Faites bien attention : gardez-vous du levain des pharisiens et de celui d’ Hérode !"
MRK.8.16,"They discussed this with one another and said, “It is because we have no bread.”","Bībūranya muri bo, bati Ntidufise imitsima.",Les disciples discutaient entre eux : Il dit cela parce que nous n’avons pas de pain !
MRK.8.17,"Aware of their discussion, Jesus asked them: “Why are you talking about having no bread? Do you still not see or understand? Are your hearts hardened?","Yesu arabimenya, arababaza, ati N’iki gitumye mwībūranya ngo nta mitsima mufise? Ntimuraruha mubimenya canke mubitahura? Mbega mufise imitima ikomantaye?","Jésus, sachant ce qui se passait, leur dit : Vous discutez parce que vous n’avez pas de pain. Pourquoi ? Ne comprenez-vous pas encore et ne saisissez-vous pas ? Votre intelligence est-elle aveuglée ?"
MRK.8.18,"Do you have eyes but fail to see, and ears but fail to hear? And don’t you remember?","Amaso ko muyafise ntimuruha mubona? Mufise amatwi, ntimwumva, kandi ntimwibuka?","Avez-vous des yeux pour ne pas voir, des oreilles pour ne pas entendre ? Ne vous souvenez-vous pas :"
MRK.8.19,"When I broke the five loaves for the five thousand, how many basketfuls of pieces did you pick up?” “Twelve,” they replied.","Hamwe namanyagurira ya mitsima itanu ibihumbi bitanu, mwatororokanije ibisimbo bingahe vyuzuye utumanyagu? Baramwishura, bati N’icumi na bibiri.","quand j’ai partagé les cinq pains entre les cinq mille hommes, combien de paniers pleins de morceaux avez-vous emportés ? – Douze, répondirent-ils."
MRK.8.20,"“And when I broke the seven loaves for the four thousand, how many basketfuls of pieces did you pick up?” They answered, “Seven.”","Ati Kandi hamwe namanyagurira ya mitsima ndwi ibihumbi bine, mwatororokanije ibivumvu bingahe vyuzuye utumanyagu? Baramwishura, bati N’indwi.","– Et quand j’ai partagé les sept pains entre les quatre mille hommes, combien de corbeilles pleines de morceaux avez-vous emportées ? – Sept, dirent-ils."
MRK.8.21,"He said to them, “Do you still not understand?”","Arababaza, ati Ntimuraruha mubitahura?",Alors il ajouta : Vous ne comprenez toujours pas ?
MRK.8.22,"They came to Bethsaida, and some people brought a blind man and begged Jesus to touch him.","Baraza bashika i Betsayida. Bamuzanira impumyi, baramwinginga ngw ayikoreko.",Ils arrivèrent à Bethsaïda. On amena un aveugle à Jésus et on le supplia de le toucher.
MRK.8.23,"He took the blind man by the hand and led him outside the village. When he had spit on the man’s eyes and put his hands on him, Jesus asked, “Do you see anything?”","Afata iyo mpumyi ukuboko, ayikūra mu mihana, acira amate mu maso yayo, ayirambikakw ibiganza, arayibaza, ati Har’ ico ubona?","Jésus prit l’aveugle par la main et le conduisit hors du village, puis il lui mouilla les yeux avec sa salive, lui imposa les mains et lui demanda : Est-ce que tu vois quelque chose ?"
MRK.8.24,"He looked up and said, “I see people; they look like trees walking around.”","Iraramura amaso, iramwishura, iti Ndabona abantu kuko mbona ibisa n’ibiti bigendagenda.","L’aveugle regarda et répondit : J’aperçois des hommes, mais je les vois comme des arbres qui marchent."
MRK.8.25,"Once more Jesus put his hands on the man’s eyes. Then his eyes were opened, his sight was restored, and he saw everything clearly.","Yongera kurambika ibiganza ku maso yayo, iritegereza, irakira, yihweza vyose neza.",Jésus posa de nouveau ses mains sur les yeux de l’aveugle. Alors celui-ci vit clair ; il était guéri et voyait tout distinctement.
MRK.8.26,"Jesus sent him home, saying, “Don’t even go into the village.”","Amurungika i we, ati Ntuje no mur’ iyi mihana.",Jésus le renvoya chez lui en lui disant : Ne rentre pas dans le village !
MRK.8.27,"Jesus and his disciples went on to the villages around Caesarea Philippi. On the way he asked them, “Who do people say I am?”","Yesu avanayo n’abigishwa biwe, aja mu mihana y’i Kayisariya mu bga Filipo: bari mu nzira, abaza abigishwa biwe, at’ Abantu bagira ngo ndi nde?","Jésus s’en alla, accompagné de ses disciples, et se rendit dans les villages autour de Césarée de Philippe . En chemin, il interrogea ses disciples : Que disent les gens à mon sujet ? Qui suis-je d’après eux ?"
MRK.8.28,"They replied, “Some say John the Baptist; others say Elijah; and still others, one of the prophets.”","Baramwishura, bati Bagira ng’ uri Yohana Umubatizi, abandi ng’ uri Eliya, abandi ng’ ur’ umwe mu bavugishwa n’Imana.","Ils lui répondirent : Pour les uns, tu es Jean-Baptiste ; pour d’autres, Elie ; pour d’autres encore, l’un des prophètes."
MRK.8.29,"“But what about you?” he asked. “Who do you say I am?” Peter answered, “You are the Messiah.”","Na we arababaza, at’ Ariko mweho mugira ngo ndi nde? Petero aramwishura, at’ Uri Kristo.","Alors il leur demanda : Et vous, qui dites-vous que je suis ? Pierre lui répondit : Tu es le Messie."
MRK.8.30,Jesus warned them not to tell anyone about him.,Arabihanikiriza ngo ntihagire umuntu babgira ivyiwe.,Il leur ordonna de ne le dire à personne.
MRK.8.31,"He then began to teach them that the Son of Man must suffer many things and be rejected by the elders, the chief priests and the teachers of the law, and that he must be killed and after three days rise again.","Atangura kubigisha, at’ Umwana w’umuntu akwiye kuzobabazwa uburyo bginshi, no kuzokwankwa n’abashingantahe n’abaherezi bakuru n’abanyabgenge b’ivyanditswe, no kuzokwicwa, maze hashize imisi itatu akazuka.","Et il commença à leur enseigner que le Fils de l’homme devait beaucoup souffrir, être rejeté par les responsables du peuple, les chefs des prêtres et les spécialistes de la Loi ; il devait être mis à mort et ressusciter trois jours après."
MRK.8.32,"He spoke plainly about this, and Peter took him aside and began to rebuke him.","Avuga iryo jambo adakingitiranije. Petero aramwihererana, atangura kumwāmira.",Il leur dit tout cela très clairement. Alors Pierre le prit à part et se mit à lui faire des reproches.
MRK.8.33,"But when Jesus turned and looked at his disciples, he rebuked Peter. “Get behind me, Satan!” he said. “You do not have in mind the concerns of God, but merely human concerns.”","Arahindukira, abona abigishwa biwe, akankamira Petero, ati Herēra inyuma yanje, Satani, kukw ivy’ Imana atari vyo ubabaye, ariko n’ivy’ abantu.","Mais Jésus se retourna, regarda ses disciples et reprit Pierre sévèrement : Arrière, « Satan » ! Eloigne-toi de moi ! Car tes pensées ne sont pas celles de Dieu ; ce sont des pensées tout humaines."
MRK.8.34,Then he called the crowd to him along with his disciples and said: “Whoever wants to be my disciple must deny themselves and take up their cross and follow me.,"Ahamagara ishengero bo n’abigishwa biwe, arababgira, at’ Umuntu ni yagomba kunkurikira, ni yiyanke, yikorere umusaraba wiwe, ankurikire;","Là-dessus, Jésus appela la foule ainsi que ses disciples et leur dit : Si quelqu’un veut me suivre, qu’il renonce à lui-même, qu’il se charge de sa croix et qu’il me suive."
MRK.8.35,"For whoever wants to save their life will lose it, but whoever loses their life for me and for the gospel will save it.","kuk’ ūgomba gukiza ubugingo bgiwe azobubura, arik’ ūzoheba ubugingo bgiwe kubganje no kubg’ ubutumwa bgiza, azobukiza.","En effet, celui qui est préoccupé de sauver sa vie la perdra ; mais celui qui perdra sa vie à cause de moi et de l’Evangile, la sauvera."
MRK.8.36,"What good is it for someone to gain the whole world, yet forfeit their soul?","Kand’ umuntu vyomumarira iki kwunguka ivyo mw isi vyose, ni yakwa ubugingo bgiwe kw iciru?","Si un homme parvenait à posséder le monde entier, à quoi cela lui servirait-il, s’il perd sa vie ?"
MRK.8.37,Or what can anyone give in exchange for their soul?,Mbeg’ umuntu yotanga iki ngw acungure ubugingo bgiwe?,Et que peut-on donner pour racheter sa vie ?
MRK.8.38,"If anyone is ashamed of me and my words in this adulterous and sinful generation, the Son of Man will be ashamed of them when he comes in his Father’s glory with the holy angels.”","Kuk’ umuntu wese bizotera isoni kunyemera no kwemera amajambo yanje mur’ iki gihe c’ubusambanyi kandi c’ikinyavyaha, n’Umwana w’umuntu bizomutera isoni kumwemera, ah’ azozira afise ubgiza bga Se, azananye n’abamarayika bera.","Si quelqu’un a honte de moi et de mes paroles au milieu des hommes de ce temps, qui sont infidèles à Dieu et qui transgressent sa Loi , le Fils de l’homme , à son tour, aura honte de lui quand il viendra dans la gloire de son Père avec les saints anges ."
MRK.9.1,"And he said to them, “Truly I tell you, some who are standing here will not taste death before they see that the kingdom of God has come with power.”","Arababgira, ati Ndababgira ukuri: mur’ aba bahagaze hano harimwo bamwe batazobona urupfu gushitsa aho bazobonera ubgami bg’Imana buzananye n’ubushobozi.","Et il ajouta : Vraiment, je vous le déclare, quelques-uns de ceux qui sont ici présents ne mourront pas avant d’avoir vu le règne de Dieu venir avec puissance."
MRK.9.2,"After six days Jesus took Peter, James and John with him and led them up a high mountain, where they were all alone. There he was transfigured before them.","Imisi itandatu ishize, Yesu ajana Petero na Yakobo na Yohana, abadūgana igisozi kirekire ari bonyene. Ahinduka ukundi imbere yabo,","Six jours plus tard, Jésus prit avec lui Pierre, Jacques et Jean, et les emmena sur une haute montagne, à l’écart, eux seuls. Là, il fut transfiguré devant eux :"
MRK.9.3,"His clothes became dazzling white, whiter than anyone in the world could bleach them.","impuzu ziwe zirakayangana, zera derere, kandi nta mumesuzi kw isi yoshoboye kuzeza artyo.",ses vêtements devinrent éblouissants et si parfaitement blancs que personne sur la terre ne peut produire une telle blancheur.
MRK.9.4,"And there appeared before them Elijah and Moses, who were talking with Jesus.","Maze Eliya na Mose barabiyereka, bavugana na Yesu.","Alors Elie leur apparut, avec Moïse ; ils parlaient tous deux avec Jésus."
MRK.9.5,"Peter said to Jesus, “Rabbi, it is good for us to be here. Let us put up three shelters—one for you, one for Moses and one for Elijah.”","Petero abgira Yesu, ati Mwigisha, bitubereye vyiza ko turi hano, nuko duce insago zitatu, rumwe rwawe, urundi rwa Mose, urundi rwa Eliya.","Pierre s’adressa à Jésus et lui dit : Maître, il est bon que nous soyons ici. Nous allons dresser trois tentes, une pour toi, une pour Moïse et une pour Elie."
MRK.9.6,"(He did not know what to say, they were so frightened.)","Ntiyar’ azi ico akwiye kuvuga, kuko bari baguye igihūmura.","En fait, il ne savait ce qu’il disait, car ils étaient tous les trois remplis de peur."
MRK.9.7,"Then a cloud appeared and covered them, and a voice came from the cloud: “This is my Son, whom I love. Listen to him!”","Maz’ igicu kiraza kibatera igitūtu, ijwi riva muri nya gicu, riti Nguyu Umwana wanje nkunda, ni mumwumve.",Une nuée se forma alors et les enveloppa. Une voix en sortit : Celui-ci est mon Fils bien-aimé. Ecoutez-le !
MRK.9.8,"Suddenly, when they looked around, they no longer saw anyone with them except Jesus.","Maze bakebaguza vuba, ntibaba bakigira uwundi babona, atari Yesu wenyene, ari kumwe na bo.","Aussitôt les disciples regardèrent autour d’eux, et ils ne virent plus personne, sinon Jésus, qui était seul avec eux."
MRK.9.9,"As they were coming down the mountain, Jesus gave them orders not to tell anyone what they had seen until the Son of Man had risen from the dead.","Bariko baramanuka ico gisozi, arabihanikiriza ngo ntihagire umuntu badondera ivyo babonye, Umwana w’umuntu atarazuka avuye mu bapfuye.","Pendant qu’ils descendaient de la montagne, il leur ordonna de ne raconter à personne ce qu’ils venaient de voir, jusqu’à ce que le Fils de l’homme ressuscite."
MRK.9.10,"They kept the matter to themselves, discussing what “rising from the dead” meant.","Babīka iryo jambo, basiguzanya ivy’ ukuzuka mu bapfuye ivy’ ari vyo.","Ils obéirent à cet ordre, mais discutaient entre eux sur ce que « ressusciter » voulait dire."
MRK.9.11,"And they asked him, “Why do the teachers of the law say that Elijah must come first?”","Baramubaza, bati Mbeg’ abanyabgenge b’ivyanditswe ko bavuga yuko Eliya akwiye kubanza kuza?",Ils lui demandèrent alors : Pourquoi les spécialistes de la Loi disent-ils qu’Elie doit venir d’abord ?
MRK.9.12,"Jesus replied, “To be sure, Elijah does come first, and restores all things. Why then is it written that the Son of Man must suffer much and be rejected?","Arabishura, ati Eliya abanza kuza koko, akaroranya vyose neza. Ariko vyanditswe bite ku Mwana w’umuntu yukw azobabazwa vyinshi, agatiturwa?","– Oui, leur dit-il, Elie vient d’abord pour remettre toutes choses en ordre a. Pourquoi l’Ecriture annonce-t-elle aussi que le Fils de l’homme souffrira beaucoup et sera traité avec mépris ?"
MRK.9.13,"But I tell you, Elijah has come, and they have done to him everything they wished, just as it is written about him.”","Ariko ndababgira yuko Eliya yamaze kuza, kandi bamwigiriye uko bagomba kwose, nk’uko vyanditswe kuri we.","En fait, je vous le déclare : Elie est venu et ils l’ont traité comme ils ont voulu, comme l’Ecriture l’a annoncé à son sujet ."
MRK.9.14,"When they came to the other disciples, they saw a large crowd around them and the teachers of the law arguing with them.","Bariko barashikīra abigishwa, babona ishengero ryinshi ribajiguje, n’abanyabgenge b’ivyanditswe bahārīra na bo.","Lorsqu’ils revinrent vers les disciples, ils virent une grande foule qui les entourait et des spécialistes de la Loi qui discutaient avec eux."
MRK.9.15,"As soon as all the people saw Jesus, they were overwhelmed with wonder and ran to greet him.","Uwo mwanya ishengero ryose rimurabutswe riratangara rwose, barirukanga baramusanganira, baramuramutsa.","Dès que tous ces gens aperçurent Jésus, ils furent très surpris et se précipitèrent à sa rencontre pour le saluer."
MRK.9.16,“What are you arguing with them about?” he asked.,"Arababaza, ati Mwariko murabahāririza ibiki?",– De quoi discutez-vous avec eux ? leur demanda-t-il.
MRK.9.17,"A man in the crowd answered, “Teacher, I brought you my son, who is possessed by a spirit that has robbed him of speech.","Umwe mur’ iryo shengero aramwishura, ati Mwigisha, nari nakuzaniye umwana wanje, yinjiwemwo n’impwemu y’ikiragi.","De la foule, quelqu’un lui répondit : Maître, je t’ai amené mon fils car il est sous l’emprise d’un esprit qui le rend muet."
MRK.9.18,"Whenever it seizes him, it throws him to the ground. He foams at the mouth, gnashes his teeth and becomes rigid. I asked your disciples to drive out the spirit, but they could not.”","Ah’ imufatiye hose, imutūra hasi, akabimba ifuro, akazyegenya amenyo, akagenda ashira umunywera; mbarira abigishwa bawe ngo bayisende, irabananira.","Partout où cet esprit s’empare de lui, il le jette par terre, de l’écume sort de la bouche de l’enfant, qui grince des dents ; puis il devient tout raide. J’ai demandé à tes disciples de chasser ce mauvais esprit, mais ils n’ont pas pu le faire."
MRK.9.19,"“You unbelieving generation,” Jesus replied, “how long shall I stay with you? How long shall I put up with you? Bring the boy to me.”","Arabishura, ati Yemwe ab’iki gihe mutizera, nzogeza ryari kubana namwe? Nzogeza ryari kubihanganira? Ni mumunzanire.",Jésus s’adressa à eux et leur dit : Gens incrédules ! Jusqu’à quand devrai-je encore rester avec vous ? Jusqu’à quand devrai-je vous supporter ? Amenez-moi l’enfant !
MRK.9.20,"So they brought him. When the spirit saw Jesus, it immediately threw the boy into a convulsion. He fell to the ground and rolled around, foaming at the mouth.","Baramuzana. Iyo mpwemu imubonye ica iramujegeza cane, aratemba, arigaragura, abimba ifuro.","On le lui amena. Mais, dès qu’il vit Jésus, l’esprit mauvais agita convulsivement l’enfant et le jeta par terre. Celui-ci se roula sur le sol, de l’écume à la bouche."
MRK.9.21,"Jesus asked the boy’s father, “How long has he been like this?” “From childhood,” he answered.","Yesu abaza se, at’ Amaze igihe kingana iki bimutera birtyo? Aramwishura, at’ Uhereye mu bgana bgiwe.",– Depuis combien de temps cela lui arrive-t-il ? demanda Jésus à son père. – Depuis qu’il est tout petit.
MRK.9.22,"“It has often thrown him into fire or water to kill him. But if you can do anything, take pity on us and help us.”","Kenshi cane imuta mu muriro no mu mazi ngw imwice. Ariko namba har’ ico woshobora, tugirire akagongwe udutabare.","Souvent même, l’esprit mauvais le pousse à se jeter dans le feu ou dans l’eau pour le faire mourir. Si tu peux faire quelque chose, aie pitié de nous et viens à notre aide !"
MRK.9.23,“ ‘If you can’?” said Jesus. “Everything is possible for one who believes.”,"Yesu aramwishura, at’ Uvuze uti Namba wobishobora? Erega vyose bishobokera uwizeye.",– Si tu peux ! répliqua Jésus. Tout est possible à celui qui croit.
MRK.9.24,"Immediately the boy’s father exclaimed, “I do believe; help me overcome my unbelief!”","Se w’uwo mwana aca aturika cane, ati Ndizeye, fasha ukutizera kwanje.","Aussitôt le père de l’enfant s’écria : Je crois, mais aide-moi, car je manque de foi !"
MRK.9.25,"When Jesus saw that a crowd was running to the scene, he rebuked the impure spirit. “You deaf and mute spirit,” he said, “I command you, come out of him and never enter him again.”","Yesu abonye abantu bagwirirana biruka, akankamira iyo mpwemu ihumanye, ati Yewe mpwemu y’ikiragi kandi y’igipfamatwi, ubganje ndakubariye muvemwo, ntukamugarukemw’ ukundi.","Jésus, voyant la foule affluer, commanda avec sévérité à l’esprit mauvais : Esprit qui rends sourd et muet, lui dit-il, je te l’ordonne, sors de cet enfant et ne rentre plus jamais en lui !"
MRK.9.26,"The spirit shrieked, convulsed him violently and came out. The boy looked so much like a corpse that many said, “He’s dead.”","Irataka, iramujegeza cane, imuvamwo, amera nk’ūhwereye, bituma abenshi bavuga bat’ Arahwereye.","L’esprit poussa un grand cri, secoua l’enfant avec violence et sortit de lui. L’enfant resta comme mort, si bien que la plupart des témoins disaient : « Il est mort. »"
MRK.9.27,"But Jesus took him by the hand and lifted him to his feet, and he stood up.","Yesu amufata ukuboko, aramuvyura, arahagarara.","Mais Jésus, prenant l’enfant par la main, le fit lever, et celui-ci se tint debout."
MRK.9.28,"After Jesus had gone indoors, his disciples asked him privately, “Why couldn’t we drive it out?”","Yinjiye mu nzu, abigishwa biwe bamubaza biherereye, bati Tweho mbega ko vyatunaniye kuyisenda?","Jésus rentra à la maison ; ses disciples, qui étaient seuls avec lui, lui demandèrent alors : Pourquoi n’avons-nous pas réussi, nous, à chasser cet esprit ?"
MRK.9.29,"He replied, “This kind can come out only by prayer. ”","Arabishura, ati Ben’ irya ntikūrwamwo n’ikindi atar’ ugusenga no kwisonzesha.","Jésus leur répondit : Des esprits comme celui-là, on ne peut les chasser que par la prière ."
MRK.9.30,"They left that place and passed through Galilee. Jesus did not want anyone to know where they were,","Bavayo, baca i Galilaya, agomba ko hatogira ūbimenya.","En partant de là, ils traversèrent la Galilée, mais Jésus ne voulait pas qu’on le sache."
MRK.9.31,"because he was teaching his disciples. He said to them, “The Son of Man is going to be delivered into the hands of men. They will kill him, and after three days he will rise.”","Kuko yigisha abigishwa biwe, at’ Umwana w’umuntu azoshirwa mu maboko y’abantu, bazomwica, hashize imisi itatu bamwishe, azozuka.","Car il se consacrait à l’enseignement de ses disciples. Il leur disait : Le Fils de l’homme va être livré aux mains des hommes ; ils le feront mourir mais, trois jours après sa mort, il ressuscitera."
MRK.9.32,But they did not understand what he meant and were afraid to ask him about it.,"Ariko bayoberwa iryo jambo, batinya kurimubaza.","Eux, cependant, ne comprenaient pas ces paroles et ils avaient peur de lui demander des explications."
MRK.9.33,"They came to Capernaum. When he was in the house, he asked them, “What were you arguing about on the road?”","Bashika i Kaperinawumu. Yinjiye mu nzu arababaza, ati Mwāhārīra ibiki mu nzira?","Ils arrivèrent à Capernaüm. Quand ils furent rentrés à la maison, Jésus leur demanda : De quoi avez-vous discuté en route ?"
MRK.9.34,But they kept quiet because on the way they had argued about who was the greatest.,"Barīhorera, kuko mu nzira bāhārīra umukuru wabo uw’ ari we.","Mais ils se taisaient car, durant le trajet, ils avaient discuté pour savoir lequel d’entre eux était le plus grand."
MRK.9.35,"Sitting down, Jesus called the Twelve and said, “Anyone who wants to be first must be the very last, and the servant of all.”","Aricara, ahamagara bamwe cumi na babiri, arababgira, at’ Umuntu ni yagomba kuba uw’ imbere, n’abe inyuma ya bose, n’abe n’umukozi wa bose.","Jésus s’assit, appela les Douze et leur dit : Si quelqu’un désire être le premier, qu’il se fasse le dernier de tous, et le serviteur de tous."
MRK.9.36,"He took a little child whom he placed among them. Taking the child in his arms, he said to them,","Yābīra akana, agahagarika hagati yabo; arakarera, arababgira,","Puis il prit un petit enfant par la main, le plaça au milieu d’eux et, après l’avoir serré dans ses bras, il leur dit :"
MRK.9.37,“Whoever welcomes one of these little children in my name welcomes me; and whoever welcomes me does not welcome me but the one who sent me.”,"at’ Ūzokwākīra umwe mu twana nk’aka mw izina ryanje, azoba anyakiriye; kand’ ūnyakīra, si jewe yākīra, ariko yākīra uwantumye.","Si quelqu’un accueille, en mon nom, un enfant comme celui-ci, il m’accueille moi-même. Et celui qui m’accueille, ce n’est pas moi seulement qu’il accueille, mais aussi celui qui m’a envoyé."
MRK.9.38,"“Teacher,” said John, “we saw someone driving out demons in your name and we told him to stop, because he was not one of us.”","Yohana aramubgira, ati Mwigisha, twabonye umuntu asenda abadayimoni mw izina ryawe, turamubuza, kukw atadukurikira.","Jean lui dit : Maître, nous avons vu quelqu’un qui chassait les démons en ton nom, et nous lui avons dit de ne plus le faire, parce qu’il ne nous suit pas."
