,0,1,2
PRO.7.15,So I came out to meet you; I looked for you and have found you!,"Ni co gitumye nza kugusanganira, Nkuronderana umwete, none ndakubonye.","Voilà pourquoi je suis sortie à ta rencontre, je cherchais à te voir, et je t’ai trouvé."
PRO.7.16,I have covered my bed with colored linens from Egypt.,"Nashashe imisego ku buriri bganje, N’impuzu z’amagarwe zajishwe mu nyuzi zo muri Egiputa.",J’ai garni mon lit de couvertures et d’étoffe brodée en fils d’Egypte .
PRO.7.17,"I have perfumed my bed with myrrh, aloes and cinnamon.",Namotesheje neza uburiri bganje Isenga n’imbazi na mudarasini.,"J’ai parfumé mon lit de myrrhe, d’aloès et de cinnamome."
PRO.7.18,"Come, let’s drink deeply of love till morning; let’s enjoy ourselves with love!","Ngwino turāreko buce, Twinezeranishe urukundo.","Viens, grisons-nous d’amour jusqu’au matin, livrons-nous aux délices de la volupté,"
PRO.7.19,My husband is not at home; he has gone on a long journey.,"Kuk’ umugabo atar’ i muhira, Yamaze urubanza rwa kure.",car mon mari n’est pas à la maison : il est parti pour un voyage au loin.
PRO.7.20,He took his purse filled with money and will not be home till full moon.”,Yajanye umupfuko w’amahera; Azogaruka ukwezi gufashe.,"Il a emporté une bourse pleine d’argent, il ne rentrera qu’à la pleine lune. »"
PRO.7.21,With persuasive words she led him astray; she seduced him with her smooth talk.,"Amuryesharyeshakw akarimi keza, Amukwegesha guhemana kw’ iminwa yiwe.","A force d’artifices, elle le fit fléchir ; par ses propos enjôleurs, elle l’entraîna."
PRO.7.22,"All at once he followed her like an ox going to the slaughter, like a deer stepping into a noose","Aca amukurikira ubgo nyene, Nk’inka ija kubāgwa, Canke nk’igipfu kijanwa guhanirwa mu munyororo;","Alors il se mit soudain à la suivre comme un bœuf qui va à l’abattoir, comme un fou qu’on lie pour le châtier,"
PRO.7.23,"till an arrow pierces his liver, like a bird darting into a snare, little knowing it will cost him his life.","Gushitsa ah’ umwampi umutobekeranije mu gitigu; Nk’ukw inyoni yisuka mu mutego, Itazi kw igiye gupfa.","jusqu’à ce qu’une flèche lui transperce le foie, comme un oiseau qui se précipite dans le filet sans se douter qu’il y va de sa vie."
PRO.7.24,"Now then, my sons, listen to me; pay attention to what I say.","None rero, bana banje, munyumve, Mutege amatwi amajambo y’ akanwa kanje.","Et maintenant, mes fils, écoutez-moi ! Prêtez attention à mes paroles !"
PRO.7.25,Do not let your heart turn to her ways or stray into her paths.,"Umutima wawe ntugakebereze mu nzira ziwe, Kandi woye kuzimira ng’ ujane inzira ziwe.","Que votre cœur ne se laisse pas entraîner par une telle femme ! Ne vous égarez pas dans ses sentiers,"
PRO.7.26,Many are the victims she has brought down; her slain are a mighty throng.,"Kuko yatsinze hasi abakomerekejwe benshi, Mber’ abakomeye bishwe na we n’isinzi.","car nombreuses sont ses victimes blessées à mort, et ceux qu’elle a fait périr comptent parmi les plus robustes."
PRO.7.27,"Her house is a highway to the grave, leading down to the chambers of death.","Inzu yiwe n’inzira ija i kuzimu, Imanuka irora i wabo w’urupfu.",Sa maison est le chemin du séjour des morts qui mène directement aux demeures de la mort.
PRO.8.1,Does not wisdom call out? Does not understanding raise her voice?,Mbega Bgenge ntahamagaye? N’ukumenya ntigushize hejuru ijwi ryakwo?,"Ecoutez : la Sagesse appelle, la raison élève la voix ."
PRO.8.2,"At the highest point along the way, where the paths meet, she takes her stand;","Ku gatwe hejuru, i ruhande y’inzira, Mu mayirabiri, ni ho ahagaze.","Elle est postée sur les hauteurs, ╵le long des routes, aux carrefours."
PRO.8.3,"beside the gate leading into the city, at the entrance, she cries aloud:","I ruhande y’amarembo, mw ishikiro ry’igisagara, Mu bikingi vy’amarembo, ni ho asemererera cane:","Tout près des portes de la ville, là où l’on passe pour entrer, ╵elle fait retentir sa voix :"
PRO.8.4,"“To you, O people, I call out; I raise my voice to all mankind.","Ati Ni mwebge mwa bagabo mpamagaye, Kand’ ijwi ryanje rihamagaye abana b’abantu.","« C’est chacun de vous que j’appelle, c’est pour vous, les humains, que ma voix se fait entendre,"
PRO.8.5,"You who are simple, gain prudence; you who are foolish, set your hearts on it.","Yemwe mwa mburabgenge, mumenye kwiguranura ic’ ari co, Namwe bijuju, mugire imitima itahura.","à vous, qui manquez d’expérience : ╵apprenez donc à réfléchir ; et à vous, insensés : ╵devenez donc intelligents !"
PRO.8.6,"Listen, for I have trustworthy things to say; I open my lips to speak what is right.","Mwumvirize, kuko ngira mvuge ibikomeye; Guteranura iminwa kwanje kuvamw’ ibibereye.","Ecoutez-moi, car j’ai à dire ╵des choses capitales, et ce sont des paroles justes ╵qui franchiront mes lèvres."
PRO.8.7,"My mouth speaks what is true, for my lips detest wickedness.","Kukw akanwa kanje kagira kavuge ivy’ ukuri, Kand’ ikibi n’umuziro ku minwa yanje.","Oui, ma bouche proférera ╵la vérité, le mal fait horreur à mes lèvres,"
PRO.8.8,All the words of my mouth are just; none of them is crooked or perverse.,"Amajambo yose y’akanwa kanje n’ay’ ukugororoka, Kandi muri yo nta kigoramye cank’ ikigoretse.","et mon palais proclamera ╵uniquement ce qui est juste. Il n’y a pas de fourberie, ╵rien de retors dans mes paroles,"
PRO.8.9,To the discerning all of them are right; they are upright to those who have found knowledge.,"Yose arumvikana ku muntu atahura, Kand’ aratumbereye ku bāronse ubgenge.","elles sont toutes justes ╵pour qui comprend les choses, elles sont droites ╵pour qui trouve la connaissance."
PRO.8.10,"Choose my instruction instead of silver, knowledge rather than choice gold,","Mwākīre inyigisho zanje, si nk’ifeza, Mwākīre n’ukumenya kurusha izahabu z’indobanurwa.","Recherchez mon éducation ╵plutôt que de l’argent, et choisissez la connaissance ╵plutôt que l’or, l’or le plus pur."
PRO.8.11,"for wisdom is more precious than rubies, and nothing you desire can compare with her.",Kuk’ ubgenge buruta utubuyenge twitwa marijani; Kandi mu bintu bihimbara vyose nta gihwanye na bgo.,"Car la sagesse est préférable ╵aux perles précieuses, et les biens les plus désirables ╵ne sauraient l’égaler ."
PRO.8.12,"“I, wisdom, dwell together with prudence; I possess knowledge and discretion.","Jewe Bgenge, amakenga nayagize inzu yanje, Nserangura ukumenya n’inama nziza.","Moi, je suis la Sagesse, ╵j’habite à côté de la réflexion, j’ai découvert l’art de penser."
PRO.8.13,"To fear the Lord is to hate evil; I hate pride and arrogance, evil behavior and perverse speech.","Kwubaha Uhoraho ni kwo kwanka ikibi: Ubgibone n’amanyama n’inzira y’ikibi N’akanwa k’ibidadi, ndavyanka.","Lorsqu’on craint l’Eternel, ╵on déteste le mal. Je déteste l’orgueil, ╵la suffisance, ╵la conduite mauvaise et la bouche menteuse."
PRO.8.14,"Counsel and sound judgment are mine; I have insight, I have power.","Inama nziza n’iyanje, bo n’ ubgenge bushitse, Ni jewe kumenya, ndi n’inkomezi.",C’est à moi qu’appartiennent ╵le conseil et la réflexion. Je suis l’intelligence ╵et possède la force.
PRO.8.15,By me kings reign and rulers issue decrees that are just;,"Ni jewe mpa abami kuganza, N’abacamanza gushinga ibiroranye.","C’est par moi que règnent les rois, et que les dirigeants ╵décrètent des lois justes."
PRO.8.16,"by me princes govern, and nobles—all who rule on earth.","Ni jewe mpa abaganza kuganza, N’abaganwa, eka mbere n’abacamanza bose bo mw isi.","Par moi gouvernent tous les chefs, tous les hommes d’Etat ╵et tous les magistrats sur terre."
PRO.8.17,"I love those who love me, and those who seek me find me.","Nkunda abankunda, Kand’ abandondera ubudahumeka bazombona.","Moi, j’aime ceux qui m’aiment, et ceux qui me recherchent ╵ne manquent pas de me trouver."
PRO.8.18,"With me are riches and honor, enduring wealth and prosperity.","Itunga n’icubahiro bir’ i wanje; N’ubutunzi buramba, bo n’ ubugororotsi.","Je suis accompagnée ╵de la richesse et de l’honneur, de biens durables, de la justice."
PRO.8.19,My fruit is better than fine gold; what I yield surpasses choice silver.,"Imbuto namye zirusha izahabu ubgiza, mbere naho zoba izahabu zitarimw’ inkamba; N’ivyimburwa vyanje biruta ifeza z’indobānurwa.","Mon fruit est plus précieux que l’or, oui, même que l’or le plus fin, et les profits que je rapporte ╵valent mieux qu’un argent de choix."
PRO.8.20,"I walk in the way of righteousness, along the paths of justice,","Ngendera mu mayira y’ubugororotsi, No hagati mu nzira z’imanza ziroranye:","Je marche sur la voie de la justice et je suis les sentiers ╵de l’équité,"
PRO.8.21,bestowing a rich inheritance on those who love me and making their treasuries full.,"Kugira ngw abankunda ndabahe kuragwa itunga, Kandi kugira ngo nuzuze ibigega vyabo.",pour combler de biens ceux qui m’aiment et remplir leurs trésors.
PRO.8.22,"“The Lord brought me forth as the first of his works, before his deeds of old;","Uhoraho yaranyamanye mw itanguriro ry’inzira ziwe, Ataratangura na kimwe mu bikorwa vyiwe vya kera.",L’Eternel m’a donné naissance ╵tout au début de son activité et avant d’entreprendre ╵les plus anciennes de ses œuvres.
PRO.8.23,"I was formed long ages ago, at the very beginning, when the world came to be.","Nashizweh’ uhereye kera hose, uhereye mbere na mbere, Isi itararemwa.","Oui j’ai été formée ╵dès les temps éternels, bien avant que la terre fût créée."
PRO.8.24,"When there were no watery depths, I was given birth, when there were no springs overflowing with water;",I bgina hatarabaho nari naravutse; Amasōko yuzuye amazi atarabaho.,J’ai été enfantée ╵avant que l’océan existe et avant que les sources ╵aient fait jaillir ╵leurs eaux surabondantes.
PRO.8.25,"before the mountains were settled in place, before the hills, I was given birth,","Imisozi miremire itarashirwaho, Bo n’udusozi, nari naravutse:","Avant que les montagnes ╵aient été établies, avant que les collines ╵soient apparues, ╵j’ai été enfantée."
PRO.8.26,before he made the world or its fields or any of the dust of the earth.,"Itararema isi cank’ indimiro, Cank’ itanguriro ry’umukungugu wo kw isi.",Dieu n’avait pas encore ╵formé la terre et les campagnes ni le premier grain de poussière ╵de l’univers.
PRO.8.27,"I was there when he set the heavens in place, when he marked out the horizon on the face of the deep,",Igihe yashirah’ ijuru ni ho nari ndi: N’igihe yarihetera hejuru y’i bgina;,"Moi, j’étais déjà là ╵quand il fixa le ciel et qu’il traça un cercle ╵autour de la surface ╵du grand abîme."
PRO.8.28,"when he established the clouds above and fixed securely the fountains of the deep,","Ijuru igihe yarigumya hejuru iyo, Igihe amasōko y’i bgina yakomera;","Et quand il condensa ╵les nuages d’en haut, quand il fit jaillir avec force ╵les sources de l’abîme,"
PRO.8.29,"when he gave the sea its boundary so the waters would not overstep his command, and when he marked out the foundations of the earth.","Igihe yashingira ikiyaga akarimbi, Kugira ngw amazi ntarenge icagezwe cayo; Igihe yashirah’ amatanguriro y’isi:","et quand il assigna ╵à la mer des limites pour que ses eaux ╵ne les franchissent pas, quand il détermina ╵les fondements du monde,"
PRO.8.30,"Then I was constantly at his side. I was filled with delight day after day, rejoicing always in his presence,","Ico gihe nari kumwe na yo, nd’ umukozi w’umuhanga: Kand’ imisi yose narayihimbara, Nama niginagura imbere yayo;","je me tenais ╵bien fermement à ses côtés , me livrant sans cesse aux délices , et jouant en tout temps ╵en sa présence."
PRO.8.31,rejoicing in his whole world and delighting in mankind.,Niginagura mw isi yayo yāgānutse; Mpimbarwa n’abana b’abantu.,"Je jouais sur sa terre ╵dans le monde habité, et trouvais mes délices ╵dans les êtres humains."
PRO.8.32,"“Now then, my children, listen to me; blessed are those who keep my ways.","None rero, bana banje, ni munyumve: Kukw abitondera inzira zanje ar’ abahirwe.","Maintenant donc, mes fils, ╵écoutez-moi : heureux tous ceux qui suivent ╵les voies que je prescris !"
PRO.8.33,Listen to my instruction and be wise; do not disregard it.,"Mwumvirize inyigisho, muce ubgenge, Kandi ntimuze muzanke.","Ecoutez mes leçons, ╵et vous deviendrez sages. Ne les négligez pas !"
PRO.8.34,"Blessed are those who listen to me, watching daily at my doors, waiting at my doorway.","Hahirwa umuntu anyumviriza, Akāma arerekeye ku myugariro yanje uko bukeye, Agategera ku bishimaryango vyanje.","Car : heureux l’homme qui m’écoute, qui vient veiller à mes portes ╵jour après jour, et qui monte la garde ╵devant l’entrée de ma maison."
PRO.8.35,For those who find me find life and receive favor from the Lord .,"Kuk’ ūmbona wese aba abonye ubugingo, Kand’ akazotoneshwa n’Uhoraho.","Car celui qui me trouve ╵a découvert la vie, il obtient la faveur ╵de l’Eternel."
PRO.8.36,But those who fail to find me harm themselves; all who hate me love death.”,"Arik’ ūncumuyeko, aba yankirije ubugingo bgiwe nyene: Abanyanka bose bakunda urupfu.","Mais il se fait tort à lui-même, ╵celui qui me désobéit : tous ceux qui me haïssent ╵aiment la mort. »"
PRO.9.1,Wisdom has built her house; she has set up its seven pillars.,"Bgenge yiyubakiye inzu, Yibāziye inkingi ndwi:","La Sagesse a bâti une maison, et elle en a taillé ╵les sept colonnes."
PRO.9.2,She has prepared her meat and mixed her wine; she has also set her table.,Yabāze ingumba ziwe; yaturiranije vino yiwe; Yateguye ameza yiwe.,"Elle a apprêté une bête ╵et elle a préparé son vin . Déjà, elle a dressé sa table."
PRO.9.3,"She has sent out her servants, and she calls from the highest point of the city,","Yatumye incoreke ziwe; Asemererera ku gatwe hejuru ko mu gisagara,","Elle a envoyé ses servantes ╵pour lancer ses invitations, elle appelle du haut des lieux ╵les plus élevés de la ville :"
PRO.9.4,"“Let all who are simple come to my house!” To those who have no sense she says,","At’ Umuntu wese w’imburabgenge n’aze yinjire hano: Kand’ abarira ibipfamutima,","« Approchez donc, ╵vous qui n’avez pas d’expérience ! » A ceux qui manquent de bon sens, ╵elle déclare :"
PRO.9.5,"“Come, eat my food and drink the wine I have mixed.","Ati Ngwino murye ku mazimano yanje, Munywe kuri vino naturiranije.",« Venez et mangez de mon pain et buvez du vin que j’ai préparé.
PRO.9.6,Leave your simple ways and you will live; walk in the way of insight.”,"Muve mu bupfu, mubone kubaho; Mugendere mu nzira yo kumenya ubgenge.",Vous qui êtes inexpérimentés ╵détournez-vous de ce chemin ╵et vous vivrez . Dirigez-vous ╵sur la voie de l’intelligence.
PRO.9.7,Whoever corrects a mocker invites insults; whoever rebukes the wicked incurs abuse.,"Ūhana umucokoranyi aba yikwegera kumāramāzwa, Kand’ uwihaniza umunyakibi aba yikwegera iceyi.","Corriger un moqueur, ╵c’est s’attirer la confusion et reprendre un méchant, ╵s’attirer un affront."
PRO.9.8,Do not rebuke mockers or they will hate you; rebuke the wise and they will love you.,"Ntiwihanize umucokoranyi, yohava akwanka: Wihanize umunyabgenge, azogukunda.","Ne reprends donc pas le moqueur, ╵car il te haïra ; si tu reprends un sage, ╵il t’en aimera davantage."
PRO.9.9,Instruct the wise and they will be wiser still; teach the righteous and they will add to their learning.,"Wigishe umunyabgenge, azorushiriza kugira ubgenge: Wigishe umugororotsi, azokwunguka kumenya.","Oui, donne des conseils au sage, ╵et il sera plus sage encore. Instruis le juste, ╵il enrichira son savoir."
PRO.9.10,"The fear of the Lord is the beginning of wisdom, and knowledge of the Holy One is understanding.","Ukwubaha Uhoraho ni kwo tanguriro ry’ubgenge, Kand’ ukumenya Uwera ni kwo kumenya ubgenge.","La sagesse commence ╵par la crainte de l’Eternel , et la science des saints , ╵c’est le discernement."
PRO.9.11,"For through wisdom your days will be many, and years will be added to your life.","Kukw imisi yawe izogwira kubganje, N’imyaka y’ukubaho kwawe izokwongerwa.","Grâce à moi, la Sagesse, ╵tes jours seront multipliés et des années ╵seront ajoutées à ta vie ."
PRO.9.12,"If you are wise, your wisdom will reward you; if you are a mocker, you alone will suffer.",Ni wagira ubgenge ni wewe uzoba ubgifitiye; Kandi ni wacokorana ni wewe ubgawe bizobako.,"Si tu es sage, ╵c’est toi qui en profiteras, mais si tu es moqueur, ╵tu en supporteras ╵toi seul les conséquences. »"
PRO.9.13,Folly is an unruly woman; she is simple and knows nothing.,"Gipfu n’umugore w’indegeteranyi, N’imburabgenge, kandi nta co azi.","Dame Folie est bien bruyante, elle est sans expérience, ╵elle n’y connaît rien ."
PRO.9.14,"She sits at the door of her house, on a seat at the highest point of the city,","Yicara ku muryango w’inzu yiwe, No ku ntebe ku gatwe hejuru ko mu gisagara,","Elle s’assied ╵à la porte de sa maison, elle place son siège ╵aux points les plus élevés de la ville,"
PRO.9.15,"calling out to those who pass by, who go straight on their way,","Ngw ahamagare abahahita, Bagenda baramirije mu nzira zabo,",pour interpeller les passants qui vont droit leur chemin.
PRO.9.16,"“Let all who are simple come to my house!” To those who have no sense she says,","At’ Umuntu wese w’imburabgenge n’aze yinjire hano; Kand’ abarira igipfamutima,","« Approchez donc, ╵vous qui n’avez pas d’expérience ! » A ceux qui manquent de bon sens, ╵elle déclare :"
PRO.9.17,“Stolen water is sweet; food eaten in secret is delicious!”,"At’ Amazi y’amībano araryoshe, N’indya zirīrwa mu mpisho ziranezereye.","« Les eaux dérobées sont plus douces, et le pain mangé en secret ╵est savoureux. »"
PRO.9.18,"But little do they know that the dead are there, that her guests are deep in the realm of the dead.","Ariko wa wundi ntaba azi kw imizimu ari ho iri, Kandi kw abatumire biwe baba i bgina i kuzimu.",Mais ils ne savent pas ╵que chez elle se rassemblent les morts et que ses invités ╵sont déjà au séjour des morts.
PRO.10.1,"The proverbs of Solomon: A wise son brings joy to his father, but a foolish son brings grief to his mother.","Imigani ya Salomo. Umwana w’ubgenge anezereza se, Arik’ umwana w’igipfu ababaza nyina.","Un fils sensé réjouit son père, mais un fils insensé cause du chagrin à sa mère."
PRO.10.2,"Ill-gotten treasures have no lasting value, but righteousness delivers from death.","Itunga rironkeshejwe ubugunge ntirigira ikimazi, Arik’ ubugororotsi bukūra mu rupfu.","Les biens des méchants ne leur profitent pas, mais mener une vie juste sauve de la mort."
PRO.10.3,"The Lord does not let the righteous go hungry, but he thwarts the craving of the wicked.","Uhoraho ntazokundira umushaha w’umugororotsi k’ ugira inzara, Arikw akaruru k’abanyavyaha azogasunikira hirya.","L’Eternel ne permet pas que l’homme droit souffre de la faim, mais il frustre les désirs des méchants."
PRO.10.4,"Lazy hands make for poverty, but diligent hands bring wealth.","Ukuboko kw’umunebge kwizanira ubgoro, Arik’ ukuboko kw’umunyamwete kuratungisha.","La main nonchalante appauvrit, mais la main active enrichit."
PRO.10.5,"He who gathers crops in summer is a prudent son, but he who sleeps during harvest is a disgraceful son.","Ūshwābūra mu ci n’umwana w’ubgenge, Arik’ uwigonera mw iyimbura n’umwana w’agatētereza.","Celui qui amasse des provisions en été est un fils intelligent, mais celui qui dort pendant la moisson est un fils qui fait honte."
PRO.10.6,"Blessings crown the head of the righteous, but violence overwhelms the mouth of the wicked.","Imigisha iba ku mutwe w’ umugororotsi, Arik’ umuryano wubikiza ku munwa w’umunyavyaha.","Des bénédictions reposent sur la tête du juste, mais les paroles des méchants cachent la violence."
PRO.10.7,"The name of the righteous is used in blessings, but the name of the wicked will rot.","Kwibuka umugororotsi kurimw’ umugisha, Arikw izina ry’umunyavyaha rizozimangana.","Le souvenir du juste continue à être en bénédiction aux autres, mais le nom des méchants tombe dans l’oubli."
PRO.10.8,"The wise in heart accept commands, but a chattering fool comes to ruin.","Ūfise umutima w’ubgenge yemera kubgirizwa, Arik’ ūfise iminwa y’ubuhumbu aratemba.","Un esprit sage prend à cœur les préceptes, mais le bavard insensé est l’artisan de sa propre perte."
PRO.10.9,"Whoever walks in integrity walks securely, but whoever takes crooked paths will be found out.","Ūgenda agororotse agenda amahoro, Arik’ ūgoramangisha inzira ziwe azomenyekana.",Qui vit dans l’intégrité marche en sécurité. Qui suit des voies tortueuses sera vite démasqué.
PRO.10.10,"Whoever winks maliciously causes grief, and a chattering fool comes to ruin.","Ūvuniranira akagohe atera umubabaro, Kand’ ūfise iminwa y’ubuhumbu aratemba.","Qui cligne de l’œil cause du tourment, mais celui qui critique en toute franchise travaille pour la paix ."
PRO.10.11,"The mouth of the righteous is a fountain of life, but the mouth of the wicked conceals violence.","Akanwa k’umugororotsi n’ isōko y’ubugingo, Arik’ umuryano wubikiza ku munwa w’umunyavyaha.","Les paroles du juste sont une source de vie , mais celles du méchant cachent la violence."
PRO.10.12,"Hatred stirs up conflict, but love covers over all wrongs.","Urwanko ruvyura intonganya, Arik’ urukundo rupfuka ibigabitanyo vyose.","La haine allume des querelles, mais l’amour couvre toutes les fautes ."
PRO.10.13,"Wisdom is found on the lips of the discerning, but a rod is for the back of one who has no sense.","Mu minwa y’ūzi gutegēra habonekamw’ ubgenge, Arikw inkoni ibīkiwe ibitugu vy’ūtagira umutima.","La sagesse se trouve sur les lèvres de l’homme sensé, et les coups de bâton sur le dos de celui qui est déraisonnable."
PRO.10.14,"The wise store up knowledge, but the mouth of a fool invites ruin.","Abanyabgenge baziganya ukumenya, Arikw akanwa k’igipfu ni ko buyobe bugira butere.","Les sages amassent le savoir, mais lorsqu’un insensé parle, le malheur n’est pas loin."
PRO.10.15,"The wealth of the rich is their fortified city, but poverty is the ruin of the poor.","Itunga ry’umutunzi rimubera igisagara gikomeye, Arikw ikimara aboro n’ubgoro bgabo.","La fortune du riche lui tient lieu de place forte, alors que la pauvreté des petites gens fait leur ruine."
PRO.10.16,"The wages of the righteous is life, but the earnings of the wicked are sin and death.","Ubutame bg’umugororotsi buzana ubugingo, Arikw inyungu z’umunyakibi zizana icaha.",Le travail du juste le fait vivre ; ce que le méchant gagne sert à faire le mal.
PRO.10.17,"Whoever heeds discipline shows the way to life, but whoever ignores correction leads others astray.","Ūshira umutima ku gutozwa indero nziza aba ari mu nzira y’ubugingo, Arik’ uwanka guhanwa aba azimiye.","Qui tient compte des critiques qu’on lui fait est sur la voie de la vie, mais celui qui fait fi des reproches se fourvoie."
PRO.10.18,Whoever conceals hatred with lying lips and spreads slander is a fool.,"Ūpfukapfuka urwanko n’ umunyaminwa y’ibinyoma, Kand’ ūvuga ibirementanyo n’igipfu.","Qui cache sa haine a des lèvres menteuses, et qui répand des calomnies est insensé."
PRO.10.19,"Sin is not ended by multiplying words, but the prudent hold their tongues.","Mw isinzi ry’amajambo ntihaburamw’ ugucumura, Arik’ uwigarura mu vy’iminwa ivuga n’umunyabgenge.","Qui parle beaucoup ne saurait éviter de pécher, mais l’homme avisé met un frein à ses lèvres."
PRO.10.20,"The tongue of the righteous is choice silver, but the heart of the wicked is of little value.","Ururimi rw’umugororotsi ni nk’ifeza z’indobānurwa, Arik’ umutima w’umunyakibi ugira ikimazi gike.",La langue du juste est un argent de choix ; ce que pensent les méchants n’a pas grande valeur.
PRO.10.21,"The lips of the righteous nourish many, but fools die for lack of sense.","Iminwa y’umugororotsi igaburira benshi, Arikw ibijuju vyicwa no kutagira umutima.","Les paroles du juste orientent beaucoup de gens, mais les insensés périssent faute de bon sens."
PRO.10.22,"The blessing of the Lord brings wealth, without painful toil for it.","Umugisha w’Uhoraho uratungisha, Kandi nta mubabaro awuvangamwo.","C’est la bénédiction de l’Eternel qui enrichit, et toute la peine qu’on se donne n’y ajoute rien ."
PRO.10.23,"A fool finds pleasure in wicked schemes, but a person of understanding delights in wisdom.","Gukora ikibi ni nk’ibihimbaro ku gipfu, Kand’ ubgenge ni ko bumerera umuntu atahura.","Commettre des actions infâmes est un jeu pour l’insensé ; de même, la sagesse l’est pour l’homme intelligent."
PRO.10.24,What the wicked dread will overtake them; what the righteous desire will be granted.,"Ico umunyakibi atinya kizomushikako, Arikw ico umugororotsi yifuza azokironka.","Ce que le méchant redoute lui arrive, mais ce que le juste désire lui sera accordé."
PRO.10.25,"When the storm has swept by, the wicked are gone, but the righteous stand firm forever.","Agashururu kamaze guhita umunyakibi ntaba akiboneka, Arik’ umugororotsi n’ibuye ry’itanguriro ryamaho.","Quand la tempête a passé, le méchant n’est plus, alors que le juste est établi sur un fondement éternel."
