,0,1,2
PRO.1.1,"The proverbs of Solomon son of David, king of Israel:","Imigani ya Salomo mwene Dawidi, umwami w’Abisirayeli,","Proverbes de Salomon , fils de David, roi d’Israël."
PRO.1.2,for gaining wisdom and instruction; for understanding words of insight;,Yo kumenya ubgenge bo n’ inyigisho; Gutegēra amajambo y’ugutahura;,"Ils ont pour but d’enseigner aux hommes la sagesse et de les éduquer, pour qu’ils comprennent les paroles prononcées avec intelligence,"
PRO.1.3,"for receiving instruction in prudent behavior, doing what is right and just and fair;","Kwigishwa gukora ibiroranye mu bgenge, Mu kugororoka, mu kwitegereza neza no mu gutunganya;","et qu’ils reçoivent une éducation réfléchie en vue d’être justes, de vivre selon le droit et dans la droiture."
PRO.1.4,"for giving prudence to those who are simple, knowledge and discretion to the young—","No guha imburabgenge kwiguranura, N’umusore kumuha ukumenya no kugira amakenga:",Ces proverbes donneront aux gens sans expérience le bon sens et aux jeunes de la connaissance et du jugement.
PRO.1.5,"let the wise listen and add to their learning, and let the discerning get guidance—","Kugira ng’ umunyabgenge yumve, yunguke ubgenge, Kandi ng’ umuntu w’umuhanga ashike ku kwemera inama nziza;","Que le sage écoute et il enrichira son savoir, et l’homme avisé acquerra l’art de bien se conduire."
PRO.1.6,"for understanding proverbs and parables, the sayings and riddles of the wise.","No ku gutahura umugani n’ikigereranyo, N’amajambo y’abanyabgenge n’ubupfindo bgabo bapfinda.",Ces proverbes sont destinés à faire comprendre les maximes et les paraboles et à pénétrer les propos des sages et leurs paroles énigmatiques.
PRO.1.7,"The fear of the Lord is the beginning of knowledge, but fools despise wisdom and instruction.",Kwubaha Uhoraho ni kwo tanguriro ry’ukumenya: Arikw ibipfu bikēngēra ubgenge n’inyigisho.,"C’est par la crainte de l’Eternel que commence la connaissance , mépriser la sagesse et l’éducation, c’est être un insensé."
PRO.1.8,"Listen, my son, to your father’s instruction and do not forsake your mother’s teaching.","Mwana wanje, umva inyigisho ya so, Kandi ntute ibgirizwa rya nyoko:","Mon fils, sois attentif à l’éducation que tu reçois de ton père et ne néglige pas l’instruction de ta mère,"
PRO.1.9,They are a garland to grace your head and a chain to adorn your neck.,"Kuko bizokubera umugāra w’ubuntu mu mutwe, N’imigufu mw izosi.",car elles seront comme une belle couronne sur ta tête et comme des colliers à ton cou.
PRO.1.10,"My son, if sinful men entice you, do not give in to them.","Mwana wanje, abanyavyaha ni bakwosha Ntukemere.","Mon fils, si des gens malfaisants veulent t’entraîner, ne leur cède pas."
PRO.1.11,"If they say, “Come along with us; let’s lie in wait for innocent blood, let’s ambush some harmless soul;","Ni bakubgira, bati Ngwino ujane natwe, Turyamire kwica, Dutegere mu mpisho ūtagira igicumuro, ata nyanduruko;","S’ils te disent : « Viens avec nous, dressons une embuscade pour tuer quelqu’un, tendons, sans raison, un piège à l’innocent :"
PRO.1.12,"let’s swallow them alive, like the grave, and whole, like those who go down to the pit;","Tubayongobeze nk’i kuzimu, bakibona, Ar’ imirava, nk’abamanuka baja muri rwa rwobo;","nous l’engloutirons tout vif comme le séjour des morts, il disparaîtra tout entier comme ceux qui descendent dans la tombe."
PRO.1.13,we will get all sorts of valuable things and fill our houses with plunder;,"Tuzoronka ibintu vyose vy’ igiciro kinini, Tuzokwuzuza amazu yacu isahu;","Nous ferons main basse sur un tas de biens précieux, nous remplirons nos maisons de butin."
PRO.1.14,cast lots with us; we will all share the loot”—,"Enda fadikanya natwe, Twese tugire umupfuko umwe:","Tu en auras ta part avec nous, nous ferons tous bourse commune »,"
PRO.1.15,"my son, do not go along with them, do not set foot on their paths;","Mwana wanje, ntuz’ ugendane na bo mu nzira, Ubuze ikirenge cawe inzira yabo,","mon fils, ne te mets pas en route avec ces gens-là, évite d’emprunter les mêmes chemins qu’eux,"
PRO.1.16,"for their feet rush into evil, they are swift to shed blood.","Kukw ibirenge vyabo vyirukira gukora ikibi, Kandi bihutira kuvisha amaraso.","car ils se précipitent vers le mal, ils ont hâte de répandre le sang."
PRO.1.17,How useless to spread a net where every bird can see it!,Kuk’ umutego utegerwa ubusa Ikiguruka cose iyo kibibona.,Mais il est vain de vouloir tendre un filet pendant que tous les oiseaux t’observent .
PRO.1.18,These men lie in wait for their own blood; they ambush only themselves!,"Kand’ abo, baryamira kuvisha ayabo maraso, Bategera mu mpisho ubgabo bugingo.","En vérité, c’est au péril de leur propre vie que ces gens-là dressent des embûches, c’est à eux-mêmes qu’ils tendent des pièges."
PRO.1.19,Such are the paths of all who go after ill-gotten gain; it takes away the life of those who get it.,Uko ni kw inzira zimeze z’ umuntu wese w’ikirara ku nyungu: Inyungu ikūrah’ ubugingo bga ba nyene yo.,C’est à cela qu’aboutiront tous ceux qui cherchent à s’enrichir par des voies malhonnêtes : un gain mal acquis fait périr celui qui le détient.
PRO.1.20,"Out in the open wisdom calls aloud, she raises her voice in the public square;",Bgenge arangururira ijwi mu nzira; Ashirira ijwi hejuru ahiyaguye;,"La Sagesse crie bien haut dans les rues, sa voix résonne sur les places publiques."
PRO.1.21,"on top of the wall she cries out, at the city gate she makes her speech:","Asemererera ku nama aho bakoranira; Mw ishikiro ku marembo, No mu gisagara, ni hoavugira amajambo yiwe:","Dominant le tumulte, elle appelle. Près des portes de la ville , elle fait entendre ses paroles, disant :"
PRO.1.22,“How long will you who are simple love your simple ways? How long will mockers delight in mockery and fools hate knowledge?,"Ati Yemwe bijuju, muzogeza ryari gukunda ubujuju? N’abacokoranyi guhimbarwa no gucokora? N’ibipfu kugirira urwanko ubgenge?","Gens sans expérience, jusques à quand vous complairez-vous dans votre inexpérience ? Et vous, moqueurs, jusqu’à quand prendrez-vous plaisir à vous moquer ? Et vous, insensés, jusqu’à quand détesterez-vous la connaissance ?"
PRO.1.23,"Repent at my rebuke! Then I will pour out my thoughts to you, I will make known to you my teachings.","Muhindukire kubgo kwihanikiriza kwanje: Rāba, nzosuka impwemu yanje kuri mwebge, Nzobamenyesha amajambo yanje.","Ecoutez mes avertissements, voici : je répandrai sur vous mon Esprit et je vous ferai connaître mes paroles."
PRO.1.24,"But since you refuse to listen when I call and no one pays attention when I stretch out my hand,","Ko nabahamagaye, namwe mukanka; Nkabākura, ntihagire ūbibabara;","J’ai appelé et vous m’avez résisté, j’ai tendu la main et personne n’y a prêté attention."
PRO.1.25,"since you disregard all my advice and do not accept my rebuke,","Mukagaya inama zanje zose, Mukanka kwihanikiriza kwanje:",Vous avez rejeté tous mes conseils et vous n’avez pas voulu de mes avertissements.
PRO.1.26,I in turn will laugh when disaster strikes you; I will mock when calamity overtakes you—,"Nuko nanje nzobatwengera mw ijigo mu gihe c’ivyago vyanyu; Nzobitamba ku muvyimba, agatengo kabafashe;","C’est pourquoi, lorsque le malheur fondra sur vous, je rirai, quand la terreur vous saisira, je me moquerai."
PRO.1.27,"when calamity overtakes you like a storm, when disaster sweeps over you like a whirlwind, when distress and trouble overwhelm you.","Agatengo kanyu kabafashe nk’igihuhuta, Ivyago vyanyu bibazingazinze nk’agashururu, Guhagarika umutima n’ubusinzikare bibashikiriye.","Quand l’épouvante, comme une tempête, viendra sur vous, que le malheur fondra sur vous comme un ouragan, et que la détresse et l’angoisse vous assailliront,"
PRO.1.28,"“Then they will call to me but I will not answer; they will look for me but will not find me,","Ni ho bazontakambira, ariko sinzobishura; Bazondondera ubudahumeka, ariko ntibazombona:","alors ils m’appelleront, mais je ne répondrai pas. Ils me chercheront, mais ne me trouveront pas ."
PRO.1.29,since they hated knowledge and did not choose to fear the Lord .,"Nuko kuko bagiriye urwanko ubgenge, Ntibahitemwo kwubaha Uhoraho;","Puisqu’ils ont détesté la connaissance et qu’ils n’ont pas choisi de craindre l’Eternel,"
PRO.1.30,"Since they would not accept my advice and spurned my rebuke,","Bakanka inama zanje, Bagakēngēra ukwihanikiriza kwanje kwose;","qu’ils n’ont pas voulu de mes conseils et qu’ils ont dédaigné tous mes avertissements,"
PRO.1.31,they will eat the fruit of their ways and be filled with the fruit of their schemes.,"Ni co gituma bazorya ku vy’ inzira zabo zāmuje, Bazohāga akazīkira kabo ubgabo.","eh bien, ils récolteront les fruits de leur conduite et ils se repaîtront jusqu’à ce qu’ils en aient plus qu’assez de leurs propres projets."
PRO.1.32,"For the waywardness of the simple will kill them, and the complacency of fools will destroy them;","Gukomantaza imitima kw’ imburabgenge kuzozica, Kand’ ukugubga neza kw’ibipfu kuzobihonnya.","Car la présomption des gens inexpérimentés causera leur mort, et l’assurance des insensés les perdra."
PRO.1.33,"but whoever listens to me will live in safety and be at ease, without fear of harm.”","Arik’ ūntega ugutwi wese azoba amahoro, Azokwama atekereje ata kibi atinya.","Mais celui qui m’écoute habitera en sécurité, il vivra tranquille, sans avoir à redouter le malheur."
PRO.2.1,"My son, if you accept my words and store up my commands within you,","Mwana wanje, ni wemera amajambo yanje, Ukabīka amabgirizwa yanje muri wewe,","Mon fils, si tu acceptes mes paroles, si tu conserves mes préceptes au fond de toi-même,"
PRO.2.2,turning your ear to wisdom and applying your heart to understanding—,"Bigatuma utega ugutwi ubgenge, Ugashira umutima ku gutahura;","si tu prêtes une oreille attentive à la sagesse, en inclinant ton cœur vers l’intelligence,"
PRO.2.3,"indeed, if you call out for insight and cry aloud for understanding,","Mbere ni wahamagara ubgenge, Ugashira ijwi hejuru uririra ugutahura;","oui, si tu fais appel au discernement, si tu recherches l’intelligence,"
PRO.2.4,"and if you look for it as for silver and search for it as for hidden treasure,","Ni waburondera nk’ifeza, Ukabusesangura nk’ūrondera izahabu zanyegejwe;","si tu la recherches comme de l’argent, si tu creuses pour la trouver comme pour découvrir des trésors ,"
PRO.2.5,then you will understand the fear of the Lord and find the knowledge of God.,"Ni ho uzotahura ukwubaha Uhoraho ukw ari kwo, Ukaronka ukumenya Imana.","alors tu comprendras ce qu’est craindre l’Eternel, et tu apprendras à connaître Dieu."
PRO.2.6,For the Lord gives wisdom; from his mouth come knowledge and understanding.,"Kuk’ Uhoraho atanga ubgenge, Mu kanwa kiwe havamw’ ukumenya n’ugutahura.","Car l’Eternel donne la sagesse, et ce sont ses paroles qui procurent la connaissance et l’intelligence."
PRO.2.7,"He holds success in store for the upright, he is a shield to those whose walk is blameless,","Abīkira abagororotsi ubgenge buroranye, Ni we nkinzo y’abagenda batunganye.","Il réserve son secours aux hommes droits. Comme un bouclier, il protège ceux qui vivent de manière intègre."
PRO.2.8,for he guards the course of the just and protects the way of his faithful ones.,"Kugira ngw arinde inzira z’ imanza ziroranye, Kand’ azigame urugendo rw’ abayoboke biwe.",Il préserve ceux qui vivent selon la droiture. Il veille sur le cheminement de ceux qui lui sont fidèles.
PRO.2.9,Then you will understand what is right and just and fair—every good path.,"Ni ho uzotahura ubugororotsi n’imanza ziroranye, N’ibitunganye, mbere n’inzira nziza yose.","Alors tu apprendras à discerner ce qui est juste, conforme au droit, à vivre selon la droiture, et à reconnaître tous les sentiers du bien."
PRO.2.10,"For wisdom will enter your heart, and knowledge will be pleasant to your soul.","Kuk’ ubgenge buzokwinjira mu mutima wawe, Kand’ ukumenya kuzohimbara ubugingo bgawe.",Alors la sagesse pénétrera dans ton cœur et la connaissance fera tes délices.
PRO.2.11,"Discretion will protect you, and understanding will guard you.","Amakenga azogushibamira, Ugutahura kuzokuzigama,",La réflexion sera ta sauvegarde et l’intelligence veillera sur toi
PRO.2.12,"Wisdom will save you from the ways of wicked men, from men whose words are perverse,","Ngo bigukize inzira y’ikibi, N’abantu badadika,","pour te préserver de la mauvaise voie et des hommes qui tiennent des propos fourbes,"
PRO.2.13,"who have left the straight paths to walk in dark ways,","Bata inzira zo kugororoka, Ngo bagendere mu nzira z’ umwiza;","de ceux qui abandonnent le droit chemin pour s’engager dans des sentiers obscurs,"
PRO.2.14,"who delight in doing wrong and rejoice in the perverseness of evil,","Banezererwa gukora ikibi, Bahimbarwa n’ibidadi vy’ikibi;","qui prennent plaisir à faire le mal, qui sont tout contents de s’enfoncer dans la perversité,"
PRO.2.15,whose paths are crooked and who are devious in their ways.,"Inzira zabo ziragoramanze, N’ingendo zabo n’izinguzingu.",dont les chemins sont tortueux et le comportement pervers.
PRO.2.16,"Wisdom will save you also from the adulterous woman, from the wayward woman with her seductive words,","Kandi ngo bigukize umugore w’icigenze, Mber’ igukize umunyamahangakazi ahemanisha amagambo yiwe,","Alors tu seras aussi préservé de la femme d’autrui, de l’inconnue aux paroles enjôleuses,"
PRO.2.17,who has left the partner of her youth and ignored the covenant she made before God.,"Yataye umukunzi wo mu buto bgiwe, Yibagiye isezerano ry’Imana yiwe:",qui abandonne l’époux de sa jeunesse et qui a oublié l’alliance conclue au nom de son Dieu .
PRO.2.18,Surely her house leads down to death and her paths to the spirits of the dead.,"Kukw inzu yiwe ihengamiye mu rupfu, Kand’ inzira ziwe zija mu bāpfuye.","Elle sombre vers la mort qui est sa demeure , et sa conduite mène au séjour des trépassés ;"
PRO.2.19,None who go to her return or attain the paths of life.,"Abaja i we nta ho bagaruka ukundi, Kandi ntibashikīra inzira z’ ubugingo.","aucun de ceux qui vont chez elle n’en revient, aucun ne retrouve les chemins de la vie."
PRO.2.20,Thus you will walk in the ways of the good and keep to the paths of the righteous.,"Ni ho uzogendera mu nzira y’abagira neza, Ukitondera inzira z’abagororotsi.","Si tu écoutes mes conseils, tu marcheras sur le chemin des hommes de bien et tu suivras les sentiers des justes."
PRO.2.21,"For the upright will live in the land, and the blameless will remain in it;","Kukw abagororotsi bazokwībēra mu gihugu, Kand’ abatunganye bazokwamayo.","Car les hommes droits habiteront le pays , et ceux qui sont intègres s’y maintiendront,"
PRO.2.22,"but the wicked will be cut off from the land, and the unfaithful will be torn from it.","Arikw abanyavyaha bazokomborwa mu gihugu, Kand’ abaguranyi bazorandurwa muri co.","mais les méchants en seront extirpés, et les traîtres en seront arrachés."
PRO.3.1,"My son, do not forget my teaching, but keep my commands in your heart,","Mwana wanje, ntuze wibagire ukwigisha kwanje, Arik’ umutima wawe witondere amabgirizwa yanje:","Mon fils, n’oublie pas l’éducation que je t’ai donnée et que ton cœur retienne mes préceptes,"
PRO.3.2,for they will prolong your life many years and bring you peace and prosperity.,"Kuko bizokwongerakw imisi myinshi, N’imyaka yo kuramvya ubugingo, n’amahoro.",car ils rallongeront tes jours et ajouteront des années à la durée de ta vie et t’assureront le bonheur.
PRO.3.3,"Let love and faithfulness never leave you; bind them around your neck, write them on the tablet of your heart.","Ubuntu n’ukuri ntibikuveko, Ubipfundike mw izosi ryawe, uvyandike ku gisate, ni co mutima wawe:","Que l’amour et la fidélité ne te fassent jamais défaut ; attache-les autour de ton cou, grave-les sur les tablettes de ton cœur,"
PRO.3.4,Then you will win favor and a good name in the sight of God and man.,"Ni ho uzobona gushimwa, bo n’ubgenge bushitse, Mu maso y’Imana n’abantu.","et tu obtiendras la faveur de Dieu et des hommes, tu auras la réputation d’être un homme de bon sens."
PRO.3.5,Trust in the Lord with all your heart and lean not on your own understanding;,"Wizigize Uhoraho umutima wawe wose, Kandi ntiwishimikize ubgenge bg’iwawe:","Mets ta confiance en l’Eternel de tout ton cœur, et ne te repose pas sur ta propre intelligence."
PRO.3.6,"in all your ways submit to him, and he will make your paths straight.","Umumenye mu ngendo zawe zose, Na we azogorora inzira zawe.","Tiens compte de lui pour tout ce que tu entreprends, et il te conduira sur le droit chemin."
PRO.3.7,Do not be wise in your own eyes; fear the Lord and shun evil.,"Ntukiyite umunyabgenge wewe ubgawe; Utinye Uhoraho, uve mu bibi:","Ne te prends pas pour un sage, crains l’Eternel et détourne-toi du mal ."
PRO.3.8,This will bring health to your body and nourishment to your bones.,"Ivyo bizogutera kunonoka mu mubiri, No kugira umusokōro mu magufa yawe.",Ce sera une bonne médecine qui t’assurera la santé du corps et la vitalité de tout ton être.
PRO.3.9,"Honor the Lord with your wealth, with the firstfruits of all your crops;","Wubahishe Uhoraho ibintu vyawe, Bo n’umushuzo w’ivyeze vyawe vyose.",Honore l’Eternel en lui donnant une part de tes biens et en lui offrant les prémices de tous tes revenus.
PRO.3.10,"then your barns will be filled to overflowing, and your vats will brim over with new wine.","Ni ho ibigega vyawe bizokwuzura vyongerekane, Kandi n’amato yawe azosēsekara imitobe.",Alors tes greniers regorgeront de nourriture et tes cuves déborderont de vin.
PRO.3.11,"My son, do not despise the Lord ’s discipline, and do not resent his rebuke,","Mwana wanje, ntugaye igikāngīro c’Uhoraho, Kandi nturambirwe n’uguhana kwiwe:","Mon fils, si l’Eternel te corrige, n’en fais pas fi, s’il te reprend, ne t’impatiente pas ,"
PRO.3.12,"because the Lord disciplines those he loves, as a father the son he delights in.","Kuk’ uwo Uhoraho akunda ari we ahana, Nk’uko se w’umwana nyene ahana umwana wiwe anezererwa.","car c’est celui qu’il aime que l’Eternel reprend, agissant avec lui comme un père avec l’enfant qu’il chérit."
PRO.3.13,"Blessed are those who find wisdom, those who gain understanding,","Hahirwa umuntu yironkera ubgenge, N’umuntu aronse ugutahura.",Heureux l’homme qui a trouvé la sagesse ! Heureux celui qui acquiert l’intelligence !
PRO.3.14,for she is more profitable than silver and yields better returns than gold.,"Kukw inyungu zabgo ziruta iz’ ifeza, Kand’ ivyo bgunguka biruta izahabu zitarimw’ inkamba.",Acquérir la sagesse vaut mieux que gagner beaucoup d’argent. Les avantages qu’elle donne sont plus précieux que l’or le plus fin.
PRO.3.15,She is more precious than rubies; nothing you desire can compare with her.,Burusha igiciro utubuyenge twitwa marijani: Kandi mu bihimbara vyose nta kintu gihwanye na bgo.,"Elle a plus de prix que les perles, et aucun trésor que tu pourrais désirer n’égale sa valeur ."
PRO.3.16,Long life is in her right hand; in her left hand are riches and honor.,"Ukuramba kuri mu kuboko kwabgo kw’i buryo, Mu kubamfu kwabgo harimw’ ubutunzi n’icubahiro.","La sagesse t’offre, dans sa main droite, une longue vie, et dans sa main gauche, la richesse et la considération."
PRO.3.17,"Her ways are pleasant ways, and all her paths are peace.","Amayira yabgo n’amayira y’ igikundiro, Kand’ inzira zabgo zose n’iz’ amahoro.","Les voies dans lesquelles elle conduit sont agréables, tous ses chemins convergent vers le bonheur."
PRO.3.18,She is a tree of life to those who take hold of her; those who hold her fast will be blessed.,Bubera igiti c’ubugingo ababucakira: Hahirwa umuntu wese abgumirako.,"La sagesse est un arbre de vie pour ceux qui s’attachent à elle, et ceux qui savent la garder sont heureux ."
PRO.3.19,"By wisdom the Lord laid the earth’s foundations, by understanding he set the heavens in place;",Uhoraho yashirishijeho isi ubgenge; Ugutahura ni kwo yagumishije ijuru.,"C’est avec la sagesse que l’Eternel a fondé la terre, et avec l’intelligence qu’il a disposé le ciel."
PRO.3.20,"by his knowledge the watery depths were divided, and the clouds let drop the dew.","Ukumenya kwiwe ni kwo kwatumye amasōko y’i kuzimu atoboka, N’ibipfungu bigatonyanga ikime.","Par sa science, il a fait jaillir l’eau des sources et ordonné aux nuages de répandre la rosée."
PRO.3.21,"My son, do not let wisdom and understanding out of your sight, preserve sound judgment and discretion;","Mwana wanje, ivyo ntibikave imbere y’amaso yawe: Ugumye ubgenge buroranye n’amakenga;","Mon fils, garde les yeux fixés sur la sagesse et la réflexion, retiens-les,"
PRO.3.22,"they will be life for you, an ornament to grace your neck.","Ni ho bizobera umutima wawe ubugingo, N’izosi ryawe ugushaza.","car elles t’apporteront la vie, elles seront une parure pour ton cou."
PRO.3.23,"Then you will go on your way in safety, and your foot will not stumble.","Ni ho uzogenda mu nzira yawe ata nkomanzi, Kandi ntuzotsitara ikirenge cawe.","Alors tu iras ton chemin en toute sécurité, sans trébucher."
PRO.3.24,"When you lie down, you will not be afraid; when you lie down, your sleep will be sweet.","Ni waryama ntuzogira ubgoba, Mber’ uzoryama, ugire itiro riryoshe.","Quand tu te coucheras, tu n’éprouveras aucune crainte, et ton sommeil sera paisible,"
PRO.3.25,"Have no fear of sudden disaster or of the ruin that overtakes the wicked,","Ntuzotinya ubgoba bga giturumbuka, Cank’ ukuzingazingwa kw’ abanyavyaha ni kwashika:","tu n’auras pas à redouter un désastre imprévu, ni la ruine qui ne manquera pas de fondre sur les méchants ;"
PRO.3.26,for the Lord will be at your side and will keep your foot from being snared.,"Kuk’ Uhoraho azokubera ivyizigiro, Kand’ azorinda ikirenge cawe ngo ntigifatwe.","car l’Eternel sera ton assurance, il gardera ton pied de tout piège."
PRO.3.27,"Do not withhold good from those to whom it is due, when it is in your power to act.","Ntukanke kugirira ivyiza ababibereye, Ugifise uburyo bgo kubikora.","Si tu en as le moyen, ne refuse pas de faire du bien à celui qui est dans le besoin,"
PRO.3.28,"Do not say to your neighbor, “Come back tomorrow and I’ll give it to you”— when you already have it with you.","Ntukabgire mugenzawe, uti Genda, uz’ugaruke, Ejo nzoguha; Kand’ ubifise ngaho.","ne dis pas à ton prochain : « Va-t’en et reviens plus tard, demain je te donnerai », alors que tu peux le faire tout de suite."
PRO.3.29,"Do not plot harm against your neighbor, who lives trustfully near you.","Ntukīgīre imigabo yo kugirira nabi mugenzawe, Kand’ abana nawe amahoro.","Ne manigance rien de mal contre ton prochain, alors qu’il vit sans défiance près de toi."
PRO.3.30,Do not accuse anyone for no reason— when they have done you no harm.,"Ntukarwane n’umuntu ata nyanduruko, Iy’ ata kibi yakugiriye.",Ne cherche pas querelle à quelqu’un sans raison alors qu’il ne t’a fait aucun mal.
PRO.3.31,Do not envy the violent or choose any of their ways.,"Ntukagirire ishari umuntu w’ikirara, Ntugatore inzira yiwe n’imwe.","N’envie pas les violents et n’adopte aucun de leurs procédés,"
PRO.3.32,For the Lord detests the perverse but takes the upright into his confidence.,"Kukw ikidambidambi n’igisesema k’Uhoraho, Arikw abagororotsi bo, asangiye ibanga na bo.","car l’Eternel a en horreur les gens pervers, mais il réserve son intimité aux hommes droits."
PRO.3.33,"The Lord ’s curse is on the house of the wicked, but he blesses the home of the righteous.","Umuvumo w’Uhoraho uri mu nzu y’abanyavyaha, Arikw ahezagira ingo z’abagororotsi.","La malédiction de l’Eternel pèse sur la maison du méchant, mais il bénit la demeure des justes."
PRO.3.34,He mocks proud mockers but shows favor to the humble and oppressed.,"N’ukuri yitamba ku muvyimba abacokoranyi, Arikw agirira ubuntu abicisha bugufi.","Il se moque des moqueurs, mais il accorde sa faveur aux humbles ."
PRO.3.35,"The wise inherit honor, but fools get only shame.","Abanyabgenge bazoragwa icubahiro, Arikw isoni ni zo zizoba umugabane w’ibipfu.","L’honneur sera la part des sages, mais les insensés porteront la honte."
PRO.4.1,"Listen, my sons, to a father’s instruction; pay attention and gain understanding.","Yemwe bana, ni mwumve ukwigisha kwa so, Mushire imitima ku kumenya uburyo bgo gutahura:","Ecoutez, mes fils, l’instruction d’un père, soyez attentifs pour acquérir du discernement."
PRO.4.2,"I give you sound learning, so do not forsake my teaching.",Kuko mbahaye inyigisho nziza; Ntimukave mw ibgirizwa ryanje.,"Car c’est un bon enseignement que je vous donne. N’abandonnez pas l’éducation que je vous ai donnée,"
PRO.4.3,"For I too was a son to my father, still tender, and cherished by my mother.","Kuko nanje nabereye data umwana nya mwana, Nabungabungwa ndi nk’ikinege mu maso ya mama.","car j’ai été, moi aussi, un fils pour mon père, et ma mère me chérissait comme un enfant unique."
PRO.4.4,"Then he taught me, and he said to me, “Take hold of my words with all your heart; keep my commands, and you will live.","Kandi data yaranyigishije, arambarira, At’ Umutima wawe ugumye amajambo yanje; Witondere amabgirizwa yanje, ubone kubaho:","Mon père m’a enseigné et m’a dit : « Que ton cœur retienne mes paroles, suis mes préceptes, et tu vivras."
