,0,1,2
SNG.1.1,Solomon’s Song of Songs.,"Indirimbo y’agaheta, ya Salomo.","Le plus beau des chants, composé par Salomon ."
SNG.1.2,Let him kiss me with the kisses of his mouth— for your love is more delightful than wine.,N’unsomeshe ugusomana kw’ akanwa kawe: Kuk’ urukundo rwawe ari rwiza kurusha vino.,"« Ah ! que ta bouche ╵me couvre de baisers, car ton amour ╵est plus exaltant que le vin."
SNG.1.3,Pleasing is the fragrance of your perfumes; your name is like perfume poured out. No wonder the young women love you!,"Amavuta yawe aratāmirana cane, Izina ryawe rimeze nk’amavuta asutswe; Ni co gituma inkumi zigukunda.","Combien suaves ╵sont tes parfums, ton nom est comparable ╵à une huile odorante ╵qui se répand. Voilà pourquoi ╵les jeunes filles ╵sont éprises de toi."
SNG.1.4,Take me away with you—let us hurry! Let the king bring me into his chambers. We rejoice and delight in you ; we will praise your love more than wine. How right they are to adore you!,"Mfata nkuje inyuma, twiruke. Umwami yanshikanye i kare: Tuzonezerwa, nawe uzoduhimbara. Tuzokwamamaza urukundo rwawe kurusha uko twokwamamaza vino: Urukundo bagukunda rurakubereye.","Entraîne-moi derrière toi ! ╵Courons ensemble ! » « Le roi m’a fait entrer ╵dans ses appartements. » « Réjouissons-nous, ╵soyons dans l’allégresse ╵à ton sujet ! Célébrons ton amour ╵plus exaltant que le bon vin ! C’est bien avec raison ╵qu’on est épris de toi. »"
SNG.1.5,"Dark am I, yet lovely, daughters of Jerusalem, dark like the tents of Kedar, like the tent curtains of Solomon.","Ndirabura, ariko ndi mwiza, Mwa bakobga b’i Yerusalemu; Mmeze nk’amahema y’i Kedari, Nk’imikingo ya Salomo.","« O filles de Jérusalem , ╵je suis noiraude, ╵et pourtant, je suis belle, pareille aux tentes de Qédar , ╵aux tentures de Salomon."
SNG.1.6,"Do not stare at me because I am dark, because I am darkened by the sun. My mother’s sons were angry with me and made me take care of the vineyards; my own vineyard I had to neglect.","Ntimumpange amaso, kuko nirabura, Kukw izuba ari ryo ryanyirabuje. Abahungu ba mama bārandakiye, Banzigamishije imirima y’imizabibu, Arik’ urwanje ruzabibu sinaruzigamye.","Ne vous étonnez pas ╵si je suis bien brunie : le soleil m’a hâlée, car les fils de ma mère, ╵irrités contre moi, m’ont fait garder les vignes, oui, mais ma vigne à moi, ╵je ne l’ai pas gardée."
SNG.1.7,"Tell me, you whom I love, where you graze your flock and where you rest your sheep at midday. Why should I be like a veiled woman beside the flocks of your friends?","Yewe, uwo umutima wanje ukunda, umbarire Ah’ uragira ah’ ari ho, N’ah’ uvyagiza mu mahodoka: None n’iki cotuma ngenda nk’uwitwikiriye mu maso, Nca i ruhande y’imikuku ya bagenzi bawe?","O toi que mon cœur aime, dis-moi où tu fais paître ╵ton troupeau de brebis, où tu le feras reposer ╵à l’heure de midi, pour que je ne sois pas ╵comme une femme errante , rôdant près des troupeaux ╵que gardent tes compagnons. »"
SNG.1.8,"If you do not know, most beautiful of women, follow the tracks of the sheep and graze your young goats by the tents of the shepherds.","Asangw’ utahazi, yewe urusha abandi bagore akaranga, Jana inzira y’ibitungwa, Uragire imyagazi y’impene yawe i ruhande y’insago z’abungere.","« Si tu ne le sais pas, ╵ô toi, la plus belle des femmes, va donc suivre les traces ╵du troupeau de brebis, fais paître tes chevrettes ╵près des huttes des pâtres. »"
SNG.1.9,"I liken you, my darling, to a mare among Pharaoh’s chariot horses.","Ewe mukunzi wanje, nakugereranije N’ifarasi yo mu zikwega imikogote ya Farawo.","« O mon amie, ╵je te trouve pareille à une jument d’attelage ╵du pharaon ."
SNG.1.10,"Your cheeks are beautiful with earrings, your neck with strings of jewels.","Imisaya yawe itewe gushaza n’ibitsibo vy’umushatsi wawe, N’izosi ryawe rishazishijwe n’utugenegene tw’igiciro kinini.","Tes joues sont belles ╵entre les perles, ton cou est beau ╵dans tes colliers ;"
SNG.1.11,"We will make you earrings of gold, studded with silver.","Tuzogutsibira ibitsibo vy’izahabu, Birimw’ intabonwa z’ifeza.",nous te ferons ╵des perles d’or tout incrustées ╵de points d’argent. »
SNG.1.12,"While the king was at his table, my perfume spread its fragrance.","Umwami akivyagiye, ari ku meza yiwe, Amavuta yanje yatanguye gutāmirana.","« Jusqu’à ce que le roi ╵parvienne à son enclos , mon nard exhale son parfum."
SNG.1.13,My beloved is to me a sachet of myrrh resting between my breasts.,Umukunzi wanje ammereye nk’itu ry’isenga Riri hagati y’amabere yanje.,"Car mon bien-aimé est pour moi ╵comme un sachet de myrrhe , entre mes seins ╵il passera la nuit."
SNG.1.14,My beloved is to me a cluster of henna blossoms from the vineyards of En Gedi.,Umukunzi wanje ammereye nk’agati kitwa koferu gashuritse udushurwe tw’uturundo Kaba mu nzabibu zo muri Eni‐gedi.,"Oui, mon bien-aimé est pour moi ╵un bouquet de henné des vignes d’Eyn-Guédi . »"
SNG.1.15,"How beautiful you are, my darling! Oh, how beautiful! Your eyes are doves.","Ereg’ uri mwiza, mukunzi wanje, n’ukuri uri mwiza pe; Amaso yawe asa n’inuma.","« Que tu es belle, ╵ma bien-aimée, ╵que tu es belle ! Tes yeux ressemblent ╵à des colombes. »"
SNG.1.16,"How handsome you are, my beloved! Oh, how charming! And our bed is verdant.","Ereg’ uri mwiza, mukunzi wanje, mber’ urahimbaye; Ikirwa cacu kigaranzuyek’ ubusaswa busha.","« Que tu es beau, mon bien-aimé, ╵tu es superbe ! Dans la verdure est notre lit."
SNG.1.17,The beams of our house are cedars; our rafters are firs.,"Imitambikwa y’ingoro yacu n’ibiti vy’amasederi, Ibishoro vyayo n’imiberoshi.","Les solives de nos maisons, ╵ce sont les cèdres, et les cyprès sont nos lambris. »"
SNG.2.1,"I am a rose of Sharon, a lily of the valleys.","Nd’ ishurwe rya habaseleti ry’i Sharoni, Ikirungu co mu biyaya.","« Moi, je suis une fleur ╵qui pousse dans la plaine du Saron , un lis de la vallée. »"
SNG.2.2,Like a lily among thorns is my darling among the young women.,Nk’ikirungu mu mahwa Ni k’umukunzi wanje ameze mu bandi bakobga.,"« Oui, comme un lis ╵parmi des ronces est mon amie ╵parmi les filles. »"
SNG.2.3,"Like an apple tree among the trees of the forest is my beloved among the young men. I delight to sit in his shade, and his fruit is sweet to my taste.","Nk’igiti c’icungwa mu bindi biti vyo mw ishamba Ni k’umukunzi wanje ameze mu bandi basore. Mpimbarwa no kwicara mu gitūtu ciwe, Amacungwa yiwe aransosera.","« Comme un pommier ╵parmi les arbres ╵de la forêt tel est mon bien-aimé ╵parmi les jeunes gens, j’ai grand plaisir ╵à m’asseoir à son ombre. Combien son fruit est doux ╵à mon palais."
SNG.2.4,"Let him lead me to the banquet hall, and let his banner over me be love.","Yanjanye mu nzu y’amazimano, Ibendera yiwe yari hejuru yanje yar’ iy’ urukundo.","Il m’a conduite ╵dans la maison du vin et il a déployé sur moi, ╵l’étendard de l’amour."
SNG.2.5,"Strengthen me with raisins, refresh me with apples, for I am faint with love.","Ni mumpēmbūze udutore tw’ inzabibu, mundabūze amacungwa, Kuk’ urukundo runshābije.","Restaurez-moi ╵avec des gâteaux de raisins, soutenez-moi ╵avec des pommes, car je suis malade d’amour."
SNG.2.6,"His left arm is under my head, and his right arm embraces me.","Ukuboko kwiwe kw’ukubamfu kuranseguye, Ukuboko kwiwe kw’ukuryo kurampfumbatiye.","Son bras gauche soutient ma tête, et son bras droit m’enlace."
SNG.2.7,"Daughters of Jerusalem, I charge you by the gazelles and by the does of the field: Do not arouse or awaken love until it so desires.","Ndabihanikirije, mwa bakobga b’i Yerusalemu mwe, Nk’uko bagenza ku ngeregere no ku mpongokazi vyo mw ishamba, Ntimunkomere umukunzi, ntimumukangure, Gushitsa ah’ avyigombeye.","O filles de Jérusalem, ╵oh, je vous en conjure par les gazelles ╵ou par les biches ╵de la campagne : n’éveillez pas, ╵non, ne réveillez pas l’amour avant qu’il ne le veuille ."
SNG.2.8,"Listen! My beloved! Look! Here he comes, leaping across the mountains, bounding over the hills.","Ijwi ry’umukunzi wanje! Eh’ araje, Yikina amatavu ku misozi, Akinagira ku turambi.","J’entends mon bien-aimé, oui, le voici, il vient, sautant sur les montagnes et bondissant sur les collines."
SNG.2.9,"My beloved is like a gazelle or a young stag. Look! There he stands behind our wall, gazing through the windows, peering through the lattice.","Umukunzi wanje ameze nk’ ingeregere canke nk’umukangara w’impongo: Eh’ ahagaze inyuma y’inzu yacu, Arungurukira mu madirisha, Yiyerekanira mu nshingo zayo.","Mon bien-aimé ressemble ╵à la gazelle ou à un jeune cerf. Le voici : il est là, ╵derrière notre mur, guettant par les fenêtres et lançant des regards ╵à travers les treillis."
SNG.2.10,"My beloved spoke and said to me, “Arise, my darling, my beautiful one, come with me.","Umukunzi wanje aravuga, arambariye, Ati Va hasi, mukunzi wanje, mwiza wanje, ngwino tugende:","Mon bien-aimé me parle, et il me dit : “Lève-toi, mon amie, ╵viens donc, ma belle,"
SNG.2.11,See! The winter is past; the rains are over and gone.,"Kuko rāba, urushana rurashize, Imvura iragiye, iracitse;","car l’hiver est passé et les pluies ont cessé, ╵leur saison est finie."
SNG.2.12,"Flowers appear on the earth; the season of singing has come, the cooing of doves is heard in our land.","Amashurwe aratanguye gushurika ku misozi, Igihe co kujwiragira kw’ inyoni kirashitse, Ijwi ry’intunguru rirumvikanye mu gihugu cacu;","On voit des fleurs éclore ╵à travers le pays, et le temps de chanter ╵est revenu. La voix des tourterelles ╵retentit dans nos champs."
SNG.2.13,"The fig tree forms its early fruit; the blossoming vines spread their fragrance. Arise, come, my darling; my beautiful one, come with me.”","Insukoni z’ibitumbge ziratanguye guhishira ku musukoni wazo, Imizabibu irashuritse, Imota ubumote bgayo bgiza. Va hasi, mukunzi wanje, mwiza wanje, ngwino tugende.","Sur les figuiers, ╵les premiers fruits mûrissent . La vigne en fleur ╵exhale son parfum . Lève-toi, mon amie, ╵et viens, ╵oui, viens, ma belle.”"
SNG.2.14,"My dove in the clefts of the rock, in the hiding places on the mountainside, show me your face, let me hear your voice; for your voice is sweet, and your face is lovely.","Ewe inanuma wanje, uba mu gihoro co mu gitandara no mw isenga ryo ku gatembge, Reka ndābe mu maso hawe, numve n’ijwi ryawe; Kukw ijwi ryawe ari ryiza, n’uburanga bgawe bukaba buhebuje.","Ma colombe nichée ╵aux fentes du rocher, cachée au plus secret ╵des parois escarpées, fais-moi voir ton visage et entendre ta voix, car ta voix est bien douce ╵et ton visage est beau."
SNG.2.15,"Catch for us the foxes, the little foxes that ruin the vineyards, our vineyards that are in bloom.","Ni mudufatire imbgebge, twa tubgebge duto‐duto twonona imirima y’imizabibu, Kukw imizabibu yacu ishuritse.","Prenez-nous les renards , oui, les petits renards ╵qui ravagent nos vignes quand elles sont en fleur."
SNG.2.16,My beloved is mine and I am his; he browses among the lilies.,"Umukunzi wanje n’uwanje nanje nd’uwiwe, Aragira mu birungu.","Mon bien-aimé, il est à moi, ╵et moi, je suis à lui, il paît parmi les lis ."
SNG.2.17,"Until the day breaks and the shadows flee, turn, my beloved, and be like a gazelle or like a young stag on the rugged hills.","Garuka, mukunzi wanje, umere nk’ingeregere canke nk’umukangara w’impongo Wo ku misozi y’i Beteri, Igihe ca ni musi kitarashika, ibitūtu vyo ku kirengazuba bitarazimangana.","Et quand viendra la brise à la tombée du jour, et quand s’estomperont les ombres, reviens, ô toi mon bien-aimé, pareil à la gazelle ╵ou à un jeune faon sur les monts escarpés ."
SNG.3.1,All night long on my bed I looked for the one my heart loves; I looked for him but did not find him.,"Mw ijoro ndi ku buriri narondeye umugabo umutima wanje ukunda: Ndamurondera, ndamubura.","Sur mon lit, au long de la nuit, j’ai recherché ╵celui que mon cœur aime. Je l’ai cherché, ╵mais ne l’ai pas trouvé."
SNG.3.2,"I will get up now and go about the city, through its streets and squares; I will search for the one my heart loves. So I looked for him but did not find him.","Ndavuga, nti Hinge mvyuke, ngendagende mu gisagara, Mu nzira no mu hiyaguye haho, Ndondere uwo umutima wanje ukunda: Naramurondeye, ndamubura.","Je me suis dit alors : ╵Il faut que je me lève, je ferai le tour de la ville ╵par les rues et les places, je chercherai partout ╵celui que mon cœur aime. Je l’ai cherché, ╵mais ne l’ai pas trouvé."
SNG.3.3,The watchmen found me as they made their rounds in the city. “Have you seen the one my heart loves?”,"Duhūra n’abashibamyi bagendura igisagara: Ndababaza, nti Mbega mwabonye wa wundi umutima wanje ukunda?","Les gardes m’ont trouvée, ╵ceux qui font le tour de la ville . Je leur ai demandé : ╵Celui que mon cœur aime, ╵ne l’avez-vous pas vu ?"
SNG.3.4,"Scarcely had I passed them when I found the one my heart loves. I held him and would not let him go till I had brought him to my mother’s house, to the room of the one who conceived me.","Mmaze kubarēngāna gato Mbona uwo umutima wanje ukunda; Ndamufata, nanka kumurekura, Kugeza aho namushikanye mu nzu ya mama, Mu nzu y’uwamvyaye.","Les ayant dépassés, peu après, j’ai trouvé ╵celui que mon cœur aime. Je l’ai saisi bien fort, ╵et ne l’ai plus lâché jusqu’à l’avoir conduit ╵au logis de ma mère, dans la chambre de celle ╵qui m’a conçue."
SNG.3.5,"Daughters of Jerusalem, I charge you by the gazelles and by the does of the field: Do not arouse or awaken love until it so desires.","Ndabihanikirije, mwa bakobga b’i Yerusalemu mwe, Nk’uko bagenza ku ngeregere no ku mpongokazi vyo mw ishamba, Ntimunkomere umukunzi, ntimumukangure, Gushitsa ah’ avyigombeye.","O filles de Jérusalem, ╵oh, je vous en conjure par les gazelles ╵ou par les biches ╵de la campagne : n’éveillez pas, ╵non, ne réveillez pas l’amour avant qu’il ne le veuille . »"
SNG.3.6,"Who is this coming up from the wilderness like a column of smoke, perfumed with myrrh and incense made from all the spices of the merchant?","Uriya ni nde, adūga avuye mu bugaragwa Ameze nk’umwotsi upfunduka nk’inkingi, Atāmirana isenga n’imibavu, N’ibimota neza vyose vy’ ibidandazwa?","« Qui donc est celle-ci ╵qui monte du désert comme un nuage de fumée, aux senteurs de myrrhe et d’encens et de tous parfums exotiques ?"
SNG.3.7,"Look! It is Solomon’s carriage, escorted by sixty warriors, the noblest of Israel,","Erega n’inderuzo ya Salomo: Har’ abahizi mirongwitandatu bayikikije, Bo mu bahizi b’Abisirayeli.","Voici la litière de Salomon escortée de ses soixante guerriers, l’élite des guerriers en Israël."
SNG.3.8,"all of them wearing the sword, all experienced in battle, each with his sword at his side, prepared for the terrors of the night.","Bose bitwaza inkota, kandi n’abahinga bo kurwana: Umuntu wese yambaye inkota kw itako ryiwe, Kubg’ ibiteye ubgoba vyo mw ijoro.","Tous armés de l’épée, exercés au combat, ils ont leur épée au côté pour parer aux terreurs nocturnes."
SNG.3.9,King Solomon made for himself the carriage; he made it of wood from Lebanon.,"Umwami Salomo yībāzishirije inderuzo y’intebe, Mu biti vy’i Lebanoni.",Le palanquin royal ╵fait sur ordre de Salomon est en bois du Liban.
SNG.3.10,"Its posts he made of silver, its base of gold. Its seat was upholstered with purple, its interior inlaid with love. Daughters of Jerusalem,","Inkingi z’icugamo yazicurishije mw ifeza, N’icegamo mw izahabu. Icicaro cayo cakoreshejwe impuzu y’agahama, Imbere hashashwe insobane Yajishanywe urukundo n’abakobga b’i Yerusalemu.","Ses colonnes sont en argent, son dossier est en or, son siège est fait en pourpre. Les filles de Jérusalem ont tapissé avec amour ╵tout l’intérieur du palanquin."
SNG.3.11,"come out, and look, you daughters of Zion. Look on King Solomon wearing a crown, the crown with which his mother crowned him on the day of his wedding, the day his heart rejoiced.","Yemwe bakobga b’i Siyoni, ni musohoke murābe umwami Salomo, Afise igitsibo yambitswe na nyina ku musi w’ubukwe bgiwe, Ni wo musi w’umunezero w’umutima wiwe.","O filles de Sion, sortez, ╵contemplez le roi Salomon portant le diadème ╵dont le ceignit sa mère au jour de son mariage, au jour où tout son cœur ╵était rempli de joie. »"
SNG.4.1,"How beautiful you are, my darling! Oh, how beautiful! Your eyes behind your veil are doves. Your hair is like a flock of goats descending from the hills of Gilead.","Ereg’ uri mwiza, mukunzi wanje, n’ukuri uri mwiza pe; Amaso yawe acishirije mu mwitwikiro wawe asa n’ inuma: Umushatsi wawe umeze nk’ umukuku w’impene Zivyagiye ku nkēngēra y’umusozi w’i Gileyadi.","« Que tu es belle, ╵ô mon amie, ╵que tu es belle ! Tes yeux ressemblent ╵à des colombes dessous ton voile, ta chevelure ╵est comme un troupeau de chèvres dévalant le mont Galaad ."
SNG.4.2,"Your teeth are like a flock of sheep just shorn, coming up from the washing. Each has its twin; not one of them is alone.","Amenyo yawe n’akāmenge nk’umukuku w’intama zākemuwe, Zivuye kwuhagirwa, Zifise amahasa zose, Ata n’imwe muri zo yagumbashe.","Tes dents ressemblent ╵à un troupeau de brebis ╵passé aux mains des tondeurs qui reviendrait du lavoir. Chacune d’elles ╵a sa jumelle, aucune n’est solitaire."
SNG.4.3,Your lips are like a scarlet ribbon; your mouth is lovely. Your temples behind your veil are like the halves of a pomegranate.,"Iminwa yawe imeze nk’urunyuzi rusa n’agahama, Kand’ akanwa kawe ni keza. Mu misaya yawe hameze nk’igisate c’ikomamanga, Iboneka mu mwitwikiro wawe.",Voici tes lèvres ╵comme un ruban écarlate ; combien ta bouche est charmante ! Et tes tempes ressemblent ╵à des moitiés de grenades dessous ton voile.
SNG.4.4,"Your neck is like the tower of David, built with courses of stone ; on it hang a thousand shields, all of them shields of warriors.","Izosi ryawe rimeze nk’umunara wa Dawidi Wubakiwe kubīkwamw’ ibirwanishwa, Umanitsemw’ inkinzo igihumbi, Inkinzo zose z’abahizi.","Ton cou ressemble ╵à la tour du roi David, bâtie comme un arsenal : mille rondaches ╵y sont pendues , tous les pavois des héros."
SNG.4.5,"Your breasts are like two fawns, like twin fawns of a gazelle that browse among the lilies.",Amabere yawe yompi ameze nk’ivyagazi bibiri vy’amahasa y’ingeregere Birīsha mu birungu.,"Comme deux faons, ╵jumeaux d’une gazelle, paissant parmi les lis, ╵sont tes deux seins. »"
SNG.4.6,"Until the day breaks and the shadows flee, I will go to the mountain of myrrh and to the hill of incense.","Hinge nīgīre ku musozi ubakw isenga, No ku gasozi kabakw imibavu, Igihe ca ni musi kitarashika, ibitūtu vyo ku kirengazuba bitarazimangana.","« Et quand viendra la brise à la tombée du jour, et quand s’estomperont les ombres, je m’en irai ╵vers la montagne de la myrrhe, vers la colline de l’encens. »"
SNG.4.7,"You are altogether beautiful, my darling; there is no flaw in you.",Uri mwiza bihebuje ga mukunzi wanje; Nta gasembga ufise.,"« Tu es toute jolie, ╵ô mon amie, et sans aucun défaut."
SNG.4.8,"Come with me from Lebanon, my bride, come with me from Lebanon. Descend from the crest of Amana, from the top of Senir, the summit of Hermon, from the lions’ dens and the mountain haunts of leopards.","Ngwino tuvane i Lebanoni, mugeni wanje, Tuvane i Lebanoni. Manuka uve ku mpinga y’ ahitwa Amana, Uve ku mpinga z’i Seniri n’i Herumoni, Uve ku masenga y’intambge, Uve ku misozi ibamw’ ingwe.","Oh, viens du Liban avec moi, ╵ma mariée , oui, viens du Liban avec moi. Veuille descendre du sommet ╵de l’Amana, du sommet du Senir, et de l’Hermon , là où les lions ╵ont leur retraite, et les panthères ╵dans les montagnes."
SNG.4.9,"You have stolen my heart, my sister, my bride; you have stolen my heart with one glance of your eyes, with one jewel of your necklace.","Uhimbaje umutima wanje, mushikanje, mugeni wanje: Uhimbarishije umutima wanje ijisho ryawe, N’umugufu umwe wo mw izosi ryawe.","Tu chamboules mon cœur, ╵ô toi, ma sœur , ╵ma mariée, tu chamboules mon cœur ╵par un seul regard jeté par tes yeux, par un seul des joyaux ╵de tes colliers."
SNG.4.10,"How delightful is your love, my sister, my bride! How much more pleasing is your love than wine, and the fragrance of your perfume more than any spice!","Ewe kuntu urukundo rwawe ari rwiza, mushikanje, mugeni wanje! Urukundo rwawe ukuntu rundutira vino! Gutāmirana kw’amavuta yawe ukuntu kundutira imibavu y’ubgoko bgose!","Ton amour est bien délicieux, ╵ô toi, ma sœur, ╵ma mariée, oui, ton amour ╵est plus exaltant que le vin et la senteur de tes parfums ╵plus que tous les arômes."
SNG.4.11,"Your lips drop sweetness as the honeycomb, my bride; milk and honey are under your tongue. The fragrance of your garments is like the fragrance of Lebanon.","Iminwa yawe, mugeni wanje, itonyanga umutsāma: Ubūki n’amata biri musi y’ururimi rwawe; Gutāmirana kw’impuzu zawe kumeze nk’ugutāmirana kw’i Lebanoni.","Tes lèvres, distillent du miel, ╵ma mariée, du miel, du lait ╵sont sous ta langue, et le parfum ╵de tes habits ╵est tout pareil ╵aux senteurs du Liban."
SNG.4.12,"You are a garden locked up, my sister, my bride; you are a spring enclosed, a sealed fountain.","Ur’ umurima uzitiriwe, mushikanje, mugeni wanje, Ur’ isōko yīmiriwe, iriba rishizwekw ikimenyetso co kuriziririza.","Tu es un jardin clos, ╵ô toi, ma sœur, ╵ma mariée, un jardin clos ╵et une fontaine scellée ."
SNG.4.13,"Your plants are an orchard of pomegranates with choice fruits, with henna and nard,","Iminago yo kuri wewe n’umurima w’amakomamanga, wama ivyiza; Urimwo koferu n’uduti twa narada,","Tes rameaux forment un verger ╵de grenadiers aux fruits exquis, henné et nard l’embaument,"
SNG.4.14,"nard and saffron, calamus and cinnamon, with every kind of incense tree, with myrrh and aloes and all the finest spices.","Narada na karukoma, Imisigati na mudarasini, n’ibiti vyose vy’imibavu, Isenga n’imbazi n’amoko yose y’ibisosa biruta ibindi.","le nard et le safran ╵et la canne odorante, ╵le cinnamome , et toutes sortes ╵de plantes donnant de l’encens, l’aloès ╵et la myrrhe, avec les plus fins aromates."
SNG.4.15,"You are a garden fountain, a well of flowing water streaming down from Lebanon.","Ur’ iriba ryo mu mirima, Ur’isōko y’amazi yiburuka, N’imigezi itemba iva i Lebanoni.","Tu es la source des jardins, un puits d’eaux vives, et d’eaux ruisselant du Liban ."
SNG.4.16,"Awake, north wind, and come, south wind! Blow on my garden, that its fragrance may spread everywhere. Let my beloved come into his garden and taste its choice fruits.","Kanguka, wa muyaga uva i burārūko, nawe uw’ i bumanuko, n’uze; Muhūhe ku murima wanje, kugira ng’ ubutāmirane bgaho bukwire hose. Umukunzi wanje n’aze mu murima wiwe, Arye ivyiza vyiwe vyamye muri wo.","Eveille-toi, brise légère, viens, doux zéphyr, que mon jardin, ╵exhale ses parfums. » « Que mon bien-aimé entre ╵dans son jardin et qu’il en goûte ╵les fruits exquis. »"
SNG.5.1,"I have come into my garden, my sister, my bride; I have gathered my myrrh with my spice. I have eaten my honeycomb and my honey; I have drunk my wine and my milk. Eat, friends, and drink; drink your fill of love.","Ndashitse mu murima wanje, mushikanje, mugeni wanje. Nomoroye isenga yanje ku giti, navuvuye imibavu yanje, Nariye ibinyagu vyanje n’ ubūki bganje, Nanyoye vino yanje n’amata yanje. Ni murye, bagenzi, Ni munywe, mbere ni munywe muhimbishwe n’ urukundo.","« Je viens dans mon jardin, ╵ma sœur, ma mariée, je récolte ma myrrhe, ╵avec mes aromates, je mange mon rayon de miel ╵avec mon miel, je bois mon vin ╵avec mon lait. Mangez, amis, buvez ! Jusqu’à l’ivresse, ╵les amoureux ! »"
SNG.5.2,"I slept but my heart was awake. Listen! My beloved is knocking: “Open to me, my sister, my darling, my dove, my flawless one. My head is drenched with dew, my hair with the dampness of the night.”","Nari nsinziriye, arik’ umutima wanje uri maso: Numva ijwi ry’umukunzi wanje aramutsa, Ati Nyugururira, mushikanje, mukunzi wanje, inanuma wanje, mwiza wanje utagira agasembga; Kuk’ umutwe wanje utonzweko n’urume, N’umushatsi wanje utonzweko n’udutonyanga tw’ ijoro.","« Je m’étais endormie, ╵pourtant mon cœur veillait. J’entends mon bien-aimé frapper : “Ma sœur, mon amie, ouvre-moi, toi, ma colombe, ╵toi, ma parfaite, car j’ai la tête ╵couverte de rosée. Mes boucles sont trempées ╵des gouttes de la nuit.”"
SNG.5.3,I have taken off my robe— must I put it on again? I have washed my feet— must I soil them again?,Nti Ko nambuye umwambaro wanje: nowambara nte? Nkaba niyoze ibirenge: novyanduza nte?,"J’ai ôté ma tunique, ╵comment la remettrais-je ? Et j’ai lavé mes pieds : ╵comment les salirais-je ?"
SNG.5.4,My beloved thrust his hand through the latch-opening; my heart began to pound for him.,"Umukunzi wanje acisha ukuboko mu mwenge w’urugi, Umutima wanje wuzura ikigumbagumba kubgiwe.","Mon bien-aimé avance ╵sa main par l’ouverture, mon ventre en a frémi"
